price,product,product_information,sells,stars
107.00 Dhs,Autre 1PC Women Halter Hollow Out Bandage Elastic Cage Strappy Bra Bustier Bra Open Cup JA30JA10( ),,,
222.00 Dhs,Autre Women Back Criss Cross Sports Bra High Impact Padded Workout Bra Running Fitness Push Up Strappy Gym Bra(Green),,,
230.00 Dhs,Autre Colorvalue Wireless Push Up Sport Bra Women Crisscross Straps Solid Yoga Sports Bra Vest Padded Fitness Athletic Underwear(Black),,,
187.00 Dhs,Autre Cross Straps Sports Bra Fitness Bras Women Cut Out Brassiere Gym Sport Padded Yoga Bras Running Underwear(Black),,,
211.00 Dhs,Autre Push Up Sports Bra Absorb Sweat Sport Bras Women For Running Yoga Vest Sports Tops Gym( ),,,
119.00 Dhs,Autre PlSize S 3XL Women Yoga Sports Bra High Impact Breathable Bra with Removable Pads Workout Tank short Running Sport Bra(White),,,
126.00 Dhs,"Autre Quick Dry Sports Bra,Women Adjustable WirePadded Shakeproof Push Up Seamless Fitness Running Yoga Sports Tops Vest(60016 WHI)",,,
175.00 Dhs,Autre Light Strappy Sports Bra Women Back Cross Seamless Fitness Yoga Bra Padded Sport Brassiere Active Wear(Black),,,
246.00 Dhs,Autre SevencolorSports Bra Pink High Impact 2019 Brassiere Push Up Padded Sport Bras Women Yoga Gym Running Underwear(Purple),,,
216.00 Dhs,Autre Women Seamless Bra Workout Tops Fitness Yoga Bra(Dark Red),,,
285.00 Dhs,"Autre PlSize XL 2XL Sports Bra,Padded WireRacerback Sport Brassiere,Woman High Impact Fitness Yoga Workout Sports Top(1 white 1 black)",,,
129.00 Dhs,Autre 7 Color Fitness Yoga Push Up Sports Bra Women Gym Running Padded Tank Athletic Vest Underwear Shockproof Zipper Sport Bra(gray),,,
128.00 Dhs,"Autre Dyed Zipper Sports Bra, Women Push Up Padded WireShockproof Gym Fitness Athletic Running Yoga Sports Tops 3 Colors(Gray)",,,
120.00 Dhs,Loose All-Match Casual Pants Haren Pants Summer Solid Color Wide Leg Pants-Green,,,
193.00 Dhs,Autre Neon Front Close Sports Bra Fluo Fluro Color Colorful Yoga Gym Jogging Running High Zipper Comfort Comfortable Bra Top(Black),,,
204.00 Dhs - 228.00 Dhs,Autre Seamless Sports Bra flexible Pink Grey Yoga Bra For Women Workout Top(02 leggings),,,
131.00 Dhs,Autre Women Yoga Bra PlSize Patchwork Sports Bra Gym Cross Backless Bra Yoga Padded Mujer Strappy Cropped Fitness(purple),,,
100.00 Dhs,Autre Summer Style Women Cotton Stretch Athletic Vest Gym Fitness Sports Bra no rims Full Cup padded bras colorful plsize tops(gray),,,
121.00 Dhs,Autre Women's High Intensity Zip Sports Bra WireYoga Bras Tank Zip Shakeproof Push Up Stretch Workout Running Bras Vest(Purple),,,
176.00 Dhs,Autre Athletic Running Sports Bra Yoga Brassiere Workout Gym Fitness Women Seamless High Impact Padded Underwear Vest Tanks(Grey),,,
205.00 Dhs,Autre Women's High Impact Workout Racerback WireSports Bra Top(A280-3 Dark Violet),,,
430.00 Dhs,Myprotein LEGGINGS MYPROTEIN POUR FEMME PANTALON JOGGING JOGGER édition limitée,,,
129.00 Dhs,Autre Women Fitness Yoga Sports Bra For Running Gym Sport Bra Padded WireShakeproof Underwear Push Up Front Zipper Sport Bra(Purple),,,
192.00 Dhs,Autre 2019 Sport Bras Padded Push Up Women Breathable Yoga Tops Woman White Jersey Comfortable Fitness Gym Shirt Jogging Running Top(WX 1930-gray),,,
107.00 Dhs,Autre 2019 Summer Fitness Women's Lace Bandage Cutout Lingerie Sports Bras Elastic Bandage Bra Without Chest Pad(7),,,
198.00 Dhs,Autre Seamless sports bra padded yoga bras for women fitness sport bra open back gym workout strappy bra high impact top(6),,,
190.00 Dhs,Autre Women Solid Push up Shockproof Sports Bra Elastic Backless Breathable Quick Dry Full Cup Workout Gym Yoga Tank Top(Navy),,,
237.00 Dhs,Autre Sports Bra Oblique Shoulder Strap Women gym bra Hollow out Back Lines StrenuoExercise fitness bra Tops Female Fitness Top(Red),,,
197.00 Dhs,Autre Sports Bra Zipper Zip Front PlSize 3Xl 4Xl 5Xl Women Adjustable Up Champion High Impact Women'S Padded Black Compression(white),,,
196.00 Dhs,Autre Female Sport Bh Hollow Brassiere Femme Tops Womens Mesh Yoga Gym Sports Bra Woman Fitness Clothing For Women(Blue),,,
207.00 Dhs,Autre Sport Bra Tops for Women Fitness Cleavage Backless Quick Dry Gym Push Up Padded Seamless Sports Bras L(Purple),,,
128.00 Dhs,Autre 4 Colors Women Zipper Push Up Sports Bras Padded WireShockproof Gym Fitness Athletic Running Yoga Vest Sports Tops(Purple),,,
129.00 Dhs,Autre 2019 New Yoga Gym Running Bra Breathable Sport Bra For Fitness Women High Stretch Tank Push Up Vest Underwear Black Yoga Bra(gray),,,
112.00 Dhs,Autre 2019 Sport Bra Women Leopard Print Bra V neck Gather Fitness Tops Summer Bandage Halter Unpadded Bras For Women(Grey),,,
131.00 Dhs,Autre Yoga Bra Women Padded Sports Bra Shake Proof Running Workout Gym Tank Fitness Shirt Vest(Black),,,
164.00 Dhs,Autre Women Sports Bra WireZipper Padded Push Up Shockproof bar Yoga Running Croped Gym Athletic Underwear Girls Fitness Bras(Orange),,,
221.00 Dhs,Autre Fitness Sports Bra Women Gym Yoga Bra Tops Sportswear For Women Sport Push Up Brassiere Workout Fitness Padded Yoga  (Black),,,
185.00 Dhs,Autre Seamless Sports Bra Women Medium Impact Pink Sports Bra With Removable Pad Activewear Pink Wireless Yoga Bra For Small Bust(Black),,,
147.00 Dhs,Autre Women Zipper Push Up Sports Bras Vest Underwear Shockproof Breathable Gym Fitness Athletic Running Yoga Bh Sport Tops(Black),,,
233.00 Dhs,Autre Colorvalue Push Up Plain Sport Bra Women Quick Dry Vest Type Fitness Yoga Bras Padded Workout Gym Sport Brassiere(Maroon),,,
,,,,
,,,,
,,,,
,,,,
,,,,
,,,,
,,,,
,,,,
223.00 Dhs,Autre YOGA Sport Fitness Bra Vest Women Yoga Bra Solid Workout Athletic Underwear(Light Pink05),,,
273.00 Dhs,Autre Sports bra lady New Style Breathable Quick Dry hollow out net yarn bra Bodybuilding Bras 4 way stretch fabric running bras(Mach blue),,,
160.00 Dhs,Autre Cross Back Sports Bra Shockproof Vest Fitness Yoga Bra Cropped with Non removable Chest Pads(Black),,,
131.00 Dhs,Autre Women's Yoga Fitness Bra Front Zipper Padded Wire Comfortable Shockproof Bra Tank Vest for Sports Gym (Green),,,
125.00 Dhs,Autre Women's Sports Yoga Blouse Bra Running Gym Workout Front Zipper Fitness Sports Shirt Women's Yoga Vest Bra(2),,,
99.00 Dhs,Autre White Sports Bra Women Single Layer Seamless Shapewear Fitness Gym sujetador deportivo mujer Running Yoga Bra Sport 2019(White),,,
139.00 Dhs,Autre Women Fitness Sport Bra Sports Bras Yoga Sports Bra for Tops High Elastic Seamless Underwear Vest Tank Large Size S 2XL(Pink),,,
165.00 Dhs,Autre Double Layer Zipper Sports Bra Ladies Fitness Yoga Bra Push Up High Padded Shirt Underwear Running Vest Gym Exercise Sportswear(blue),,,
115.00 Dhs,Autre Sports Bra Patchwork Back Cross Padded Push Up Bra Breathable Seamless Stretch Athletic Gym Vest Women Fitness(Green fruit),,,
198.00 Dhs,Autre Fitness Sports Bra Black Sleevelss Racerback Vest PlSize Yoga Bras for Women Padded Running Tank Tops Gym Shirt  (Gray),,,
103.00 Dhs,Autre Woman Seamless Sports Yoga Bras  Anti sagging Cotton Soft Sports Bra Sleep Bra Sets 2019 Solid(Gray),,,
114.00 Dhs,Autre Women Girls Push Up Lingerie Corset  Bandage Sports BraPush Up Bra+Pants Underwear Set  10.10(Pink),,,
248.00 Dhs,Autre Women's seamless sports bra for running workout gym high impact fitness yoga bra quick(pink),,,
107.00 Dhs,Autre Women Seamless Single Layer Sports Bra Fitness Gym Running Yoga Exercise Shapewear Sports Bra 3 Colors Size M/L/XL/XXL(White),,,
162.00 Dhs,Autre Women Sports Bras GYM Running Fitness Exercise Quick drying Underwear Training Shockproof Vest Removable Pads(Orange),,,
202.00 Dhs,Autre Women's High Impact WireWorkout Racerback Sports Bra Top(Hot Pink03),,,
135.00 Dhs,Autre Women Mesh Breathable Sports Bra Fitness Padded Bra Workout Yoga Tank Full Cup Racerback(White),,,
282.00 Dhs,"Autre Women PlSize XL XXL Zipper Sports Bras,Padded Push Up WireBreathable Sports Tops,Fitness Gym Yoga Sports Bra Top(Yellow)",,,
198.00 Dhs,Autre Women Push Up Yoga Bra Seamless Sports Bra Workout Sport Bh Fitness for Gym Brassiere Women's Sportswear(black),,,
201.00 Dhs,Autre Sport Padded Yoga Bra Push Up Sports Bras High Impact Pink Sports Bra Strappy Fitness Gym Yoga Top(Yellow),,,
115.00 Dhs,Autre Summer Women Stretch Athletic Vest Gym Fitness Sports Bra No Rims Full Cup Solid Bras Tops Q88 B2Cshop(Pink),,,
128.00 Dhs,"Autre Women Zipper Push Up Sports Bras,PlSize XL Padded WireBreathable Sports Tops,Fitness Gym Yoga Sports Bra Top(White)",,,
189.00 Dhs,Autre Sports Wear for Women Gym Fitness High Impact Sports Bra Padded Push Up Seamless Ropa Mujer Strappy Shirt Top(Black),,,
202.00 Dhs,Autre Criss Cross Sports Bra Womens Tops Sporty Tank Fitness Strappy Gym Ladies Athletic Exercise Compression Underwear(Black),,,
240.00 Dhs,Autre Women Seamless Sport Bra Push Up Sports Bra Workout Bra Sports Wear for Women Gym(Dark Purple),,,
237.00 Dhs,Autre Sports Bra Oblique Shoulder Strap Women gym bra Hollow out Back Lines StrenuoExercise fitness bra Tops Female Fitness Top(Black),,,
210.00 Dhs,Autre Women Cross Design Sports Bra Push Up Shockproof Vest Tops Captain America Superman Running Gym Fitness Bras (Blue),,,
257.00 Dhs,Autre High Sports Bra Women Hollow Out Padded Yoga Bras Fitness Gym Bra Tops Soutien Gorge Sport Bh Active Wear(white),,,
129.00 Dhs,Autre Sports Bra 5 Colors Ladies Padded Push up Yoga Fitness Daily Wear Wire Bra Seamless Full Cup Solid Sports Top(Apricot),,,
128.00 Dhs,Autre Women Fitness Yoga Push Up Sports Bra Gym Running Padded Shockproof Quick Dry Tank PlSize Bra 6 Colors(Red),,,
201.00 Dhs,Autre New Style Side Cross Women Mesh Sports Bra Push Up Adjustable Bras Gym Fitness Tank Running Yoga Bras(Black),,,
128.00 Dhs,Autre Padded Yoga Bra Women Sports Bra black Workout Gym Fitness Vest seamless push up tops plsize(Blue),,,
131.00 Dhs,Autre Women Stretch Sport Bra Push Up Padded Fitness Tank Tops Workout Gym Yoga For Fwmale Vest(HOT),,,
99.00 Dhs,Autre White Sports Bra Women Single Layer Seamless Shapewear Fitness Gym sujetador deportivo mujer Running Yoga Bra Sport 2019( ),,,
183.00 Dhs,Autre Sports Bra Women High Yoga Running Fitness Workout Push Up Shockproof Female Tops Underwear Brassiere(White),,,
116.00 Dhs,Autre Women Sports Bras Breathable Running Gym Yoga Fitness Tank Ladies Padded Seamless Bra Workout Bras(White),,,
223.00 Dhs,Autre New Women Cross Design Sports Bra Push Up Shockproof Vest Tops with Padding for Running Gym Fitness Jogging Yoga Shirt(Sky Blue),,,
231.00 Dhs,Autre Colorvalue Deep V Yoga Sports Bras Women Push Up Nylon Workout Fitness Vest Type Gym Exercise Sport Brassiere(Cinnamon Color),,,
175.00 Dhs,Autre Tops Sports Bra Breathable Fitness Stretch Underwear Push Up Yoga Bras With Padding The Gym Bra Running Yoga White Bra(White),,,
190.00 Dhs,Autre Women's High Impact Sport Bra With Back Pocket Front Zipper Workout Bra(Black01),,,
,,,,
,,,,
,,,,
,,,,
,,,,
,,,,
,,,,
,,,,
108.00 Dhs,Autre Women Yoga Sports Bra Comfortable Lace Leisure Gym Athletic Padded Seamless Stretch Vest(Beige),,,
180.00 Dhs,Autre 2019 Women Topos High Impact Sports Bra for SportsWear Fitness Yoga Run Pad Cropped Sports Tops Push Up Women Bra(Flower ash),,,
107.00 Dhs,Autre 2019 Summer Fitness Women's Lace Bandage Cutout Lingerie Sports Bras Elastic Bandage Bra Without Chest Pad(16),,,
198.00 Dhs - 331.00 Dhs,Autre women summer sleeveless short fashion solid color Navel vest womens Sport Bra(AGreen),,,
117.00 Dhs,Autre Fitness Bra Breathable Sport bra Mesh Push Up  Bras for Women stitching yoga Brassiere Sport tops(B),,,
207.00 Dhs,Autre Women Push Up Seamless Sports Bra Workout Female Sport Fitness Run  Yoga Gym Brassiere Women's Sportswear (Black),,,
130.00 Dhs,Autre Level 4 Stretch Sports Bras Shockproof Fixed Quick drying Underwear Vest Women Running Gym Zipper Adjustable Strap(Silver),,,
159.00 Dhs,Autre Newest  Black White Gray Blue Color Popular 1 Pc Women Girl Sports Bra Comfortable Ladies Sport Bra Pullover(Gray),,,
165.00 Dhs,Autre Back Cross Shockproof Sports Bras Women Gym Fitness Seamless Yoga Bra Push Up Bra(MICAI GREEN),,,
198.00 Dhs,Autre Strappy Sports Bra Running Fitness Yoga Bras Padded Sport Gym Athletic Underwear Push Up Brassiere Workout Vest(Multi),,,
182.00 Dhs,Autre Noflen Women Seamless Sports Bra Running Yoga Brassiere Workout Gym Fitness High Impact Padded Underwear Vest Tank(Black),,,
131.00 Dhs,Autre New Sports Bra Women Fitness Yoga Bras Backless Gym Padded Sport Athletic Workout Running Underwear(Black),,,
123.00 Dhs,Autre Women Girls Sports Bra Bras Large Sizes Good Female Breathable Push Up Seamless Underwear Brassiere Fitness Yoga Running(Pink),,,
282.00 Dhs,"Autre Women PlSize XL XXL Zipper Sports Bras,Padded Push Up WireBreathable Sports Tops,Fitness Gym Yoga Sports Bra Top(Pink)",,,
112.00 Dhs,Autre 2019 Sport Bra Unpadded Women Leopard Print Bra V neck Gather Fitness Tops Summer Bandage Halter For Women(Leopard),,,
126.00 Dhs,Autre 3 Styles Padded Yoga Bra Tops Ladies Breathable Push Up Vest Women Jogging Sport Shockproof Fitness Bra Seamless Tank Tops(Style1 White),,,
115.00 Dhs,Autre Sports Bra for Womens Fitness Yoga Push Up Gym Running Padded Tank Athletic Vest Underwear Shockproof Strappy Sport Bra Top(Green),,,
199.00 Dhs,Autre Women Sport Bra Yoga Bra Fitness Workout Push Up Bra Soft Lace Workout Vest bra  2019 Sale(B5013B),,,
189.00 Dhs,Autre Gradient Seamless Sports Bra For Fitness Yoga Bras Gym Orange Workout Women Fitness Active Wear(1111 Bra Gray),,,
111.00 Dhs,Autre Women Fitness Sports Bra Striped Lingerie Seamless Bra Running Gym Quick Dry Breathable WireVest Underwear #2S20FN(White),,,
172.00 Dhs,Autre Criss Cross Sport Bra Fitness Women Gym Gym Running Elastic Yoga Bra Workout Bras Fallindoll(Red),,,
117.00 Dhs,Autre 8 Colours Sport Bra For Women Gym Running Yoga Sport Bra Set Girl Underwear High Quality Women Fitness Sport Bra(ROYAL BLUE),,,
171.00 Dhs,Autre New Women Sports Bra Fitness Yoga Bra Running Bra High Quality Lady Sportswear Sports For Female(Green),,,
214.00 Dhs,Autre New Back Deep V Women Push Up Seamless Sports Bra Workout Gym Fitness Running Bra Women's Yoga Bra Vest(Black),,,
198.00 Dhs,Autre Sports Bra For Women Fitness High Impact Yoga Bra Sport Shockproof Bra Cross Workout Gym Yoga Tops  Push Up Sportswear(Grey),,,
183.00 Dhs,Autre Sports Bra Women High Yoga Running Fitness Workout Push Up Shockproof Female Tops Underwear Brassiere(Black),,,
126.00 Dhs,Autre Stretch Bra Racerback Padded Workout Women Yoga Bra Tops for Running Sports Gym Workout Female Yoga Clothing Shirts Vest(Red),,,
122.00 Dhs,Autre Women Zipper Push Up Sports Bra Padded WireShockproof Gym Fitness Athletic Running Yoga Vest Sport Tops Shake Underwear(Gray),,,
129.00 Dhs,Autre 2019  Fitness Yoga Bra women Quickly Dry Yoga Tank Tops Gym Running Padded Bra Seamless Black Yoga Sports Bra(red),,,
199.00 Dhs,Autre Women Sport Bra Yoga Bra Fitness Workout Push Up Bra Soft Lace Workout Vest bra  2019 Sale(B5011G),,,
108.00 Dhs,Autre Women Zipper Push Up Sports Bras Vest Underwear Shockproof Breathable Gym Fitness Athletic Running Yoga Bh Sport Tops(Purple),,,
119.00 Dhs,Autre Women Absorb Sweat Vest Sports Gym Shaped Bra Back No Wheels Wireless Sports Bra(Green),,,
131.00 Dhs,Autre Women's Yoga Fitness Bra Front Zipper Padded Wire Comfortable Shockproof Bra Tank Vest for Sports Gym (Grey),,,
249.00 Dhs,Autre Women New Seamless Girls Gym Cropped Fitness Yoga Bra Padded Push Up Sports Bra(SteelBlue),,,
126.00 Dhs,Autre White Women's Sport Bra Push Up Workout Yoga Sports Shirts Gym Academia Fitness Brassiere Vest tank Top(Black),,,
123.00 Dhs,Autre Women Girls Sports Bra Bras Large Sizes Good Female Breathable Push Up Seamless Underwear Brassiere Fitness Yoga Running(Blue),,,
117.00 Dhs,Autre Women Workout Stretch Tank Yoga Padded Vest Sport Bra Tops Racerback Sports Bra(Skin),,,
129.00 Dhs,Autre 2019 New Yoga Gym Running Bra Breathable Sport Bra For Fitness Women High Stretch Tank Push Up Vest Underwear Black Yoga Bra(red),,,
111.00 Dhs,Autre Women Seamless Bra With pads Big Size Push up Bras PlSize Underwear Vest Tops Wireless Padded Brassiere drop(Pink),,,
148.00 Dhs,Autre Brand Women Sports Bra High for Sporting Yoga Fitness Athletics Gym  Workout Bra Mesh Breathable (Wine Red),,,
,,,,
,,,,
,,,,
,,,,
,,,,
,,,,
,,,,
,,,,
128.00 Dhs,Autre Absorb Sweat Women Athletic Running Sports Bra Gym Fitness Yoga Running Vest Underwear Padded Workout Sport Bra(Green),,,
111.00 Dhs,"Autre Women Absorb Sweat Quick Drying Sports Bra,Fitness Padded Stretch Workout Vest Running Wireless Underwear Hot(4)",,,
114.00 Dhs,Autre Women Workout Stretch Tank Yoga Padded Vest Sport Bra Tops Racerback Sports Bra(Pink),,,
122.00 Dhs,Autre Seamless Sports Bra No Pad Women's Vest Fitness Running Gym Yoga Bra Breathable Wire Bra Quick Dry(black),,,
190.00 Dhs,Autre Women's High Impact Sport Bra With Back Pocket Front Zipper Workout Bra(Magenta03),,,
167.00 Dhs,Autre Women Breathable Mesh Sports Bras Shockproof Padded Athletic Gym Running Bra Solid Seamless Fitness Yoga Sport Tops Vest(Green),,,
126.00 Dhs,Autre 3 Styles Padded Yoga Bra Tops Ladies Breathable Push Up Vest Women Jogging Sport Shockproof Fitness Bra Seamless Tank Tops(Style3 Black),,,
203.00 Dhs,Autre Women Skin Tight Soft Hollow Dry Max Athletic Running Workout Fitness Yoga Bra with Built in Pads(Red),,,
223.00 Dhs,Autre Women Seamless Sports Bras Nepoa Gym Vrouwen Energie Shark Long Sleeve Seamless Sports Bra(White Grey Bottom),,,
135.00 Dhs,Autre Quick Dry Padded Sports Bra Women Adjustable Fitness Sport Brassiere Push Up Seamless Running Yoga Bra Detachable New A30521(RD),,,
122.00 Dhs,Autre Women Sports Bra Gym Tank Tops Breathable Red Fitness Bra Push Up bra Corsets Bustiers With Cup(black),,,
159.00 Dhs,Autre women sports bras GYM lady running fitness exercise quick drying underwear training dancing Shockproof  vest(Purple),,,
223.00 Dhs,Autre YOGA Women's Removable Pads Yoga Bra Tops Cross Strappy Back Sports Bra(Dark Violet04),,,
113.00 Dhs,Autre Women Fitness Bra Padded Compression Sport Bra Sportswear Quick Dry Elastic Running Yoga Bra RED(Black),,,
221.00 Dhs,Autre Fitness Sports Bra Women Gym Yoga Bra Tops Sportswear For Women Sport Push Up Brassiere Workout Fitness Padded Yoga  (Purple),,,
107.00 Dhs - 119.00 Dhs,Autre 2019 Torridity Yoga Bra Athletic Underwear Women Sports Bras Running Gym Breathable Yoga Bra Fitness Jogging Bras Female(style 16),,,
115.00 Dhs,Autre Summer Women Stretch Athletic Vest Gym Fitness Sports Bra No Rims Full Cup Solid Bras Tops Q88 B2Cshop(Dark Blue),,,
129.00 Dhs,Autre 7 Color Fitness Yoga Push Up Sports Bra Women Gym Running Padded Tank Athletic Vest Underwear Shockproof Zipper Sport Bra(rose Red),,,
240.00 Dhs,Autre Women Seamless Bra Yoga Bra Sports Bra Girls Gym Fitness Top(DARK GREY-PINK),,,
213.00 Dhs,Autre Camo Seamless Sports Bra High Impact Push Up Yoga Bra Padded Gym Brassiere Running Underwear Fitness Sport Femme(Purple),,,
186.00 Dhs,Autre Word Tops Sports Bra Breathable Fitness Stretch Underwear Push Up Yoga Bras With Padding The gym bra(Silver),,,
191.00 Dhs,Autre Strappy Seamless Sports Bra High Impact Push Up Yoga Bras Padded Gym Brassiere Running Fitness Femme Workout Sport Bh(Red),,,
199.00 Dhs,Autre 2019 Camo Seamless Sports Bra For Women Gym Criss Cross Workout Bras High Impact Bras Wireless Yoga Bra(Green),,,
122.00 Dhs,Autre Women Sports Bra Gym Tank Tops Breathable Red Fitness Bra Push Up bra Corsets Bustiers With Cup(Pink),,,
223.00 Dhs,Autre YOGA Sport Fitness Bra Vest Women Yoga Bra Solid Workout Athletic Underwear(Opal Green08),,,
171.00 Dhs,Autre Gym Seamless Sports High Impact Sports Bra Fitness Women Padded Fitness Stretch Sports Bras Cross Probra High Impact Vest(Gray),,,
134.00 Dhs,Autre S 6XL Large Size Women New Design Comfort BraMesh Breathable Yoga Underwear Shockproof Sports Fitness Bras M08(OR),,,
228.00 Dhs,Autre Seamless Sports Bra flexible Pink Grey Yoga Bra For Women Workout Top(03 leggings),,,
203.00 Dhs,Autre Women Stylish Stretch Double Strappy High Shockproof Sport Jogging Bra with Built in Padds(Black),,,
185.00 Dhs,Autre Women's Sports Bra Tops Orange Thicken Bras Sports Fitness Sails Women's Bras Sports Yoga Pushing Sports Bras(Flower green),,,
184.00 Dhs,Autre Seamless Sports Bra Women Fitness Workout Gymwear Running Shirt Hollow Back Strappy Bare Midriff Activewear Solid Color(Red),,,
120.00 Dhs,Autre 5 Colors Sports Bra Ladies Padded Push up Yoga Fitness Daily Wear Wire sleep Bra Seamless Full Cup Solid Sports Top(Beige),,,
161.00 Dhs,Autre Women's Seamless Sports Bras Lace Cross Front Side Buckle Closure Bra Wireless Yoga Running Vest For Fitness Underwear(White),,,
129.00 Dhs,Autre Sports Bra High Stretch Breathable Fitness Women Padded for Running Yoga Gym Seamless Bra Gradient Sport Bra(RoseRed),,,
201.00 Dhs,Autre Push Up Sport Bra for Women Yoga Bra Tops Gym Workout Shockproof Underwear Running Tights Sportswear(red),,,
193.00 Dhs,Autre Seamless Sport Bra Gym Bra Fitness Yoga Padded Tops Running Athletic Vest CrossSportsWear Active Wear(G),,,
113.00 Dhs,Autre Women Sports Bra Padded Bras Lace Stretch Gym Yoga Athletic Vest(skin color),,,
140.00 Dhs,Autre 2019 Sports Bras Sports Bras   Padded Seamless High Impact for Yoga Gym Workout Fitness tank tops biustonosz sportowy(Black),,,
282.00 Dhs,"Autre Women PlSize XL XXL Zipper Sports Bras,Padded Push Up WireBreathable Sports Tops,Fitness Gym Yoga Sports Bra Top(Blue)",,,
102.00 Dhs,Autre 2019 Women's Lace Bra V neck Sport Bras Halter Racerback Corset Underwear Comfort Yoga Fitness Tops New(2),,,
,,,,
,,,,
,,,,
,,,,
,,,,
,,,,
,,,,
,,,,
140.00 Dhs,Autre 2019 Sports Bras Sports Bras   Padded Seamless High Impact for Yoga Gym Workout Fitness tank tops biustonosz sportowy(Black),,,
127.00 Dhs,Autre Women Push Up Yoga Sports Bras Front Zipper Padded Fitness Tank Tops Gym Workout Running Sport Bra Breathable Underwear(Blue),,,
131.00 Dhs,Autre New Sports Bra Women Fitness Yoga Bras Backless Gym Padded Sport Athletic Workout Running Underwear(Hot Pink),,,
144.00 Dhs,Autre Women's Mid Impact Sports Bra Fitness Yoga Bra Breathable Running Workout Racerback Sports Top(Blue),,,
130.00 Dhs,Autre High Stretch Breathable Mesh Gym Bra Brassiere Sport Femme For Aerobics Running Workout Sports Bra Fitness Active Wear( ),,,
102.00 Dhs - 114.00 Dhs,Autre 2019 Women Lace Bra Solid Straps Thin Seamless Wire Hollow Out Halter Push Up Breathable Lingerie Underwear(1-white),,,
111.00 Dhs,Autre Gym Sporty Yoga Women Workout Sleeveless Tank Tops Ladies Fitness Seamless Solid Color Breathable Zipper Bra Padded Stretch(Gray),,,
205.00 Dhs,Autre Women's High Impact Workout Racerback WireSports Bra Top(Black01),,,
126.00 Dhs,"Autre Quick Dry Sports Bra,Women Adjustable WirePadded Shakeproof Push Up Seamless Fitness Running Yoga Sports Tops Vest(60016 BLK)",,,
122.00 Dhs,Autre Women Sports Bra Gym Tank Tops Breathable Red Fitness Bra Push Up bra Corsets Bustiers With Cup(green),,,
128.00 Dhs,Autre Women's Seamless Sports Bras Lace Cross Front Side Buckle Closure Yoga Bra Wireless Running Vest Gym Fitness Sports Top(White),,,
191.00 Dhs,Autre Cross Sports Bra Seamless Fitness Women Yoga Push Up  Padded Shockproof Black PlSize Running Bra (Blue),,,
212.00 Dhs,Autre Backless Seamless High Sports Bra Women Solid Shock Proof Quick Drying Breathable Exercise Fitness Gym Top(Black),,,
107.00 Dhs,Autre 2019 Summer Fitness Women's Elastic Lace Bandage Bra Female Cutout Lingerie Sports Bras Without Chest Pad New(5),,,
205.00 Dhs,Autre Womens Backless Strappy Ladies Sports Bra Tops Activewear For Women Exercise Sporty Tank Sport Compression Athletic Top(Yellow),,,
116.00 Dhs,Autre 7 Colors Women Yoga Sport Bra Fitness Running Vest sleep Underwear Padded Tops Underwear No Wire rim Female gym bras(White),,,
104.00 Dhs,Autre Fitness Bra Women Fitness Yoga Sports Bra For Running Gym Padded Wire Stretch Shake Proof Underwear Solid Color(Nude),,,
270.00 Dhs,Autre PlSize XXL Absorb Sweat Yoga Sports Bra For Women Breathable Athletic Running Tops Vest Seamless Padded Gym Fitness Underwear(Black),,,
126.00 Dhs,Autre Women Sports Bra Quick Dry Padded Shockproof Gym Fitness Running Yoga Sport Brassiere Tops(Fluorescent green),,,
131.00 Dhs,Autre Men Slimming Vest Body Shaper Neoprene Abdomen Fat Burning Shaperwear Waist Sweat Corset Weight Slimming Belly Sportswear(Yellow black),,,
115.00 Dhs,Autre Women Yoga Sports Bra Leisure Seamless Padded Vest Sleep Strapy Tops(Lavender),,,
117.00 Dhs,Autre Women's Sports Underwear Shock proof Yoga Gathering Bra Sports Workout Athletic Solid 2019(PP),,,
201.00 Dhs,Autre seamless sports bra workout gym high impact padded yoga bra women yoga seamless gym vest(Dark Grey),,,
135.00 Dhs,Autre Women Stretch Fitness Tank Seamless Workout Yoga Padded Sports Bra Breathable Gym Athletic Vest(PK),,,
273.00 Dhs,Autre Sports bra lady New Style Breathable Quick Dry hollow out net yarn bra Bodybuilding Bras 4 way stretch fabric running bras(so merlot),,,
115.00 Dhs,Autre Sports Bra for Womens Fitness Yoga Push Up Gym Running Padded Tank Athletic Vest Underwear Shockproof Strappy Sport Bra Top(Grey),,,
131.00 Dhs,Autre Training High Stretch Breathable Sports Bra Fitness Women Shockproof Padded Sport Bra for Running Yoga Gym Seamless Bra(1),,,
190.00 Dhs,Autre Sports Bra Woman Big Size Chest Sport With PlBra Women Gym Workout 6xl 5xl 4xl 3xl High Impact Large Yoga(Pink),,,
225.00 Dhs,Autre Colorvalue Wireless Padded Yoga Fitness Tops Brassiere Women Spaghetti Strap Workout Sports Bras with Removable Pads(Sky Blue),,,
229.00 Dhs,Autre 2019 Leopard push up beach wear piece swimsuit tankini sports Bra traje de bano mujer size S L BI 11(1),,,
117.00 Dhs,Autre Women's Sports Underwear Shock proof Yoga Gathering Bra Sports Workout Athletic Solid 2019(YE),,,
142.00 Dhs,"Autre 6 Colors Women Push Up Sports Bras,PlSize XL Padded Wire U neck Shakeproof Running Yoga Fitness Sports Tops(Pink)",,,
257.00 Dhs,Autre YOGA Women's Removable Pads Yoga WireRacerback Sports Bra(Black01),,,
213.00 Dhs,Autre Adjustable Back Buckle Women Sports Bra Push Up Running Yoga Bra Shockproof Breathable Hollow Gym Fitness Bra(Purple),,,
