price,product,product_information,sells,stars
105.00 Dhs,Autre Best Deal   Womens yoga tops lady Thin No Mat Athletic Vest Fitness Sports Yoga Stretch Bras Good looking AU19X7(White),,,
198.00 Dhs,Autre Women Push Up Yoga Bra Seamless Sports Bra Workout Sport Bh Fitness for Gym Brassiere Women's Sportswear(purple),,,
210.00 Dhs,Autre Women Cross Design Sports Bra Push Up Shockproof Vest Tops Captain America Superman Running Gym Fitness Bras (Pink),,,
123.00 Dhs,Autre Padded Women Wear Sports Bra Vest Yoga Push Up Bh Shockproof Running Tank Breathable Quick Dry Fitness Gym Underwear(5),,,
116.00 Dhs,Autre 7 Colors Women Yoga Sport Bra Fitness Running Vest sleep Underwear Padded Tops Underwear No Wire rim Female gym bras(blue(no pad)),,,
211.00 Dhs,Autre Camo seamless sports bra high impact push up sport bra women fitness workout gym bra padded gym top(Black),,,
389.00 Dhs,Autre Athletic Running Racerback Sports Bra For Women High Impact Padded Fitness Underwear Vest Seamless Shockproof Gym Yoga Tanks(Pink),,,
162.00 Dhs,Autre Women Sports Female with Compression Push Up Underwear Sports Bra Sportswear Strap Printed Yoga Bra Top(70105Red),,,
120.00 Dhs,Autre Women Sport Bra Black Padded Yoga Brassiere Fitness Sports Tank Female Sport Yoga Bra Push Up Sports Bra 2019 (4),,,
128.00 Dhs,Autre Women's Sports Bra Breathable Mesh Shockproof Thicken Sports Gym Running Seamless Fitness Yoga Vest Sports Bra(Pink),,,
113.00 Dhs,Autre Women Soft Sports Bra Yoga Fitness Stretch Workout Tank Seamless Padded Bra Higt Quality(Pink),,,
114.00 Dhs,Autre Women Girls Push Up Lingerie Corset  Bandage Sports BraPush Up Bra+Pants Underwear Set  10.10(Black),,,
430.00 Dhs,2018 Mens Funny Shirt Blue Fire Snake Dragon 3D Printed T-Shirts Short Sleeve Tops Tees,,(1),5 out of 5
105.00 Dhs,Autre Women Fitness Yoga Sports Bra For Running Gym Padded Wire Stretch Shake Proof Underwear Solid Color Fitness BraN(Nude),,,
179.00 Dhs,SWEAT SHAPER DÉBARDEUR POUR PERTE DE POIDS POUR FEMMES,,,
136.00 Dhs,Autre Summer Women's tight fitting yoga strap vest female sports fitness clothes breathable sports running bra jogging shirt(White),,,
238.00 Dhs,Autre double line push up sport bra cute grey strappy wireless underwear women gym padded bras for yoga(Grey),,,
189.00 Dhs,Autre SevencolorSports Bra Pink High Impact 2019 Brassiere Push Up Padded Sport Bras Women Yoga Gym Running Underwear(Black),,,
240.00 Dhs,Autre Women Tight Sports Bras Medium Breathable Comfort LiNing Sport Bra AUBN022(AUBN022 2H),,,
107.00 Dhs,Autre 2019 Summer Fitness Women's Elastic Lace Bandage Bra Female Cutout Lingerie Sports Bras Without Chest Pad New(19),,,
192.00 Dhs,Autre Anti sweat Sports Bra High Stretch Breathable Fitness Women Padded for Running Yoga Gym Seamless Bra Gradient Sport Bra(Red),,,
,,,,
,,,,
,,,,
,,,,
,,,,
,,,,
,,,,
,,,,
231.00 Dhs,Autre 3Pcs Spring Yoga Bra Fitness Debardeur Femme Sportwear Sports Push Up Sport Bra Lace Jogging Gym  Z25(3Pcs Black),,,
122.00 Dhs,Autre Women Female Dry Quick Push Up Natural Color Sports Bra Tank Tops Yoga Shirt with Padding For Running Fitness Gym Bras(khaki),,,
200.00 Dhs,Autre Sports Bra Women Fitness Yoga Bras Gym Padded Push Up BH Sport Athletic Workout Running Clothing Red Black(black),,,
133.00 Dhs,Autre Probra Sports Bra Women Running Yoga Bra Push Up Sports Bras Athletic Vest Yoga Padded Brassiere High Impact Sport Top(Army Green),,,
144.00 Dhs,"Autre Zipper Push Up Women Sports Brassiere,Padded WireShockproof Breathable Sports Tops,Fitness Gym Yoga Sports Bra Top(Purple)",,,
189.00 Dhs,Autre Backless Push Up Sports Bra Fitness Women Seamless Gym Bra Padded Yoga Bra Sport bh Running Workout Active Wear(orange),,,
128.00 Dhs,Autre Women Sport Bra Zipper Front Running Yoga Sports Bra Push Up Shockproof WireFitness Vest(gray),,,
216.00 Dhs,Autre Women Yoga Cropped Back Strapy Sports Bra Padded Yoga Bra Fitness Workout Gym Tank Push Up Running Bra Yoga Vest (Black),,,
261.00 Dhs,Autre Women Sports Bra Back Mesh Breathable Fitness Gym Athletic Wear Bra Tank Navy Blue Padded Yoga Bra Running Pilates Training(pink),,,
113.00 Dhs,Autre Women Sports Bra Padded Bras Lace Stretch Gym Yoga Athletic Vest(Lavender),,,
107.00 Dhs,Autre 2019 Summer Fitness Women's Elastic Lace Bandage Bra Female Cutout Lingerie Sports Bras Without Chest Pad New(18),,,
159.00 Dhs,Autre women sports bras GYM lady running fitness exercise quick drying underwear training dancing Shockproof  vest(Red),,,
178.00 Dhs,Autre New Yoga Fitness Bra Women Hollow Mesh Cross Bra Sports Vest Tank Quick Dry Gym  Beauty Back Women Large size(Gray),,,
113.00 Dhs,Autre Comfort Sports Bras Lace Trim Size Women Padded Wireless Yoga Gym Bra Clothing(Blue),,,
191.00 Dhs,Autre Seamless Sports Bra Women Fitness Cropped Padded Yoga Bra Push Up Gym Brassiere Sport Workout Racerback Active Wear(Black),,,
334.00 Dhs,Sedectres Fashion Women Zip Ladies Ankle Heels Casual Open Toe Lace Party Singel Shoes -Black,,,
107.00 Dhs,Autre 2019 Summer Fitness Women's Lace Bandage Cutout Lingerie Sports Bras Elastic Bandage Bra Without Chest Pad(9),,,
200.00 Dhs,Autre Quality Women's Sports Bra Quick Dry Yoga Fitness Bra femme Gym Clothes  Running  Workout Underwear shirt (Pink),,,
190.00 Dhs,Autre Women Solid Push up Shockproof Sports Bra Elastic Backless Breathable Quick Dry Full Cup Workout Gym Yoga Tank Top(Black),,,
129.00 Dhs,Autre Women Fitness Yoga Sports Bra For Running Gym Adjustable Spaghetti Straps Padded Seamless Athletic Vest S M L (Blue),,,
129.00 Dhs,Autre Breathable Stretch Gym Sports Bra Female Push Up Shockproof Running Exercise Tank Women Yoga Fitness Bra Ladies Padded(3182 Gray),,,
129.00 Dhs,Autre New Anti sweat Women Sports Running Bra Quick Dry Fitness for Gym Yoga Workout Bra Seamless Underwear Vest(Pink),,,
222.00 Dhs,Autre Sports Bra  Women's Padded Compression Sports Bra Sportswear PhBra Bag Fast Dry Elastic Running Sport Bra Top(Red),,,
126.00 Dhs,Autre White Women's Sport Bra Push Up Workout Yoga Sports Shirts Gym Academia Fitness Brassiere Vest tank Top(Gray),,,
191.00 Dhs,Autre 21 Colors Seamless Sports Bra Women Gym Back Cross Strappy Fitness Women Sports Bras Gym Yoga Bras For Running Tops(Violet2),,,
191.00 Dhs,Autre 21 Colors Seamless Sports Bra Women Gym Back Cross Strappy Fitness Women Sports Bras Gym Yoga Bras For Running Tops(Gray4),,,
228.00 Dhs,Autre Seamless Sports Bra flexible Pink Grey Yoga Bra For Women Workout Top(01 bra),,,
190.00 Dhs,Autre Sports Bra Woman Big Size Chest Sport With PlBra Women Gym Workout 6xl 5xl 4xl 3xl High Impact Large Yoga(white),,,
372.00 Dhs,Autre PlSize M 3XL Zipper Push Up Sports Bra For Women Shockproof Padded Fitness Yoga Bras Athletic Gym Running Sports Tops Vest(Blue Gray Green),,,
174.00 Dhs,Autre High Impact Sports Bra For Women Fitness Yoga Racerback Sport Bra Seamless Padded Gym Bra Gradient Sports Yoga Cropped Top(Sky Blue),,,
210.00 Dhs,Autre Women Cross Design Sports Bra Push Up Shockproof Vest Tops Captain America Superman Running Gym Fitness Bras (Black),,,
99.00 Dhs,Autre White Sports Bra Women Single Layer Seamless Shapewear Fitness Gym sujetador deportivo mujer Running Yoga Bra Sport 2019(Khaki),,,
114.00 Dhs,Autre Absorb Sweat Quick Drying Sports Bra Fitness Padded Stretch Workout Vest Running Wireless Underwear running bra(Purple),,,
123.00 Dhs,Autre Women's Sports Bras Running Gym Breathable Yoga Bra Sport Athletic Underwear Woman Fitness Jogging Bras Yoga Bra Top(wine red),,,
182.00 Dhs,Autre Back Cross Strappy Seamless Sports Bra Push Up Yoga Bra Padded Women Gym Brassiere Running Fitness Workout Sportswear Black(Yellow),,,
123.00 Dhs,Autre M XXL XXXL 4XL 5XL 6XL Sports Bra Big Size Breathable Wire Sleep Daily Yoga Bra Black White Women Padded Sports Top(Flesh),,,
116.00 Dhs,"Autre Absorb Sweat Quick Drying Sports Bra,Fitness Padded Stretch Workout Vest Running Wireless Underwear for Women(3)",,,
115.00 Dhs,Autre Women Yoga Sports Bra Leisure Seamless Padded Vest Sleep Strapy Tops(Blue),,,
223.00 Dhs,Autre Women Seamless Sports Bras Nepoa Gym Vrouwen Energie Shark Long Sleeve Seamless Sports Bra(Orange Grey Bottom),,,
114.00 Dhs,Autre Summer Style Women Cotton Stretch Athletic Vest Gym Fitness Sports Bra no rims Full Cup padded bras colorful plsize tops(purple),,,
,,,,
,,,,
,,,,
,,,,
,,,,
,,,,
,,,,
,,,,
162.00 Dhs,Autre Women Sports Female with Compression Push Up Underwear Sports Bra Sportswear Strap Printed Yoga Bra Top(70105DarkGreen),,,
115.00 Dhs,Autre Women Yoga Sports Bra Leisure Seamless Padded Vest Sleep Strapy Tops(Blue),,,
223.00 Dhs,Autre Women Seamless Sports Bras Nepoa Gym Vrouwen Energie Shark Long Sleeve Seamless Sports Bra(Orange Grey Bottom),,,
114.00 Dhs,Autre Summer Style Women Cotton Stretch Athletic Vest Gym Fitness Sports Bra no rims Full Cup padded bras colorful plsize tops(purple),,,
116.00 Dhs,"Autre Absorb Sweat Quick Drying Sports Bra,Fitness Padded Stretch Workout Vest Running Wireless Underwear for Women(3)",,,
212.00 Dhs,Autre Women Seamless Sports Bra High Impact Running Padded Yoga Bras Fitness Tops Soutien Gorge Sport Bh Workout Brassiere(black),,,
115.00 Dhs,Autre Lace Side Zero Binding Seamless Underwear Sports Bra Girl Without Rims Comfortable Yoga Underwear(Champagne),,,
213.00 Dhs,Autre Women Thin Shoulder Strap Shockproof Sports Bra Push Up Running Yoga Bra Summer Thin Style Fitness Bras (Pink),,,
188.00 Dhs,Autre Women's Compression Padded Sports Bra With Yoga Bra Sportswear Elastic Running Underwear Gym Sport Bra Top(Flower),,,
119.00 Dhs,Autre Women Absorb Sweat Vest Sports Gym Shaped Bra Back No Wheels Wireless Sports Bra(Hot Pink),,,
139.00 Dhs,Autre Women Padded Tank Running Vest Gym Fitness Sports Bra Stretch Cotton Seamless Yoga Bra Wrap Chest Push Up Jogger Bra(Pink),,,
142.00 Dhs,Autre Women Seamless Brassiere Sport Bra For Yoga Push Up Sports Bra High Impact Running Padded Fitness Workout Wear(5),,,
131.00 Dhs,Autre Women's Yoga Fitness Bra Front Zipper Padded Wire Comfortable Shockproof Bra Tank Vest for Sports Gym (Rose),,,
202.00 Dhs,Autre Hollow Female Fitness Women Yoga Gym Tops Sport Bh Woman High Impact Sports Bra Academia For Women's Racerback(White),,,
123.00 Dhs,Autre Cotton Solid Sport Bra Fitness Running Yoga Bras Padded High Impact Workout Female Push UP Yoga Brassiere Sports Bra #A(Black),,,
205.00 Dhs,Autre Womens Backless Strappy Ladies Sports Bra Tops Activewear For Women Exercise Sporty Tank Sport Compression Athletic Top(Green),,,
196.00 Dhs,Autre PlSize High Stretch Shockproof Breathable Women Sports Bra Fitness Tights Padded Running Yoga Gym Seamless Vest B30(three),,,
193.00 Dhs,Autre Neon Front Close Sports Bra Fluo Fluro Color Colorful Yoga Gym Jogging Running High Zipper Comfort Comfortable Bra Top(Grey),,,
191.00 Dhs,Autre Seamless Sport Bra Women Girls Gym Workout Fitness Yoga Bra Padded Push Up Sports Bra Seamless Shockproof Bra(slate lavendar),,,
125.00 Dhs,Autre Womens Lace Sports Bra Breathable Widened Shoulder Straps Impact Sport Bra for Running Yoga Gym With U design(Green),,,
168.00 Dhs,Autre Woman Cross Yoga Sports Bra Sport Female Fitness Bh Tops Women Wear For Gym Bras Women's Brassiere Active Clothing(Gray),,,
101.00 Dhs - 112.00 Dhs,Autre Women Sports Bra Underwear Black Lace Bandage Bra Thin Seamless Wire Bustier Brassiere Lingerie(3),,,
219.00 Dhs,Autre Women's Medium Strappy Back WireRemovable Cups Longline Yoga Sports Bra(Dark Grey02),,,
108.00 Dhs,Autre Summer Women Mesh Patchwork Sports Bra Tank Tops Bodycon Slim Gym Sports Clothing Bustier Vest Tops Bralette(Black),,,
129.00 Dhs,Autre 7 Colors Fitness Yoga Push Up Zipper Sports Bra Gym Running Padded Shockproof Quick Dry Tank PlSize Bra (Black),,,
111.00 Dhs,Autre Stylish Gym Fitness Sports Bra Cotton Push Up Stretch Athletic Vest No Rims Breathable Full Cup Padded Bras PlSize Top(gray),,,
128.00 Dhs,Autre S XXL XXXL Breathable Sports Bras Women Hollow Out Padded Sports Bra PlSize Gym Running Fitness Yoga Sports Tops(White),,,
166.00 Dhs,Autre Sports Hoodie Fitness Women Yoga Push up Sports Hooded Bra Yoga Fitness Vest Bra Workout Running Top(Black),,,
121.00 Dhs,Autre Yoga Sports Bra Full Cup quick dry Shockproof Cross Back Push Up Workout Bra For women Gym Running Jogging Fitness Bra(white(no pad)),,,
180.00 Dhs,Autre Women Seamless Sports Bra Fitness Push up Femme Sportswear Workout Solid Color sports wear for women gym(Purple),,,
115.00 Dhs,Autre Women Yoga Sports Bra Leisure Seamless Padded Vest Sleep Strapy Tops(Black),,,
106.00 Dhs,Autre Women Fitness Yoga Sports Bra for Running Gym Straps Padded Athletic Vest Quick Dry Sport bra for women 5 colors(Orange),,,
231.00 Dhs,Autre Colorvalue Waterproof Half Zipper Athletic Sport Shirts Women Slim Long Sleeved Fitness Yoga Tops with Thumb Holes(Dark Green),,,
125.00 Dhs,Autre Women's Sports Yoga Blouse Bra Running Gym Workout Front Zipper Fitness Sports Shirt Women's Yoga Vest Bra(3),,,
181.00 Dhs,Autre Women Seamless Sports Bra Running Yoga Brassiere Workout Gym Fitness Sport Bra High Impact Padded Underwear Vest Tank(Classic Black),,,
113.00 Dhs,Autre Women Soft Sports Bra Yoga Fitness Stretch Workout Tank Seamless Padded Bra Higt Quality(Black),,,
240.00 Dhs,Autre Women Seamless Bra Yoga Bra Sports Bra Girls Gym Fitness Top(GREEN),,,
203.00 Dhs,Autre Women Stylish Stretch Double Strappy High Shockproof Sport Jogging Bra with Built in Padds(Blue),,,
450.00 Dhs,Marathon Chic Survêtement Femme - Gris,,,
186.00 Dhs,Autre Two Pcs Sets Yoga back Closure Bra  Gray Bra set Push Up Women  Bra Sports Underwear(Gray),,,
,,,,
,,,,
,,,,
,,,,
,,,,
,,,,
,,,,
,,,,
177.00 Dhs,Autre Women Push Up Seamless Sports Bra Workout Female Sport Fitness Bh For Yoga Gym Brassiere Women's Sportswear(Blue),,,
175.00 Dhs,Autre Shoulder Solid Sports Bra Women Fitness Yoga Bras Gym Padded Sport Athletic Underwear Workout Running Clothing(White),,,
231.00 Dhs,Autre Colorvalue Waterproof Half Zipper Athletic Sport Shirts Women Slim Long Sleeved Fitness Yoga Tops with Thumb Holes(Grey Blue),,,
159.00 Dhs,Autre women sports bras GYM lady running fitness exercise quick drying underwear training dancing Shockproof  vest(light yellow),,,
110.00 Dhs - 123.00 Dhs,Autre Women's Sports Bras Running Gym Breathable Yoga Bra Sport Athletic Underwear Woman Fitness Jogging Bras Yoga Bra Top(Pink),,,
223.00 Dhs,Autre 2019 Women Seamless Sports Bra for Fitness Gym Yoga Running Pad Cropped SportsWear Tank Tops Sports Gym Seamless Bra Women(Gray),,,
396.00 Dhs,Reebok Tee-shirt SE PMSH - FEMME NOIR,,(1),5 out of 5
115.00 Dhs,Autre Sports Bra Patchwork Back Cross Padded Push Up Bra Breathable Seamless Stretch Athletic Gym Vest Women Fitness(fuchsia),,,
120.00 Dhs,Autre 10 Colors No Wire rim Bras Female Running Fitness Yoga Seamless Push Up Women Sports Underwear PlSize Sports Vest XXL(purple),,,
122.00 Dhs,Autre Sports Bra Women Fitness Yoga Padded Push Up Breathable Gym Bra Sujetador Brasieres Deportivos Soutien Gorge Sport Top(Grey),,,
129.00 Dhs,Autre 7 Colors Fitness Yoga Push Up Zipper Sports Bra Gym Running Padded Shockproof Quick Dry Tank PlSize Bra (Gray),,,
177.00 Dhs,Autre Sports Bra Cross back Vest Breathable Mesh Fitness Women Running Sport Bh Yoga Shirt Bra Gym Brassiere(Blue),,,
105.00 Dhs - 117.00 Dhs,Autre Back Pocket High Quality Shock Sports Bra Women Shakeproof Yoga Bras Full Cup Fitness Bras Gym Sport Underwear(ROYAL  BLUE),,,
211.00 Dhs,Autre Camo seamless sports bra high impact push up sport bra women fitness workout gym bra padded gym top(Army Green),,,
249.00 Dhs,Autre Women New Seamless Sport Bra Girls Gym Fitness Yoga Bra Padded Push Up Sports Bra(Indigo),,,
128.00 Dhs,Autre New Shockproof Breathable  Push Up Sport Bras Yoga Running Sport T shirt Gym Clothing Fitness Active Sport Tops(ZQ),,,
223.00 Dhs,Autre Women Seamless Sports Bras Nepoa Gym Vrouwen Energie Shark Long Sleeve Seamless Sports Bra(Orange Bottom),,,
187.00 Dhs,Autre Women Seamless Yoga Bra Workout Female Sport Fitness Sports Bra Gym Brassiere Cross Tops Women's Sportswear Sport Bh(Purple),,,
176.00 Dhs,"Autre Women Sports Bra Shockproof Running Yoga Bras Cropped Tops, Seamless WireGym Fitness Vest Workout Tank Top(Pink)",,,
136.00 Dhs,Autre Summer Women's tight fitting yoga strap vest female sports fitness clothes breathable sports running bra jogging shirt(Red),,,
129.00 Dhs,Autre Gradient Breathable Sports Bras Women Quick Dry Padded Sports for Fitness Yoga Running Gym Seamless Sport vest Top(Purple),,,
176.00 Dhs,Autre Women Sports Bra  Full Cup Seamless Gym Sports Bra For Women Fitness Ladies Padded Push up Yoga wear yoga  Wire Bra(Mesh black),,,
211.00 Dhs,Autre cut out women sports bra twist yoga bra workout gym bra fitness yoga padded pink bra gym vest (Pink),,,
126.00 Dhs,Autre Women's Printed Yoga Bra Cross Short Tops Fitness Bandage Shockproof Thicken Running Bra(sky blue),,,
168.00 Dhs,Autre Backless Sports Bra Fitness Bras Women Strappy Brassiere Sport Vest Gym Padded Yoga Bras Push up Running Underwear(Green),,,
135.00 Dhs - 140.00 Dhs,Ladies Printed High Strength Quick Dry Sports Running Fitness Yoga Shorts,,,
205.00 Dhs,Autre Women's High Impact Workout Racerback WireSports Bra Top(Grey04),,,
205.00 Dhs,Autre Woman Backless Fitness Bras Academia Sports Bra For Sport Bh Female Yoga Tops Women Gym Brassiere Women's(Orange),,,
105.00 Dhs - 117.00 Dhs,Autre Back Pocket High Quality Shock Sports Bra Women Shakeproof Yoga Bras Full Cup Fitness Bras Gym Sport Underwear(ROSE RED),,,
189.00 Dhs,Autre Backless Push Up Sports Bra Fitness Women Seamless Gym Bra Padded Yoga Bra Sport bh Running Workout Active Wear(violet),,,
128.00 Dhs,Autre Padded Yoga Bra Women Sports Bra black Workout Gym Fitness Vest seamless push up tops plsize(Black),,,
112.00 Dhs,Autre 7 Colors Womens Sport Bra Fitness Yoga Running Vest Underwear Padded Tops Underwear  No Wire rim Bras Female(Pink),,,
193.00 Dhs,Autre Seamless Sport Bra Gym Bra Fitness Yoga Padded Tops Running Athletic Vest CrossSportsWear Active Wear(A),,,
214.00 Dhs,Autre Autumn New Gym Fitness Women Shockproof Sports Bra Push Up Bras Padded Yoga Bras Back Hollow out Ladies Bras(Black),,,
131.00 Dhs,Autre Women Yoga Bra PlSize Patchwork Sports Bra Gym Cross Backless Bra Yoga Padded Mujer Strappy Cropped Fitness(BLACK),,,
225.00 Dhs,Autre Women's seamless sports bra workout army green gym high impact fitness yoga bra brackless strappy sports bra (Black),,,
196.00 Dhs,Autre Women Cross Back Sports Bra Padded High Impact Workout Running Yoga Gym Bra Fitness Brassiere Sport Femme(white),,,
109.00 Dhs,Autre Women's High Impact Workout Running Powerback Underwire Zipper Sports Bra(Purple),,,
130.00 Dhs,Autre Cooling bra ice silk seamless vest no rims sports bra sleep yoga underwear running fitness breathable sports underwear shirt(Pink),,,
213.00 Dhs,Autre Compression Cropped Fitness Yoga Bra  For Women High Impact Padded Sports Bra Training Femme Workout Tops(black bra top),,,
,,,,
,,,,
,,,,
,,,,
,,,,
,,,,
,,,,
,,,,
213.00 Dhs,Autre Compression Cropped Fitness Yoga Bra  For Women High Impact Padded Sports Bra Training Femme Workout Tops(black bra top),,,
117.00 Dhs,Autre 8 Colours Sport Bra For Women Gym Running Yoga Sport Bra Set Girl Underwear High Quality Women Fitness Sport Bra(SKIN-COLOR),,,
126.00 Dhs,Autre White Women's Sport Bra Push Up Workout Yoga Sports Shirts Gym Academia Fitness Brassiere Vest tank Top(Blue),,,
189.00 Dhs,Autre Backless Push Up Sports Bra Fitness Women Seamless Gym Bra Padded Yoga Bra Sport bh Running Workout Active Wear(brown),,,
198.00 Dhs,Autre Women's Wireless Racerback Sports Bra Medium Impact Workout Yoga Top(Heather Grey02),,,
123.00 Dhs,Autre Padded Women Wear Sports Bra Vest Yoga Push Up Bh Shockproof Running Tank Breathable Quick Dry Fitness Gym Underwear(4),,,
141.00 Dhs,Autre Women Seamless Brassiere High Impact Running Padded Fitness Workout Wear Sport Bra For Yoga Push Up Sports Bra(Black),,,
168.00 Dhs,Autre Woman Cross Yoga Sports Bra Sport Female Fitness Bh Tops Women Wear For Gym Bras Women's Brassiere Active Clothing(Pink),,,
199.00 Dhs,Autre Women Sport Bra Yoga Bra Fitness Workout Push Up Bra Soft Lace Workout Vest bra  2019 Sale(B5012B),,,
203.00 Dhs,Autre Women Stylish Solid Double Dry High Compact Full Quick Dry Sports Exercise Bra(Red),,,
198.00 Dhs,Autre PlSize Yoga Sport Bra for Women Seamless Underwear Shockproof Gym Fitness Athletic Vest Running Bh Push Up Bra 5XL(Apricot),,,
142.00 Dhs,"Autre 6 Colors Women Sports Bras, Push Up Padded Wire Shakeproof Running Athletic Gym Fitness Tops Sosten Deportivo(Pink)",,,
131.00 Dhs,Autre Training High Stretch Breathable Sports Bra Fitness Women Shockproof Padded Sport Bra for Running Yoga Gym Seamless Bra(4),,,
223.00 Dhs,Autre YOGA Women's Removable Pads Yoga Bra Tops Cross Strappy Back Sports Bra(Black01),,,
240.00 Dhs,Autre Purple Strappy High Impact Sports Bra Cropped Yoga Tops Black Activewear Contrast Grey Workout Clothes for Women(grey),,,
109.00 Dhs,Autre Women Sport Bra Breathable Quick Dry Backless Comfortable Underwear Yoga Wireless Sports Bra For Fitness Running Top(Black),,,
135.00 Dhs,Autre Women Running Sport T shirt Gym Shirt Women Stitching Color Yoga Sports Bra Fitness Women Sport Bra(pink),,,
131.00 Dhs,Autre Sport Bras Push Up For Cup A D Front Zipper Sport Bra Running Jogging Fitness Yoga Bra Breathable Shockproof Quick Dry Sport Top(Skin),,,
223.00 Dhs,Autre YOGA Sport Fitness Bra Vest Women Yoga Bra Solid Workout Athletic Underwear(Black01),,,
130.00 Dhs,Autre Women's Seamless High Impact Sports Bra with Removable Cups High Pink Workout Yoga Bra Back Cutout Activewear(white),,,
195.00 Dhs,Autre Female Sports Bra Crisscross Front Back New Active Yoga Running Wear Gym Bra Women Vest Seamless Tops(Black),,,
270.00 Dhs,Autre PlSize XXL Absorb Sweat Yoga Sports Bra For Women Breathable Athletic Running Tops Vest Seamless Padded Gym Fitness Underwear(Black green),,,
180.00 Dhs,Autre Hollow Out Seamless Sports Bra For Women Gym Back Cross Strappy Fitness Women Sports Bras With Removable Pads Gym Active Wear(Gray),,,
198.00 Dhs,Autre Spaghetti Straps Sports Bra Women High Impact Padded Yoga Bras Fitness Tops Sport Bh Workout Running Gym Brassiere(black),,,
119.00 Dhs,Autre Women Absorb Sweat Vest Sports Gym Shaped Bra Back No Wheels Wireless Sports Bra(Black),,,
131.00 Dhs,Autre Women's Yoga Fitness Bra Front Zipper Padded Wire Comfortable Shockproof Bra Tank Vest for Sports Gym (Blue),,,
221.00 Dhs,Autre Compression High Elastic Sports Bra Women Fitness Tops Gym Sportswear Running Vest Cloth Shockproof Yoga Bras(White),,,
111.00 Dhs,"Autre Absorb Sweat Quick Drying Sports Bra,Fitness Padded Stretch Workout Vest Running Wireless Underwear for Women(5)",,,
114.00 Dhs,Autre Women Workout Stretch Tank Yoga Padded Vest Sport Bra Tops Racerback Sports Bra(Green),,,
180.00 Dhs - 201.00 Dhs,Autre PlSize Workout Sports Tops Gym Racerback Seamless Yoga Fitness Sport Bra Padded Activewear for Women Tops Crops(Multi),,,
123.00 Dhs,Autre Cotton Solid Sport Bra Fitness Running Yoga Bras Padded High Impact Workout Female Push UP Yoga Brassiere Sports Bra #A(Purple),,,
129.00 Dhs,Autre Women Fitness Yoga Sports Bra For Running Gym Sport Bra Padded WireShakeproof Underwear Push Up Front Zipper Sport Bra(Beige),,,
183.00 Dhs,Autre Women's Sports Bras For Running With Removable Cups Push Up Yoga Bra Seamless Back Strappy Fitness Athletic Bra Tops(wine red),,,
176.00 Dhs,Autre Women Padded Solid Sport Bra Tops Yoga Bra Black Gray Sport Underwear Run Jogging Yoga Gym Fitness Push Up Sports Bra Yoga Vest (BLU),,,
131.00 Dhs,Autre Training High Stretch Breathable Sports Bra Fitness Women Shockproof Padded Sport Bra for Running Yoga Gym Seamless Bra(3),,,
205.00 Dhs,Autre Cross Strap Sports Bra Women Push up Yoga Bra Cropped Tank Running Brassiere Fitness Tops Gym Running Vest wire Padded(pink),,,
119.00 Dhs,Autre 2019 Torridity Yoga Bra Athletic Underwear Women Sports Bras Running Gym Breathable Yoga Bra Fitness Jogging Bras Female(style 14),,,
102.00 Dhs - 114.00 Dhs,Autre 2019 Women Lace Bra Solid Straps Thin Seamless Wire Hollow Out Halter Push Up Breathable Lingerie Underwear(2-black),,,
141.00 Dhs,Autre 2019 Fashion Korean Style Women Pure Color PlSize Ultra thin Large Bra Sports Bra Full Bra Cup Tops Tee Shirt Femme Aesthetic(Beige),,,
223.00 Dhs,Autre YOGA Women's Light Cross Back WireRemovable Cups Yoga Sport Bra(Dark Forest10),,,
,,,,
,,,,
,,,,
,,,,
,,,,
,,,,
,,,,
,,,,
119.00 Dhs,Autre 2019 Torridity Yoga Bra Athletic Underwear Women Sports Bras Running Gym Breathable Yoga Bra Fitness Jogging Bras Female(style 14),,,
165.00 Dhs,Autre Back Cross Shockproof Sports Bras Women Gym Fitness Seamless Yoga Bra Push Up Bra(Blue),,,
123.00 Dhs,Autre Cotton Solid Sport Bra Fitness Running Yoga Bras Padded High Impact Workout Female Push UP Yoga Brassiere Sports Bra #A(Yellow),,,
111.00 Dhs,Autre Halter Sports Bra Women Ladies Sleeveless Lace Floral Crochet Bra Strapless Sweet Underwear Lingerie Bras(Gray),,,
218.00 Dhs,Autre orange pink seamless women sports bra crisscross strappy padded wirerunning bras shakeproof yoga bra (orange pink),,,
240.00 Dhs,Autre Women's Removable Pads Yoga Cross Strappy Back Sports Bra(Cherry Pink05),,,
117.00 Dhs,Autre Women Sport Bra Black Padded Yoga Brassiere Fitness Sports Tank Female Sport Yoga Bra Push Up Sports Bra#es(Pink),,,
131.00 Dhs,Autre Sport Bra S M L Breathable Sport Cup A D Sport Bra Fitness Cross Back Push Up Bra For Women Gym Running Yoga Bra Push Up(Black),,,
140.00 Dhs,Autre 2019 Sports Bras Sports Bras   Padded Seamless High Impact for Yoga Gym Workout Fitness tank tops biustonosz sportowy(Green),,,
221.00 Dhs,Autre Compression High Elastic Sports Bra Women Fitness Tops Gym Sportswear Running Vest Cloth Shockproof Yoga Bras(Black),,,
276.00 Dhs,"Autre Absorb Sweat Seamless Sports Bras, Women WirePadded Yoga Bra Underwear ,Athletic Vest Gym Fitness Running Tank Tops(White)",,,
190.00 Dhs,Autre Shockprook Sports Bra High Impact Women Yoga Bra Padded Gym Fitness Tops Racerback Workout Tank Tops Running Sport Bh(black),,,
