price,product,product_information,sells,stars
179.00 Dhs,Weekwiki Super Ensemble sport - Rouge-,,(62),3.2 out of 5
178.00 Dhs - 179.00 Dhs,"Corset, Débardeur, Sudation, Ceinture Minceur Abdo-minal pour Perte de Poids",,,
270.00 Dhs - 290.00 Dhs,Survette  Longue,,(12),4.3 out of 5
119.00 Dhs - 180.00 Dhs,SWEAT SHAPER DÉBARDEUR POUR PERTE DE POIDS POUR FEMMES,,(8),4.1 out of 5
179.00 Dhs,Weekwiki Top Survêtement Femme 2019 -Blanc-,,(8),3.5 out of 5
270.00 Dhs - 290.00 Dhs,Survette  Longue,,(13),4.4 out of 5
99.00 Dhs,SWEAT SHAPER DÉBARDEUR POUR PERTE DE POIDS POUR FEMMES,,,
290.00 Dhs - 299.00 Dhs,Survette  Longue,,(6),4.5 out of 5
270.00 Dhs,Survette  Longue,,(12),4.7 out of 5
202.00 Dhs,Autre Undershirt with elastic band open front short Les Chest Binder sport tank Bustiers Tomboy  bust bra nylon spandex(black),,,
270.00 Dhs,Survette  Longue,,(3),3.3 out of 5
75.00 Dhs,SWEAT SHAPER DÉBARDEUR POUR PERTE DE POIDS POUR FEMMES,,,
95.00 Dhs,Grain de Sable T-SHIRT,,,
149.00 Dhs,Weekwiki New Ensemble sport - Rouge-,,(4),1.5 out of 5
150.00 Dhs,Ensemble survêtement mobra miroir duveteux Rose gold  avec les poche pour les femmes,,,
149.00 Dhs,Weekwiki New Ensemble femme - Rouge-,,,
121.00 Dhs - 135.00 Dhs,Autre SWomen Workout Waist Trainer Cincher Corset Slimming  Sweat Belt Underbust Sport Girdle Body Shaper Postpartum Belt New(black),,,
149.00 Dhs,Weekwiki New Ensemble sport -Gris-,,(1),4 out of 5
67.00 Dhs,"Miss Belt Ceinture type corset, gaine , ligne amincissante, ventre plat",,,
202.00 Dhs,Autre Undershirt with elastic band open front short Les Chest Binder sport tank Bustiers Tomboy  bust bra nylon spandex(Nude),,,
69.00 Dhs,Lws> Gaine Abdominal sentir plus découpé et tonique instantanément,,,
169.00 Dhs,Weekwiki New Ensemble sport -Noir-,,(1),4 out of 5
55.00 Dhs,Kalenji SHORT JOGGING FEMME RUN DRY KALENJI NOIR,,,
204.00 Dhs - 228.00 Dhs,Autre Seamless Sports Bra flexible Pink Grey Yoga Bra For Women Workout Top(01 leggings),,,
59.00 Dhs,Cerceau 50/100 cm Pour Sport,,,
176.00 Dhs - 196.00 Dhs,Autre High Impact Sports Bra Camo Seamless Yoga Bra Gym Running Brassiere Women Fitness Sport Bra Cross Tops Women's Clothing(Purple),,,
110.00 Dhs,Autre Women Seamless Yoga Shirts Sport Bra Comfortable Bra Push Up for Sports Sleep Fitness Clothing 5 color(green),,,
131.00 Dhs,Autre Men Slimming Vest Body Shaper Neoprene Abdomen Fat Burning Shaperwear Waist Sweat Corset Weight Slimming Belly Sportswear(Full black),,,
131.00 Dhs,Autre Men Slimming Vest Body Shaper Neoprene Abdomen Fat Burning Shaperwear Waist Sweat Corset Weight Slimming Belly Sportswear(Gray),,,
245.00 Dhs,Kalini LEGGINGS RUN DRY POUR FEMME PANTALON JOGGING,,,
95.00 Dhs,Grain de Sable T-SHIRT,,,
169.00 Dhs,Grain de Sable LEGGING,,,
223.00 Dhs,Autre YOGA Women's Light Cross Back WireRemovable Cups Yoga Sport Bra(White02),,,
197.00 Dhs,Autre sport Les Tomboy  adjustable  corset Chest Binder Bustiers Undershirt tank with elastic band cotton short(Black),,,
112.00 Dhs,Autre Halter Sport Bra Women Leopard Print Tops V neck Backless Fitness Shirts Summer Bandage Unpadded Vest For Women(Leopard),,,
117.00 Dhs,Autre Fitness Bra As Seen on Tv Sport Woman Butt Lifter Trainer Lift Butt Hip Enhancer PlSize S 5XL Women Control Panties(338),,,
149.00 Dhs,Fashion 2 Pcs Tenue Fitness Femme: Pantalon Legging et Haut,,(4),4.3 out of 5
106.00 Dhs,Women Sexy Quick Drying Sweat Absorption Waterproof Leggings With Zipper,,,
139.00 Dhs,Grain de Sable T-SHIRT,,,
123.00 Dhs,Autre Women Push Up  Zipper Sports Brassiere Padded WireShockproof Breathable Sports Tops Fitness Gym Yoga Sports vest Bra Top(Purple),,,
,,,,
,,,,
,,,,
,,,,
,,,,
,,,,
,,,,
,,,,
74.00 Dhs,Women Sexy Buttock Lifting Trousers Candy Solid Color Leggings Yoga Pants,,,
205.00 Dhs,Autre Women's Hollow Yoga Gym Bras Sports Bra Sport Bh For Woman Brassiere Female Fitness Clothing Tops Women(Pink),,,
202.00 Dhs,Autre Woman Push Up Seamless Sport Bra Sports Fitness Women's Yoga Bras Bh Sporty Tops For Women Gym Underwear(Black),,,
114.00 Dhs,Autre Sports Bras Women Seamless Padded High Impact for Yoga Workout Fitness Push Up Gym Vest(BK),,,
198.00 Dhs,Autre Heal Orange Back Cross Sport Bra Zipper Push Up High Impact Sports Wear For Women Gym Women Fitness Bra Running Athletic Bra(Black),,,
226.00 Dhs,Autre 2019 Running Yoga Impact Camo Seamless Sports Bra Push Up Gym Sport Hollow Open Back Fitness Tops Active Workout(Lavender),,,
116.00 Dhs - 155.00 Dhs,Autre Fashion Women Sports Bras Yoga Fitness Stretch Workout Tank Female Girls Seamless Padded Racerback Sports Bra(Black),,(1),1 out of 5
145.00 Dhs - 162.00 Dhs,Autre Sports Bras Comfortable Gathering shockproof running sports underwear yoga ladies vest style adjustment large size bra A30521(BG),,(1),4 out of 5
164.00 Dhs,Autre XXL XXXL XXXXL Big Size Women Zipper Sports Bra Quick Dry Shockproof Sport Yoga Running Fitness Gym Sports Bra Top(Black),,,
223.00 Dhs - 249.00 Dhs,Autre S 3XL Large Size Women New Design Comfort Aire Bra Hollow Mesh Breathable Yoga Underwear Shockproof Sports Fitness Bras(White),,,
69.00 Dhs,MISSBELT Ceinture qui donne une Forme plus mince,,,
350.00 Dhs,Robe  TURC longue sportwear,,,
31.00 Dhs,Yuerlian Women Athletic Tights Running Gym Fitness Training Yoga Top Shirts  Blue,,,
123.00 Dhs,Autre Padded Women Wear Sports Bra Vest Yoga Push Up Bh Shockproof Running Tank Breathable Quick Dry Fitness Gym Underwear(1),,,
96.00 Dhs - 107.00 Dhs,Autre 2019 Summer Fitness Women's Elastic Lace Bandage Bra Female Cutout Lingerie Sports Bras Without Chest Pad New(9),,,
56.00 Dhs,Women Warm Winter Thick Footless Tights Skinny Slim Leggings Stretch Pants,,,
207.00 Dhs,Autre Sport Bra Tops for Women Fitness Cleavage Backless Quick Dry Gym Push Up Padded Seamless Sports Bras L(Blue),,,
128.00 Dhs,Autre sports bra female sports wear for women gym sports bra spandex anti sweat plsize fitness women black white yoga top(Red),,,
112.00 Dhs,Autre 2019 Sport Bra Unpadded Women Leopard Print Bra V neck Gather Fitness Tops Summer Bandage Halter For Women(White),,,
128.00 Dhs,Autre sports bra female sports wear for women gym sports bra spandex anti sweat plsize fitness women black white yoga top(rosered),,,
197.00 Dhs,Autre sport Les Tomboy  adjustable  corset Chest Binder Bustiers Undershirt tank with elastic band cotton short(Grey),,,
166.00 Dhs,Autre Pink Pulling Rope Shockproof Sports Bra Gym Hoodie Yoga Running Bra Tops Women Fitness Sport with Hat Sujetador Bralet (Pink),,,
197.00 Dhs,Autre sport Les Tomboy  adjustable  corset Chest Binder Bustiers Undershirt tank with elastic band cotton short(White),,,
105.00 Dhs - 117.00 Dhs,Autre Back Pocket High Quality Shock Sports Bra Women Shakeproof Yoga Bras Full Cup Fitness Bras Gym Sport Underwear(GRAY),,,
105.00 Dhs,Grain de Sable T-SHIRT,,,
95.00 Dhs,Grain de Sable T-SHIRT,,,
179.00 Dhs,"Corset, Débardeur, Sudation, Ceinture Minceur Abdo-minal Femme pour Perte de Poids",,,
219.00 Dhs,veste de sport bleu,,,
300.00 Dhs,Slimming Hot Shaper Cami Hot For Women,,,
202.00 Dhs,Autre Undershirt with elastic band open front short Les Chest Binder sport tank Bustiers Tomboy  bust bra nylon spandex(white),,,
109.00 Dhs,Fashion Sport Football Soccer Long Hosiery Socks Over Knee High Sock Baseball Hockey WH,,,
115.00 Dhs,Grain de Sable LEGGING,,,
96.00 Dhs,LiftSquat Letter Printed Women Running Yoga Pant Sport Exercise Trouser,,,
149.00 Dhs,Weekwiki New Ensemble sport -Noir-,,,
108.00 Dhs - 121.00 Dhs,Autre Women's High Intensity Zip Sports Bra WireYoga Bras Tank Zip Shakeproof Push Up Stretch Workout Running Bras Vest(Gray),,,
174.00 Dhs,Autre Posture Corrector Lift Up Bra Women New Desigh X bra Breathable Yoga Underwear Shockproof Sports Fitness Vest Bras( ),,,
60.98 Dhs,"Miss Belt Ceinture type corset, gaine , ligne amincissante, ventre plat",,,
190.00 Dhs,"Corset, Débardeur, Sudation, Ceinture Minceur Abdo-minal Femme pour Perte de Poids",,,
139.00 Dhs,Fashion 1 Pair Thigh High Hosiery Socks Over Knee Girls Football Hosiery Socks  Red,,,
209.00 Dhs,Fashion 5 Pairs Men Sports Running Five Finger Toe Hosiery Socks Elastic Short Soild Hosiery Socks,,,
,,,,
,,,,
,,,,
,,,,
,,,,
,,,,
,,,,
,,,,
199.00 Dhs,"Corset, Débardeur, Sudation, Ceinture Minceur Abdo-minal Femme pour Perte de Poids",,,
120.00 Dhs,Loose All-Match Casual Pants Haren Pants Summer Solid Color Wide Leg Pants-Yellow,,,
209.00 Dhs,Fashion 5 Pairs Men Sports Running Five Finger Toe Hosiery Socks Elastic Short Soild Hosiery Socks DG,,,
195.00 Dhs - 400.00 Dhs,minceur original pour perte poids femme,,,
223.00 Dhs,PIERYOGA 11821M1 Women Yoga Pants Black Bloomers Full Length Smooth Pants,,,
159.00 Dhs,Grain de Sable LEGGING,,,
599.00 Dhs,Weekwiki New Ensemble femme -Noir-,,(3),2.7 out of 5
91.00 Dhs,Female Ankle-length Bottoming Pants Middle-waisted Embroidery Pencil Trousers,,,
139.00 Dhs,"Corset Débardeur Sudation, Ceinture Minceur Abdo-minal Femme pour Perte de Poids",,,
187.00 Dhs - 193.00 Dhs,Fashion Style Womens 3D Print Yoga Skinny Workout Gym Leggings Sports Training Cropped Pants,,,
115.00 Dhs,Grain de Sable LEGGING,,(1),3 out of 5
139.00 Dhs,Fashion Men Sport Football Soccer Long Hosiery Socks Over Knee High Sock Baseball Hockey SB,,,
139.00 Dhs,Fashion Men Sport Football Soccer Long Hosiery Socks Over Knee High Sock Baseball Hockey YE,,,
139.00 Dhs,Fashion Men Sport Football Soccer Long Hosiery Socks Over Knee High Sock Baseball Hockey RD,,,
369.00 Dhs,Survêtement-Rose,,,
139.00 Dhs,Fashion Men Sport Football Soccer Long Hosiery Socks Over Knee High Sock Baseball Hockey WH,,,
159.00 Dhs,Fashion Men Sport Football Soccer Long Hosiery Socks Striped Hosiery Socks High Sock Baseball BU,,,
139.00 Dhs,Fashion Men Sport Football Soccer Long Hosiery Socks Over Knee High Sock Baseball Hockey BK,,,
369.00 Dhs,Survêtement gris,,,
450.00 Dhs,Survêtement Chic Femme - noir rose,,,
209.00 Dhs,Fashion 5 Pairs Men Sports Running Five Finger Toe Hosiery Socks Elastic Short Soild Hosiery Socks GY,,,
299.00 Dhs,"Miss Belt Ceinture type corset, gaine , ligne amincissante, ventre plat",,(1),3 out of 5
400.00 Dhs,Gaine minceur original pour perte poids femme,,(5),4.8 out of 5
349.00 Dhs,Reebok FEMMES FITNESS & ENTRAÎNEMENT TEE BLEU SPORT,,,
549.00 Dhs,Adidas T-shirt FEMMES CLIMACHILL TEE Noir Jaune,,,
549.00 Dhs,Adidas T-shirt FEMMES CLIMACHILL TEE Noir vert,,,
249.00 Dhs,Attayibat Survêtement tunique longue - Vert ,,(3),3 out of 5
499.00 Dhs,Adidas Supernova Tee femmes Maroon,,,
549.00 Dhs,Adidas Supernova Tee femmes Violet,,,
99.00 Dhs,"Miss Belt BYS WY Ceinture type corset, gaine , ligne amincissante, ventre plat",,,
88.00 Dhs,"Ceinture type corset, gaine , ligne amincissante, ventre plat",,,
125.00 Dhs,Ceinture Abdomen femmes    (corset ventre ),,,
295.00 Dhs,"Miss Belt Ceinture type corset, gaine , ligne amincissante, ventre plat",,,
150.00 Dhs,Ensemble survêtement mobra miroir duveteux BLeu  avec les poche pour les femmes,,,
150.00 Dhs,Ensemble survêtement mobra miroir duveteux Noir  avec les poche pour les femmes,,,
129.00 Dhs,Autre Women Sports Bras Fast Dry Elastic Shockproof Padded Gym Running Bra Solid color Fitness Yoga Sport breathable Tops Vest(black),,,
189.00 Dhs,Autre SevencolorSports Bra Pink High Impact 2019 Brassiere Push Up Padded Sport Bras Women Yoga Gym Running Underwear(Pink),,,
123.00 Dhs,Autre Women Push Up  Zipper Sports Brassiere Padded WireShockproof Breathable Sports Tops Fitness Gym Yoga Sports vest Bra Top(Blue),,,
134.00 Dhs,Autre S 6XL Large Size Women New Design Comfort BraMesh Breathable Yoga Underwear Shockproof Sports Fitness Bras M08(BK),,,
125.00 Dhs,Autre Womens Lace Sports Bra Breathable Widened Shoulder Straps Impact Sport Bra for Running Yoga Gym With U design(Purple),,,
,,,,
,,,,
,,,,
,,,,
,,,,
,,,,
,,,,
,,,,
134.00 Dhs,Autre S 6XL Large Size Women New Design Comfort BraMesh Breathable Yoga Underwear Shockproof Sports Fitness Bras M08(BK),,,
189.00 Dhs,Autre SevencolorSports Bra Pink High Impact 2019 Brassiere Push Up Padded Sport Bras Women Yoga Gym Running Underwear(Pink),,,
123.00 Dhs,Autre Women Push Up  Zipper Sports Brassiere Padded WireShockproof Breathable Sports Tops Fitness Gym Yoga Sports vest Bra Top(Blue),,,
203.00 Dhs,Autre Women Stylish Solid Double Dry High Compact Full Quick Dry Sports Exercise Bra(Orange),,,
198.00 Dhs,Autre Backless Sports Bra Fitness Bras Women Strappy Brassiere Sports Vest Gym Padded Yoga Bras Push up Running Underwear(Black),,,
113.00 Dhs,Autre Lady Women's Seamless Padded WireComfort Bra yoga Thin vest strap yoga sports bra home bra 6 colors(R),,,
138.00 Dhs,Autre New Womens Tops Vest Fashion Camisole Sleeveless T Shirt short shirt Running shirt fashion shirt for women Sports Bras(Black),,,
119.00 Dhs,Autre 2019 Torridity Yoga Bra Athletic Underwear Women Sports Bras Running Gym Breathable Yoga Bra Fitness Jogging Bras Female(style 7),,,
112.00 Dhs,Women Leggings Candy Color Skinny Ripped Hole Cut Out Leggings Tight-Pants,,,
223.00 Dhs,Autre Seamless Sports Bra Wireless High Impact Work Bra Padded Push Up Yoga Tpp Breathable Sports Wear For Women Gym(Purple),,,
123.00 Dhs,Autre Shockproof Athletic Vest Fitness Women Padded Running Gym Bra Gradient Sport Bra Breathable Sports Training Solid Yoga Bra(5),,,
240.00 Dhs,Autre Women Tight Sports Bras Medium Breathable Comfort LiNing Sport Bra AUBN022(AUBN022 3H),,,
177.00 Dhs,Autre Women Push Up Seamless Sports Bra Workout Female Sport Fitness Bh For Yoga Gym Brassiere Women's Sportswear(Green),,,
205.00 Dhs,Autre Deep V Design Sport Bra Women Fitness Yoga Bra Push Up Bra Back Cross  Running Gym Bra Vest(Black),,,
126.00 Dhs,Autre Brand Women Sport Padded Bra For Running Fitness Gym Padded Seamless Lace Underwear Push Up Yoga Tops Bra(Sky Blue),,,
248.00 Dhs,Autre Women Push Up Seamless Sports Bra Workout Female Sport Fitness For Yoga Gym Brassiere Women's Sportswear(Pink),,,
201.00 Dhs,Autre Women Backless Sports Bra High Stretch Yoga Sports Wear For ladies Gym Shockproof Running Sport Bra Push Up(White),,,
121.00 Dhs,Autre Quick dry Fitness Shockproof Sport Bra For Women Running Breathable Yoga bra Mesh Seamless Underwear Tank 5Colour(White),,,
198.00 Dhs,Autre Seamless sports bra padded yoga bras for women fitness sport bra open back gym workout strappy bra high impact top(4),,,
119.00 Dhs,Autre PlSize S 3XL Women Yoga Sports Bra High Impact Breathable Bra with Removable Pads Workout Tank short Running Sport Bra(Black),,,
104.00 Dhs,Autre Fitness Bra Women Fitness Yoga Sports Bra For Running Gym Padded Wire Stretch Shake Proof Underwear Solid Color(White),,,
233.00 Dhs,Autre Colorvalue Cross Straps Gym Sports Bra Women Wireless Yoga Fitness Padded Push Up Yoga Bra Activewear XS XL(Black),,,
192.00 Dhs,Autre Women Mesh seamless  sports bra quick dry Fitness bra  yoga Running vest  sports underwear girl gym clothes(Lavender),,,
125.00 Dhs,Autre Womens Lace Sports Bra Breathable Widened Shoulder Straps Impact Sport Bra for Running Yoga Gym With U design(Skin),,,
117.00 Dhs,Autre Women Lady lace Yoga Vest Seamless Fitness Sports Bra Tops Gym Underwear Bras 6 Colors M L XL(Black),,,
189.00 Dhs,Autre Women Push Up Seamless Sports Bra Workout Female Sport Fitness Bh For Yoga Gym Brassiere Women's Sportswear(Lavender),,,
193.00 Dhs,Autre Seamless Sport Bra Gym Bra Fitness Yoga Padded Tops Running Athletic Vest CrossSportsWear Active Wear(C),,,
193.00 Dhs,Autre Sports Bra Sportswear Push Up Running Padded Training Yoga Bra Workout Active Jogger Women Fitness Gym Hollow Out(Purple),,,
128.00 Dhs,Autre Women Fitness Yoga Push Up Sports Bra Gym Running Padded Shockproof Quick Dry Tank PlSize Bra 6 Colors(Gray),,,
180.00 Dhs,Autre 2019 new women yoga sports bra female sport fitness shirt workout running clothes sports vest wear for women gym top(Brown),,,
105.00 Dhs,Autre Women Yoga Fitness Sports Bra Comfortable Vest Bra Seamless Slim Underwear(Nude),,,
129.00 Dhs,Autre Women Fitness Yoga Sports Bra For Running Gym Sport Bra Padded WireShakeproof Underwear Push Up Front Zipper Sport Bra(Black),,,
118.00 Dhs,Autre 10 Color Plsize Absorb Sweat Athletic Running Women Sports Bra Gym Fitness Seamless Padded Vest Tanks(Red),,,
180.00 Dhs,Autre Women Seamless Sports Bra Fitness Push up Femme Sportswear Workout Solid Color sports wear for women gym(Brown),,,
121.00 Dhs,Autre Sports Bra 5 Colors Ladies Padded Push up Yoga Fitness Daily Wear Wire Bra Seamless Full Cup Solid Sports Top(Blue),,,
162.00 Dhs - 180.00 Dhs,Autre Mens Weight Loss Waist Trainer Vest  Sweat Body Shaper Tank Slimmer Trimmer Zweet Body Shaper Compressie Workout Tank Top( ),,,
129.00 Dhs,Autre Seamless Padded Sports Bra Women Push Up Shockproof Yoga Fitness Underwear Elastic Breathable Workout Running Tank Tops(Green),,,
185.00 Dhs,Autre Seamless Sports Bra Female Sport Bh Woman Yoga Bras For Fitness Women Gym Brassiere Cross Tops Women's Clothing(Red),,,
209.00 Dhs - 232.00 Dhs,Autre Women Yoga Shirts Running Vest Push Up Sports Bra Yoga Gym Tank Shockproof Padded Workout Fitness Bra Lady Athletic Yoga Bra(Red),,,
116.00 Dhs,Autre 7 Colors Women Yoga Sport Bra Fitness Running Vest sleep Underwear Padded Tops Underwear No Wire rim Female gym bras(Black),,,
,,,,
,,,,
,,,,
,,,,
,,,,
,,,,
,,,,
,,,,
185.00 Dhs,Autre Seamless Sports Bra Female Sport Bh Woman Yoga Bras For Fitness Women Gym Brassiere Cross Tops Women's Clothing(Red),,,
209.00 Dhs - 232.00 Dhs,Autre Women Yoga Shirts Running Vest Push Up Sports Bra Yoga Gym Tank Shockproof Padded Workout Fitness Bra Lady Athletic Yoga Bra(Red),,,
116.00 Dhs,Autre 7 Colors Women Yoga Sport Bra Fitness Running Vest sleep Underwear Padded Tops Underwear No Wire rim Female gym bras(Black),,,
176.00 Dhs,Autre Athletic Running Sports Bra Yoga Brassiere Workout Gym Fitness Women Seamless High Impact Padded Underwear Vest Tanks(Blue),,,
114.00 Dhs,Autre Women Seamless Thin Bra Vest Fitness Yoga Stretch Bras Women Padded Sports Bra Solid Color Comfortable Beathable Bra(Black),,,
248.00 Dhs,Autre Women's seamless sports bra for running workout gym high impact fitness yoga bra quick(black),,,
113.00 Dhs,Autre High Quality Women Seamless Wire Padded Fitness Vest Tank Comfort Yoga Sport Bra sports bra plsize(White),,,
176.00 Dhs,"Autre Women Sports Bra Shockproof Running Yoga Bras Cropped Tops, Seamless WireGym Fitness Vest Workout Tank Top(Black)",,,
165.00 Dhs,Autre Back Cross Shockproof Sports Bras Women Gym Fitness Seamless Yoga Bra Push Up Bra(MICAI PURPLE),,,
198.00 Dhs,"Corset, Débardeur, Sudation, Ceinture Minceur Abdo-minal Femme pour Perte de Poids",,,
214.00 Dhs,Autre U Type Women Push Up Seamless Sports Bra Workout Gym Fitness Running Bra Women's Yoga Bra Vest (Beige),,,
108.00 Dhs,Autre Women Yoga Sports Bra Comfortable Lace Leisure Gym Athletic Padded Seamless Stretch Vest(Black),,,
143.00 Dhs,Autre Absorb Sweat Athletic Running Gym Fitness Women Sports Bra Padded Vest deportivo camisa mujer(Blue),,,
132.00 Dhs,Autre Women's Mesh Strappy Back Cami Crisscross Yoga Sports Bra(Pink03),,,
148.00 Dhs,Autre Fitness Yoga Push Up Sports Bra for Womens Gym Running Padded Tank Athletic Vest Underwear Shockproof Strappy Sport Bra (Green),,,
166.00 Dhs,Autre Pink Pulling Rope Shockproof Sports Bra Gym Hoodie Yoga Running Bra Tops Women Fitness Sport with Hat Sujetador Bralet (Yellow),,,
214.00 Dhs,Autre U Type Women Push Up Seamless Sports Bra Workout Gym Fitness Running Bra Women's Yoga Bra Vest (gray blue),,,
126.00 Dhs,Autre 3 Styles Padded Yoga Bra Tops Ladies Breathable Push Up Vest Women Jogging Sport Shockproof Fitness Bra Seamless Tank Tops(Style2 Blue),,,
216.00 Dhs,Autre Women Shockproof Seamless Sports Bra Back Chinese Knot  Design Yoga Bra Push Up Padded Workout Bra(Pink),,,
113.00 Dhs,Autre Women Quick Drying Padded Yoga Shirt Sports Bra Push Up Dry Tank Tops For Running Fitness Gym Bras PlSize(Black),,,
147.00 Dhs,Autre Women Zipper Push Up Sports Bras Vest Underwear Shockproof Breathable Gym Fitness Athletic Running Yoga Bh Sport Tops(Blue),,,
131.00 Dhs,Autre Fitness Sports Bra Women Running Yoga Bra Push Up Sport Bra Athletic Vest Yoga Padded Brassiere Sport Soutien Gorge(Green),,,
180.00 Dhs,Autre Shoulder Solid Sports Bra Women Fitness Yoga Bras Gym Padded Sport Athletic Underwear Workout Running Clothing(Black),,,
117.00 Dhs,Autre Women's Sports Underwear Shock proof Yoga Gathering Bra Sports Workout Athletic Solid 2019(BU),,,
223.00 Dhs,Autre 2019 Women Seamless Sports Bra for Fitness Gym Yoga Running Pad Cropped SportsWear Tank Tops Sports Gym Seamless Bra Women(Red),,,
123.00 Dhs,Autre Fitness Sports Bra Women Running Yoga Bra Push Up Sport Bra Athletic Vest Yoga Padded Brassiere Sport bras(blue),,,
198.00 Dhs,Autre New Women's High Impact Personality oblique shoulder strap Sports Bra Women running fitness Bra clothes(Red),,,
117.00 Dhs,Autre Multicolored Women Sports Bra Ladies Fitness Gym Running Yoga Soft Stretchy Padded Straps Sport Bras Tops V2(Black),,,
130.00 Dhs,Autre Women's Seamless High Impact Sports Bra with Removable Cups High Pink Workout Yoga Bra Back Cutout Activewear(pink),,,
125.00 Dhs,Autre Fitness Sports Bra Women Running Yoga Bra Push Up Sport Bra Athletic Vest Yoga Padded Brassiere Sport Soutien Gorge(Gray),,,
205.00 Dhs,Autre Cross Strap Sports Bra Women Push up Yoga Bra Cropped Tank Running Brassiere Fitness Tops Gym Running Vest wire Padded(Black),,,
193.00 Dhs,Autre Seamless Racerback Sports Bra Women's Gym Yoga Running Boxing Active High Control Wireless Comfort Bra Large Size(Grey Neon Yellow),,,
223.00 Dhs,Autre YOGA Women's Light Cross Back WireRemovable Cups Yoga Sport Bra(Light Pink05),,,
112.00 Dhs,Autre Women Seamless Wire Padded Fitness Vest Tank Comfort Yoga Sport Bra sports bra plsize High Quality(Red),,,
126.00 Dhs,Autre Women Sports Bra Quick Dry Padded Shockproof Gym Fitness Running Yoga Sport Brassiere Tops(gray),,,
192.00 Dhs,Autre Women Mesh seamless  sports bra quick dry Fitness bra  yoga Running vest  sports underwear girl gym clothes(Blue),,,
107.00 Dhs,Autre 2019 Summer Fitness Women's Lace Bandage Cutout Lingerie Sports Bras Elastic Bandage Bra Without Chest Pad(14),,,
166.00 Dhs,Autre 2019 New Style Women Fitness Bra Sports Yoga Running Bra High Quality Lady Sportswear Sports For Female(White),,,
159.00 Dhs,Fashion Men Sport Football Soccer Long Hosiery Socks Striped Hosiery Socks High Sock Baseball DB,,,
270.00 Dhs,Autre PlSize XXL Absorb Sweat Yoga Sports Bra For Women Breathable Athletic Running Tops Vest Seamless Padded Gym Fitness Underwear(White),,,
,,,,
,,,,
,,,,
,,,,
,,,,
,,,,
,,,,
,,,,
122.00 Dhs,Autre Women's Wireless Moving Comfort Sports Bra(White),,,
125.00 Dhs,Autre Fitness Sports Bra Women Running Yoga Bra Push Up Sport Bra Athletic Vest Yoga Padded Brassiere Sport Soutien Gorge(Purple),,,
159.00 Dhs,Fashion Men Sport Football Soccer Long Hosiery Socks Striped Hosiery Socks High Sock Baseball DB,,,
131.00 Dhs,Autre Women Yoga Bra PlSize Patchwork Sports Bra Gym Cross Backless Bra Yoga Padded Mujer Strappy Cropped Fitness(white),,,
177.00 Dhs,Autre Sport Bra for Women Breathable Yoga Tops Pad Fitness Running Gym Push Up Brassiere Cross Back Strap Sports Bras(gradient grey),,,
117.00 Dhs,Autre Women's Sports Underwear Shock proof Yoga Gathering Bra Sports Workout Athletic Solid 2019(SB),,,
213.00 Dhs,Autre Adjustable Back Buckle Women Sports Bra Push Up Running Yoga Bra Shockproof Breathable Hollow Gym Fitness Bra(Black),,,
107.00 Dhs,Autre 2019 Summer Fitness Women's Elastic Lace Bandage Bra Female Cutout Lingerie Sports Bras Without Chest Pad New(17),,,
123.00 Dhs,Autre Padded Women Wear Sports Bra Vest Yoga Push Up Bh Shockproof Running Tank Breathable Quick Dry Fitness Gym Underwear(2),,,
105.00 Dhs,Autre Women Yoga Fitness Sports Bra Comfortable Vest Bra Seamless Slim Underwear(White),,,
130.00 Dhs,Autre New 8888 No Rims Ladies Yoga Bra Running Fitness Underwear(Gray),,,
130.00 Dhs,Autre Women Cross Yoga Sports Bra Sport Bh For Female Brassiere Woman Fitness Tops Gym Bras Brassiere Women's Clothing(rose Red),,,
129.00 Dhs,Autre 7 Color Fitness Yoga Push Up Sports Bra Women Gym Running Padded Tank Athletic Vest Underwear Shockproof Zipper Sports Bra (Black),,,
131.00 Dhs,Autre Training High Stretch Breathable Sports Bra Fitness Women Shockproof Padded Sport Bra for Running Yoga Gym Seamless Bra(5),,,
191.00 Dhs,Autre Women Sports Bra Tops High Impact for Fitness Yoga Running Pad Cropped SportsWear Tank Tops Sports Push Up Bra Women(BRA.FY.3-blue),,,
126.00 Dhs,Autre Yoga patchwork Bras Push Up Sports Bra Yoga Running Fitness Yoga Bras Padded Stithching color Sports Female(gary),,,
176.00 Dhs,Autre Women Padded Solid Sport Bra Tops Yoga Bra Black Gray Sport Underwear Run Jogging Yoga Gym Fitness Push Up Sports Bra Yoga Vest (BLA),,,
240.00 Dhs,Autre Shockproof High Impact Pink Sports Bra Women Net Yarn Padded Yoga Bra Breathable Fitness Tank Cropped Gym Clothing(3),,,
129.00 Dhs,Autre Women Fitness Yoga Sports Bra For Running Gym Adjustable Spaghetti Straps Padded Seamless Athletic Vest S M L (Black),,,
122.00 Dhs - 136.00 Dhs,Autre Summer Women's tight fitting yoga strap vest female sports fitness clothes breathable sports running bra jogging shirt(Yellow),,,
372.00 Dhs,Autre PlSize M 3XL Zipper Push Up Sports Bra For Women Shockproof Padded Fitness Yoga Bras Athletic Gym Running Sports Tops Vest(Red),,,
201.00 Dhs,Autre seamless sports bra workout gym high impact padded yoga bra women yoga seamless gym vest(Purple),,,
222.00 Dhs,Autre Back Mesh Triangle Push Up Sports Bra Fitness Racerback Bras Women Gym Sport Padded Yoga Bras Running Underwear(Black),,,
128.00 Dhs,Autre 4 Colors Women Zipper Push Up Sports Bras Padded WireShockproof Gym Fitness Athletic Running Yoga Vest Sports Tops(Red),,,
149.00 Dhs - 189.00 Dhs,"Corset, Débardeur, Sudation, Ceinture Minceur Abdo-minal Femme pour Perte de Poids",,,
126.00 Dhs,Autre Women Workout Tank Gym Stretch Hollow Yoga Sports Running Bra Padded(Black),,,
234.00 Dhs,Autre Shockproof Sports Bra Underwear Women's Running Fitness Yoga Backless Sportswear Seamless Push Up For Female Workout(Orange),,,
