price,product,product_information,sells,stars
122.00 Dhs,Autre women Sports Bras Fitness Sports Bra Shockproof Shapes Quick Dry Running Gym Adjustable Underwear push up Yoga Bra Top(purple),,,
141.00 Dhs,Autre 2019 new fashion women Sports Bras Padded Seamless High Impact for Yoga Workout Fitness Yoga Sports bra underwear A30521(BK),,,
161.00 Dhs,Autre Women's Seamless Sports Bras Lace Cross Front Side Buckle Closure Bra Wireless Yoga Running Vest For Fitness Underwear(Blue),,,
243.00 Dhs,Autre Running Fitness Yoga Sports Bra Yoga Gym Bra Women Quick Dry Shirt Sleeveless High Stretch Breathable(Rose Red),,,
120.00 Dhs,Autre 5 Colors Sports Bra Ladies Padded Push up Yoga Fitness Daily Wear Wire sleep Bra Seamless Full Cup Solid Sports Top(Black),,,
129.00 Dhs,Autre 2019 New Yoga Gym Running Bra Breathable Sport Bra For Fitness Women High Stretch Tank Push Up Vest Underwear Black Yoga Bra(black with pink),,,
,,,,
,,,,
,,,,
,,,,
,,,,
,,,,
,,,,
,,,,
117.00 Dhs,Autre 8 Colours Sport Bra For Women Gym Running Yoga Sport Bra Set Girl Underwear High Quality Women Fitness Sport Bra(WHITE),,,
167.00 Dhs,Autre Women Breathable Mesh Sports Bras Shockproof Padded Athletic Gym Running Bra Solid Seamless Fitness Yoga Sport Tops Vest(Black),,,
191.00 Dhs,Autre Push Up Sports Bra High Impact Running Padded Women Seamless Brassiere Sport Bra For Yoga Fitness Workout Active Wear(Blue),,,
198.00 Dhs,Autre 2019 New Camo Seamless Sports Bra For Women Gym Criss Cross Workout Bras High Impact Bras Fitness Yoga Bra(Purple),,,
198.00 Dhs,Autre Sport Bra Fitness Gym Women Strappy Vest Seamless Padded Yoga Bras Training Tank Push up Running Underwear(2),,,
123.00 Dhs,Autre Sports Bra Full Cup Breathable Shockproof Cross Back Push Up Workout Bra For women Gym Running Jogging Yoga Fitness Bra(grey(with pad)),,,
203.00 Dhs,Autre Women Stylish Stretch Double Strappy High Shockproof Sport Jogging Bra with Built in Padds(Gold),,,
165.00 Dhs,Autre Double Layer Zipper Sports Bra Ladies Fitness Yoga Bra Push Up High Padded Shirt Underwear Running Vest Gym Exercise Sportswear(black),,,
130.00 Dhs,Autre Sport Bra Women Fitness Strappy Backless Yoga Bra Patchwork Gym Running Tank Tops Sportswear(Black),,,
226.00 Dhs,Autre 2019 Running Yoga Impact Camo Seamless Sports Bra Push Up Gym Sport Hollow Open Back Fitness Tops Active Workout(Black),,,
126.00 Dhs,Autre White Women's Sport Bra Push Up Workout Yoga Sports Shirts Gym Academia Fitness Brassiere Vest tank Top(Black),,,
117.00 Dhs - 131.00 Dhs,Autre Women Zipper Push Up Sports Bra Padded Shockproof Gym Fitness Athletic Running Yoga Vest Sport Tops Shake Underwear Fitness(Orange),,,
173.00 Dhs - 192.00 Dhs,Autre Women Mesh seamless  sports bra quick dry Fitness bra  yoga Running vest  sports underwear girl gym clothes(Black),,,
240.00 Dhs,Autre Shockproof High Impact Pink Sports Bra Women Net Yarn Padded Yoga Bra Breathable Fitness Tank Cropped Gym Clothing(1),,,
115.00 Dhs,Autre Sports bra Black White  Intimates Quick drying Flesh Women Girl Thin No Mat Athletic Vest Fitness Sports Yoga Stretch Bra(1),,,
221.00 Dhs,Autre Fitness Sports Bra Women Gym Yoga Bra Tops Sportswear For Women Sport Push Up Brassiere Workout Fitness Padded Yoga  (Green),,,
117.00 Dhs,Autre Pop Women's Breathable Yoga Bra Running Fitness Detachable Mat Comfortable Underwear Solid Color Sports Bra(White),,,
114.00 Dhs,Autre Summer Style Women Cotton Stretch Athletic Vest Gym Fitness Sports Bra no rims Full Cup padded bras colorful plsize tops(black),,,
164.00 Dhs,Autre Seamless Sports Bra Fitness Women Racerback Running Tops Pink Workout Padded Yoga Bra High Impact Activewear(pink),,,
131.00 Dhs,Autre Fitness Sports Bra Women Running Yoga Bra Push Up Sport Bra Athletic Vest Yoga Padded Brassiere Sport Soutien Gorge(Purple),,,
135.00 Dhs,Autre SWomen Workout Waist Trainer Cincher Corset Slimming  Sweat Belt Underbust Sport Girdle Body Shaper Postpartum Belt New(rose red),,,
119.00 Dhs,Autre Women Absorb Sweat Vest Sports Gym Shaped Bra Back No Wheels Wireless Sports Bra(Orange),,,
117.00 Dhs,Autre High Stretch Breathable Sports Bra Fitness Women Padded Sport Bra for Running Yoga Gym Seamless Bra Gradient(Black),,,
114.00 Dhs,Autre Sport Women Cross Neck Backless Wrapped Thread Lingerie Bra Chest Wrap Bra(Army Green),,,
125.00 Dhs,Autre Women Sports Bra Wire Running Lingerie Seamless Workout Padded Yoga Comfortable Soft Push Up Quick Dry Fitness(Blue),,,
116.00 Dhs,"Autre Absorb Sweat Quick Drying Sports Bra,Fitness Padded Stretch Workout Vest Running Wireless Underwear for Women(5)",,,
193.00 Dhs,Autre Sports Bra Sportswear Push Up Running Padded Training Yoga Bra Workout Active Jogger Women Fitness Gym Hollow Out(Black),,,
223.00 Dhs,Autre New arrival Yocndux Women Sports Bra Women Fitness Winding Yoga Bra Gym sports High elasticity brassiere sport  (Black),,,
123.00 Dhs,Autre Women Sports Bra Underwear Yoga Push Up Shakeproof Vest Running Padded Workout Breathable Quick Dry Fitness Gym Tank Top(4),,,
198.00 Dhs,Autre Sports Bra For Women Fitness High Impact Yoga Bra Sport Shockproof Bra Cross Workout Gym Yoga Tops  Push Up Sportswear(Black),,,
193.00 Dhs,Autre Women Sport Bra Seamless Gym Bra Yoga Tops Fitness Workout Running Athletic Vest CrossActive wear(Purple),,,
117.00 Dhs,Autre 8 Colours Sport Bra For Women Gym Running Yoga Sport Bra Set Girl Underwear High Quality Women Fitness Sport Bra(GREEN),,,
276.00 Dhs,"Autre Absorb Sweat Seamless Sports Bras, Women WirePadded Yoga Bra Underwear ,Athletic Vest Gym Fitness Running Tank Tops(5 Colors)",,,
201.00 Dhs - 223.00 Dhs,Autre Women Seamless Sports Bras Nepoa Gym Vrouwen Energie Shark Long Sleeve Seamless Sports Bra(White Grey Top),,,
136.00 Dhs,Autre New Style Women's Summer Tank Tops Sleeveless T Shirt Sports Vest Blouse bra sujetador deportivo push up ( ),,,
117.00 Dhs,Autre PlSize Women Quick Dry Tight Compressed Pad Yoga Shirt Sports Bra Push Up Tank Tops Running Fitness Gym Bras(2),,,
189.00 Dhs,Autre Backless Push Up Sports Bra Fitness Women Seamless Gym Bra Padded Yoga Bra Sport bh Running Workout Active Wear(Black),,,
115.00 Dhs,Autre Sports Bra Patchwork Back Cross Padded Push Up Bra Breathable Seamless Stretch Athletic Gym Vest Women Fitness(purple),,,
129.00 Dhs,Autre 7 Color Fitness Yoga Push Up Sports Bra Women Gym Running Padded Tank Athletic Vest Underwear Shockproof Zipper Sport Bra(white),,,
216.00 Dhs,Autre Colorvalue Double Straps Yoga Sport Bras Women Shockproof High Fitness Workout Bras Plain Padded Running Gym Top(Light Pink),,,
,,,,
,,,,
,,,,
,,,,
,,,,
,,,,
,,,,
,,,,
110.00 Dhs,Autre Women Seamless Yoga Shirts Sport Bra Comfortable Bra Push Up for Sports Sleep Fitness Clothing 5 color(red),,,
108.00 Dhs,Autre NEW Womens Sports Bras Thin No Mat Athletic Vest Fitness Sports Yoga Stretch running Fitness Bra S XXXL #3n12(Flesh),,,
138.00 Dhs,Autre New Womens Tops Vest Fashion Camisole Sleeveless T Shirt short shirt Running shirt fashion shirt for women Sports Bras(White),,,
130.00 Dhs,Autre Woman Sports Bra Push Up Tops For Women Gym Pink Brassiere Sport Bra Criss Cross  Female Yoga Bra(Purple),,,
99.00 Dhs - 111.00 Dhs,Autre Stylish Gym Fitness Sports Bra Cotton Push Up Stretch Athletic Vest No Rims Breathable Full Cup Padded Bras PlSize Top(purple),,,
191.00 Dhs,Autre Seamless Sport Bra Women Girls Gym Workout Fitness Yoga Bra Padded Push Up Sports Bra Seamless Shockproof Bra(black),,,
113.00 Dhs,Autre Comfort Sports Bras Lace Trim Size Women Padded Wireless Yoga Gym Bra Clothing(Black),,,
128.00 Dhs,Autre Women's Sports Bra Breathable Mesh Shockproof Thicken Sports Gym Running Seamless Fitness Yoga Vest Sports Bra(Black),,,
128.00 Dhs,Autre Breathable Sports Bras Women Hollow Out Padded Sports Bra S XXL XXXL PlSize Gym Running Fitness Yoga Sports Tops(White),,,
202.00 Dhs,Autre Women Academia Black Criss Cross Gym Yoga Sports Bra For Female Compression Fitness Wear Sport Femme Brassiere Woman(Black),,,
193.00 Dhs,Autre Gym Bra Fitness Sports Yoga Sportswear Push Up Camo Workout Active Running Training Seamless Padded Bra Women(Green),,,
115.00 Dhs,Autre Summer Women Stretch Athletic Vest Gym Fitness Sports Bra No Rims Full Cup Solid Bras Tops Q88 B2Cshop(Rose Red),,,
169.00 Dhs,Autre Women Solid Sport Bra Back Pocket Running Yoga Bras Padded High Impact Workout outdoor equipments Sports Bra #3(B),,,
199.00 Dhs,Autre High Impact Sports Bra for Women Padded Push Up Yoga Bra Gym Fitness Sport Tops Wireless Underwear Women Sportwear(Black),,,
126.00 Dhs,"Autre Gradient High Stretch Sports Bra for Women,Quick Dry Padded HBack Sports Top,Seamless Yoga Running Fitness Sport Bra Top(Pink)",,,
282.00 Dhs,"Autre Women PlSize XL XXL Zipper Sports Bras,Padded Push Up WireBreathable Sports Tops,Fitness Gym Yoga Sports Bra Top(Orange)",,,
145.00 Dhs,Hot Cami Shapers Corset Fast Perspiration Tops,,,
108.00 Dhs,Autre NEW Womens Sports Bras Thin No Mat Athletic Vest Fitness Sports Yoga Stretch running Fitness Bra S XXXL #3n12(Black),,,
106.00 Dhs,Autre Women Seamless Fitness Running Gym Sports Yoga Bra Sports Bra No Rims Paded Underwear Shockproof Sport Bra Top(white),,,
240.00 Dhs,Autre NEW zumaba Bra and zunaba Bra zunaba sport Bra zunaba yoga tops bra GUANMSSB112(f-yellow),,,
162.00 Dhs,Autre Sports Bras Comfortable Gathering shockproof running sports underwear yoga ladies vest style adjustment large size bra A30521(BK),,,
225.00 Dhs,Autre Women's seamless sports bra workout army green gym high impact fitness yoga bra brackless strappy sports bra (Purple),,,
111.00 Dhs,Autre Women Fitness Sports Bra Striped Lingerie Seamless Bra Running Gym Quick Dry Breathable WireVest Underwear #2S20FN(Black),,,
180.00 Dhs,Autre 2019 new women yoga sports bra female sport fitness shirt workout running clothes sports vest wear for women gym top(Red),,,
193.00 Dhs,Autre Gym Bra Fitness Sports Yoga Sportswear Push Up Camo Workout Active Running Training Seamless Padded Bra Women(Purple),,,
192.00 Dhs,Autre Anti sweat Sports Bra High Stretch Breathable Fitness Women Padded for Running Yoga Gym Seamless Bra Gradient Sport Bra(Blue),,,
183.00 Dhs,Autre Women's Sports Bras For Running With Removable Cups Push Up Yoga Bra Seamless Back Strappy Fitness Athletic Bra Tops(black),,,
220.00 Dhs,"Autre Women's Low Impact Mesh Back Sports Bra With Removable Pads For Yoga,Pilates,Barre(Black01)",,,
203.00 Dhs,Autre Women Sports Bra Fitness Padded Can Adjusted Shoulder Straps Stripe Running Push up Yoga Bra Top(Sky Blue),,,
117.00 Dhs,Autre Women Workout Stretch Tank Yoga Padded Vest Sport Bra Tops Racerback Sports Bra(Green),,,
119.00 Dhs,Autre Absorb Sweat Quick Drying Sports Gym Push Up Bra Fitness Padded Stretch Workout Vest Running Sleeveless Yoga Underwear Women(1),,,
111.00 Dhs,"Autre Women Absorb Sweat Quick Drying Sports Bra,Fitness Padded Stretch Workout Vest Running Wireless Underwear Hot(1)",,,
111.00 Dhs,Autre Halter Sports Bra Women Ladies Sleeveless Lace Floral Crochet Bra Strapless Sweet Underwear Lingerie Bras(Navy Blue),,,
183.00 Dhs,Autre SevencolorHigh Impact Sports Bra Seamless Women Padded Push Up Workout Fitness Gym Yoga Sport Bras Tank Top(Red),,,
114.00 Dhs,Autre Women Workout Stretch Tank Yoga Padded Vest Sport Bra Tops Racerback Sports Bra(White),,,
192.00 Dhs,Autre Women Sports Bra High Impact for Fitness Yoga Running Pad Cropped SportsWear Tank Tops Sports Push Up Bra Women (White),,,
107.00 Dhs,Autre 3 Colors Women Lady Yoga Vest Black White Nude Seamless Fitness Sports Bra Tops Gym Underwear Bras(ND),,,
232.00 Dhs,Autre YOGA Women's WirePadded Strappy Back Workout Yoga Sports Bra(White02),,,
125.00 Dhs,Autre Fitness Sports Bra Women Running Yoga Bra Push Up Sport Bra Athletic Vest Yoga Padded Brassiere Sport Soutien Gorge(Blue),,,
120.00 Dhs,Autre Women Sport Bra Black Padded Yoga Brassiere Fitness Sports Tank Female Sport Yoga Bra Push Up Sports Bra 2019 (7),,,
,,,,
,,,,
,,,,
,,,,
,,,,
,,,,
,,,,
,,,,
120.00 Dhs,Autre Women Sport Bra Black Padded Yoga Brassiere Fitness Sports Tank Female Sport Yoga Bra Push Up Sports Bra 2019 (7),,,
121.00 Dhs - 135.00 Dhs,Autre Women Zipper Push Up Sports Bras Vest Underwear Shockproof Bra Breathable Gym Fitness Athletic Running Yoga Sport Bras Tops(white),,,
389.00 Dhs,Autre Performance Women Base Layer Sports Bras Medium Fitness Tight LiNing Sport Bra Tops AUBN034 WBJ176(AUBN034-6H),,,
132.00 Dhs,Autre Women Fitness exercise Sports Bra Push Up Breathable Yoga Bras Underwear GYM lady Running Neon Color Quick Dry(Pink),,,
169.00 Dhs - 189.00 Dhs,Autre Pink Seamless Sports Bra High Impact Strappy Gym Tops Women Brassiere Yoga Fitness Running Sport Bras Padded Push Up Active Wear(Pink),,,
196.00 Dhs,Autre Female Sport Bh Hollow Brassiere Femme Tops Womens Mesh Yoga Gym Sports Bra Woman Fitness Clothing For Women(Black),,,
198.00 Dhs,Autre Sport Bra Fitness Gym Women Strappy Vest Seamless Padded Yoga Bras Training Tank Push up Running Underwear(X2),,,
113.00 Dhs,Autre Women Fitness Bra Padded Compression Sport Bra Sportswear Quick Dry Elastic Running Yoga Bra RED(Purple),,,
270.00 Dhs,Autre PlSize XXL Absorb Sweat Yoga Sports Bra For Women Breathable Athletic Running Tops Vest Seamless Padded Gym Fitness Underwear(Green),,,
249.00 Dhs,Autre Colorvalue Vest Type Fitness Camo Sports Bras Women Breathable Workout Training Bras Mid Gym Yoga Brassiere(Dark Grey),,,
128.00 Dhs,Autre Women Sports Bra Padded Push Up Shockproof Seamless Wire Workout Training Gym Fitness Sports Bra Top(Black),,,
114.00 Dhs,Autre NEW Womens Sport Bra Fitness Yoga Running Vest Underwear Padded Tops Underwear 7 Colors No Wire rim Bras Female(Red),,,
115.00 Dhs,Autre Sports Bra Patchwork Back Cross Padded Push Up Bra Breathable Seamless Stretch Athletic Gym Vest Women Fitness(white),,,
180.00 Dhs,Autre 2019 Women Topos High Impact Sports Bra for SportsWear Fitness Yoga Run Pad Cropped Sports Tops Push Up Women Bra(Brilliant orange),,,
247.00 Dhs,Autre Double Layer Contrast Sports Bra Women's Red&Navy High Impact Workout Gym Bra for Yoga and Running  Padded Top(Red),,,
324.00 Dhs - 361.00 Dhs,Autre Naturehike Quick drying underwear suits for men and women skiing outdoor function wicking thermal underwear(Men Black Blue),,,
112.00 Dhs,Autre Women Sports Bra Underwear Black Lace Bandage Bra Thin Seamless Wire Bustier Brassiere Lingerie(4),,,
180.00 Dhs,Autre Women PlSize Sports Bra Shockproof Bra Zipper Fitness Yoga Bra Gym White Seamless High Impact Sports Bra Running(Black),,,
116.00 Dhs,Autre Women Sports mesh perspective stitching Yoga Bra Workout Tank Tops Stretch Seamless Racerback Padded Fitness Running vest(Black),,,
124.00 Dhs,Autre Female Yoga Fitness Breathable Comfort Sports Bra Shockproof Sports Underwear Quick drying Running Training Back cross(Pink),,,
114.00 Dhs,Autre NEW Womens Sport Bra Fitness Yoga Running Vest Underwear Padded Tops Underwear 7 Colors No Wire rim Bras Female(Purple),,,
214.00 Dhs,Autre U Type Women Push Up Seamless Sports Bra Workout Gym Fitness Running Bra Women's Yoga Bra Vest (caramel),,,
207.00 Dhs,Autre Women's Stretch Strappy Extreme Control Push Up Padded Racerback Running Workout Active Sports Bra(Purple),,,
83.00 Dhs - 84.00 Dhs,Fashion Shorts Sport Athletic Gym Workout Fitness Yoga Leggings,,(1),3 out of 5
110.00 Dhs - 123.00 Dhs,"Autre Quick Dry Sports Bra,Women Padded WireAdjustable Shakeproof Fitness Underwear,Push Up  Seamless Yoga Running Tops(Green)",,,
132.00 Dhs,Autre Women's Mesh Strappy Back Cami Crisscross Yoga Sports Bra(Black01),,,
139.00 Dhs,Autre Women Brassiere Yoga bh Sports Bra Padded Exercise Shockproof Seamless Push Up Gym Bra Fitness Quick Dry(Purple),,,
181.00 Dhs,Autre PlSize Women Zipper Sports Bra Underwear Shockproof Push Up Gym Fitness Athletic Running Yoga Bh Sport Bra 5XL(Classic Black),,,
121.00 Dhs,Autre Yoga Sports Bra Full Cup quick dry Shockproof Cross Back Push Up Workout Bra For women Gym Running Jogging Fitness Bra(green(with pad)),,,
130.00 Dhs,Autre Women Sports Bra Fitness Clothes Breathable Running Vest Mesh Patchwork Workout Tank  New Yoga Sport Bra( ),,,
144.00 Dhs,Autre Sports Bra for Fitness Women Push Up Cross Straps Yoga Running Gym Femme Padded Underwear Tops Female(Green),,,
243.00 Dhs,Autre Running Fitness Yoga Sports Bra Yoga Gym Bra Women Quick Dry Shirt Sleeveless High Stretch Breathable(Purple),,,
198.00 Dhs,Autre Spaghetti Straps Sports Bra Women High Impact Padded Yoga Bras Fitness Tops Sport Bh Workout Running Gym Brassiere(wine red),,,
225.00 Dhs,Autre Colorvalue Wireless Padded Yoga Fitness Tops Brassiere Women Spaghetti Strap Workout Sports Bras with Removable Pads(Dark Purple),,,
210.00 Dhs,Autre Female lulu style running yoga sports underwear gathered U shaped beauty back fitness bra Yoga GYM Sport naked Feeling (Dark red),,,
117.00 Dhs,Autre Women Workout Stretch Tank Yoga Padded Vest Sport Bra Tops Racerback Sports Bra(Pink),,,
166.00 Dhs,Autre Pink Pulling Rope Shockproof Sports Bra Gym Hoodie Yoga Running Bra Tops Women Fitness Sport with Hat Sujetador Bralet (Black),,,
113.00 Dhs,Autre Women Soft Sports Bra Yoga Fitness Stretch Workout Tank Seamless Padded Bra Higt Quality(Skin),,,
129.00 Dhs,Autre Women Yoga Bra Sport Bra PlSize Patchwork Gym Backless Cross Bra Padded Yoga Women Strips Cut Out Fitness Top(white),,,
162.00 Dhs,Autre Women Running Yoga Gym Fitness Front Zipper Bra Shakeproof Push Up Tank Racerback Padded Bicycle Bike Sports Bra(Red),,,
,,,,
,,,,
,,,,
,,,,
,,,,
,,,,
,,,,
,,,,
184.00 Dhs,Autre Women Mesh Push Up Sports Bra with pads Breathable Shockproof Fitness Yoga Bra for Running workout Vest Gym Sport Bra (White),,,
128.00 Dhs,Autre Women's Seamless Sports Bras Lace Cross Front Side Buckle Closure Yoga Bra Wireless Running Vest Gym Fitness Sports Top(Flesh),,,
111.00 Dhs,Autre Women Hollow Translucent Underwear Sheer Lace Frenum Strap Lingerie Sport Bras Tops#YL( ),,,
139.00 Dhs,Autre Women Brassiere Yoga bh Sports Bra Padded Exercise Shockproof Seamless Push Up Gym Bra Fitness Quick Dry(Green),,,
186.00 Dhs,Autre Selling Quick drying Sport Bra Wicking Running Yoga  Breathable underwear Black Blue Green Yellow Orange Gray Purple(23),,,
122.00 Dhs,Autre Absorb Sweat Quick Drying Sports Bra yoga fitness Vest jogging Wireless Running Underwear for Women no rims(Blue),,,
175.00 Dhs,Autre Women's Double Layer Crochet Mesh Padded WireYoga Sports Bra(Multicoloured03),,,
242.00 Dhs,"Autre PlSize 2XL 5XL Adjustable Zipper Sports Bra,Women Padded Push Up WireYoga Bra,Gym Running Fitness Sports Tops(1gray 1black 1rose)",,,
238.00 Dhs - 265.00 Dhs,Autre 2019 Sports Bra Lady New Style Breathable Quick Dry Sports bra Bodybuilding Bras 4 Way Stretch Fabric Running Bras(Light purple),,,
128.00 Dhs,Autre Absorb Sweat Women Athletic Running Sports Bra Gym Fitness Yoga Running Vest Underwear Padded Workout Sport Bra(Black),,,
120.00 Dhs,Autre Women Sports Bras Fitness Sports Bra Shockproof Shapes breathable Running Gym Adjustable Underwear push up Yoga Bra Top(blue),,,
223.00 Dhs,Autre Women Seamless Sports Bras Nepoa Gym Vrouwen Energie Shark Long Sleeve Seamless Sports Bra(Pink Grey Bottom),,,
216.00 Dhs,Autre Colorvalue Double Straps Yoga Sport Bras Women Shockproof High Fitness Workout Bras Plain Padded Running Gym Top(Lemon Yellow),,,
182.00 Dhs,Autre Seamless Sports Bra Running Back Cross Strappy Yoga Bra With Removable Pads Brassiere Sport Woman Fitness Activewear(army green),,,
256.00 Dhs,Autre Woman Yoga Sports Bra Push Up Running Sport Shockproof Breathable Gym Fitness High Stretch(Purple),,,
221.00 Dhs,Autre Fitness Sports Bra Women Gym Yoga Bra Tops Sportswear For Women Sport Push Up Brassiere Workout Fitness Padded Yoga  (Army green),,,
128.00 Dhs,Autre Women's Sports Bras Gym Fitness Irregular shoulder strap hollowed yoga sports vest Sport Bras  New female(Black),,,
122.00 Dhs,Autre 4 color high impact sports bra Athletic Running Gym Fitness Women Seamless Padded Vest M L XL(green),,,
191.00 Dhs,Autre Cross Sports Bra Seamless Fitness Women Yoga Push Up  Padded Shockproof Black PlSize Running Bra (Green),,,
164.00 Dhs,Autre Women Sports Bra WireZipper Padded Push Up Shockproof bar Yoga Running Croped Gym Athletic Underwear Girls Fitness Bras(Green),,,
117.00 Dhs,Autre Women's Sports Underwear Shock proof Yoga Gathering Bra Sports Workout Athletic Solid 2019(RD),,,
148.00 Dhs,Autre Brand Women Sports Bra High for Sporting Yoga Fitness Athletics Gym  Workout Bra Mesh Breathable (Black),,,
129.00 Dhs,Autre Ladies Sports Bra Padded Women Fitness Training Athletic Running Sports Bra Yoga Bra(white),,,
122.00 Dhs,Autre Outdoor Type Women Yoga Bra Fitness Seamless Racerback Padded Sports Bra Fitness Workout Bras(Lavender),,,
223.00 Dhs,Autre 2019 Women Camo Sports Bra High Impact for Fitness Yoga Running Pad Cropped SportsWear Tank Tops Sports Gym Bra Women(Purple),,,
189.00 Dhs,Autre Backless Push Up Sports Bra Fitness Women Seamless Gym Bra Padded Yoga Bra Sport bh Running Workout Active Wear(green),,,
215.00 Dhs,Autre Cross Back Padded Sports Tops Sport bh Push Up Shockproof Running Gym Yoga Bras White Shortened (white),,,
123.00 Dhs,Autre Women Girls Sports Bra Bras Large Sizes Good Female Breathable Push Up Seamless Underwear Brassiere Fitness Yoga Running(Khaki),,,
285.00 Dhs,"Autre PlSize XL 2XL Sports Bra,Padded WireRacerback Sport Brassiere,Woman High Impact Fitness Yoga Workout Sports Top(1blue 1white 1black)",,,
135.00 Dhs,Autre Sports Bra High Stretch Breathable Fitness Women Padded for Running Yoga Gym Seamless Bra Gradient Sport Bra(Sapphire Blue),,,
111.00 Dhs,Autre Stylish Gym Fitness Sports Bra Cotton Push Up Stretch Athletic Vest No Rims Breathable Full Cup Padded Bras PlSize Top(blue),,,
123.00 Dhs,Autre Women Sports Bra Underwear Yoga Push Up Shakeproof Vest Running Padded Workout Breathable Quick Dry Fitness Gym Tank Top(5),,,
128.00 Dhs,"Autre Dyed Zipper Sports Bra, Women Push Up Padded WireShockproof Gym Fitness Athletic Running Yoga Sports Tops 3 Colors(Rose)",,,
142.00 Dhs,"Autre 6 Colors Women Sports Bras, Push Up Padded Wire Shakeproof Running Athletic Gym Fitness Tops Sosten Deportivo(Flesh)",,,
122.00 Dhs,Autre Sports Bra Women Fitness Yoga Padded Push Up Breathable Gym Bra Sujetador Brasieres Deportivos Soutien Gorge Sport Top(Yellow),,,
113.00 Dhs,Autre High Quality Women Seamless Wire Padded Fitness Vest Tank Comfort Yoga Sport Bra sports bra plsize(Lavender),,,
111.00 Dhs,Autre Shockproof And No Steel Ring Sports Bra No Trace Large Size Vest Yoga Running Sleep Fitness Underwear For Women Tank Top(White),,,
135.00 Dhs,Autre Women Zip Front Sports Bra Wireless Post Surgery Active Yoga Sport Yoga Vest Running Yoga Gym Sport Tops(BU),,,
203.00 Dhs,Autre Women Yoga Bra Criss Cross Sports Bra Brassiere Sport Woman Fitness Gym Running Sport Bra Push Up(Red),,,
164.00 Dhs,Autre Women Sports Bra WireZipper Padded Push Up Shockproof bar Yoga Running Croped Gym Athletic Underwear Girls Fitness Bras(Black),,,
,,,,
,,,,
,,,,
,,,,
,,,,
,,,,
,,,,
,,,,
120.00 Dhs,Autre Sports Vest Beauty Back Sports Bra Shock Proof Gathering High Intensity Sport Bh Yoga Underwear Fitness Bra A06(Black),,,
205.00 Dhs,Autre Women Fitness Bras Sports Hollow Out Back Triangle Solid Color Push Up Yoga Bras Vest Running GYM Tops(Black),,,
169.00 Dhs,Autre Women Sports Push Up Sports Bra Padded Tank Tops High Impact Yoga Bras PlSize Vest Sweats for Running Gym Fitness(Black),,,
108.00 Dhs,Autre Summer Women Mesh Patchwork Sports Bra Tank Tops Bodycon Slim Gym Sports Clothing Bustier Vest Tops Bralette(Gray),,,
107.00 Dhs,Autre 2019 Summer Fitness Women's Lace Bandage Cutout Lingerie Sports Bras Elastic Bandage Bra Without Chest Pad(13),,,
128.00 Dhs,"Autre Women Sports Bra,Quick Dry Padded Shockproof Gym Fitness Running Yoga Sport Brassiere Tops(Random Color)",,,
120.00 Dhs,Autre 10 Colors No Wire rim Bras Female Running Fitness Yoga Seamless Push Up Women Sports Underwear PlSize Sports Vest XXL(Rose red),,,
180.00 Dhs,Autre Women PlSize Sports Bra Shockproof Bra Zipper Fitness Yoga Bra Gym White Seamless High Impact Sports Bra Running(Gray),,,
449.00 Dhs,"Reebok TEE-SHIRT D'ENTRAÎNEMENT POUR FEMME, BLEU",,,
123.00 Dhs,Autre Women Sports Bra Underwear Yoga Push Up Shakeproof Vest Running Padded Workout Breathable Quick Dry Fitness Gym Tank Top(7),,,
131.00 Dhs,Autre Men Slimming Vest Body Shaper Neoprene Abdomen Fat Burning Shaperwear Waist Sweat Corset Weight Slimming Belly Sportswear(Orange),,,
114.00 Dhs,Autre Sports Bras Women Seamless Padded High Impact for Yoga Workout Fitness Push Up Gym Vest(BU),,,
221.00 Dhs,Autre Fitness Sports Bra Women Gym Yoga Bra Tops Sportswear For Women Sport Push Up Brassiere Workout Fitness Padded Yoga  (Light Purple),,,
135.00 Dhs,Autre Quick Dry Padded Sports Bra Women Adjustable Fitness Sport Brassiere Push Up Seamless Running Yoga Bra Detachable New A30521(GN),,,
111.00 Dhs,Autre Women Seamless Bra With pads Big Size Push up Bras PlSize Underwear Vest Tops Wireless Padded Brassiere drop(Lavender),,,
124.00 Dhs,Autre Women Sports Bra Quick Dry Padded Shockproof Gym Fitness Running Yoga Sport Brassiere Tops 0(1),,,
177.00 Dhs,Autre Women Push Up Seamless Sports Bra Workout Female Sport Fitness Bh For Yoga Gym Brassiere Women's Sportswear(Red),,,
193.00 Dhs,Autre Seamless Racerback Sports Bra Women's Gym Yoga Running Boxing Active High Control Wireless Comfort Bra Large Size(Magenta Pink),,,
218.00 Dhs,Autre Female Fitness Yoga Bra Sports Bra Padded Print Batman Captain America Superhero Tank Tops Sport Bra for sports(Lavender),,,
186.00 Dhs,Autre Selling Quick drying Sport Bra Wicking Running Yoga  Breathable underwear Black Blue Green Yellow Orange Gray Purple(5),,,
198.00 Dhs,Autre Sports Bra For Women Fitness High Impact Yoga Bra Sport Shockproof Bra Cross Workout Gym Yoga Tops  Push Up Sportswear(Purple),,,
141.00 Dhs,Autre 2019 new fashion women Sports Bras Padded Seamless High Impact for Yoga Workout Fitness Yoga Sports bra underwear A30521(GY),,,
223.00 Dhs,Autre New Women Cross Design Sports Bra Push Up Shockproof Vest Tops with Padding for Running Gym Fitness Jogging Yoga Shirt(Black),,,
