price,product,product_information,sells,stars
64.99 Dhs,Tummy Trimmer Entrainement de abdominaux ,,(24),4.1 out of 5
99.00 Dhs,Sauna Sweat minceur perte  poids serre taille Gilet Corporel réglable,,,
98.00 Dhs - 98.99 Dhs,SWEAT SHAPER DÉBARDEUR POUR PERTE DE POIDS POUR HOMMES,,(39),4.1 out of 5
115.00 Dhs,"Bande de Resistance (le double de puissance soit 70 Kg au lieu de 35 Kg au même prix), Kit de 11 pièces pour exercice fitness gym yoga abs ou de pilâtes",,(6),4 out of 5
119.00 Dhs,Ensemble survêtement  Tshirt et pantalon NOIR 2021,,,
80.00 Dhs - 89.00 Dhs,Hot Shaper Gilet minceur pour femme,,(5),3.8 out of 5
128.99 Dhs,Iron Gym Barre Fix Barre Musculation Iron Gym,,(13),4.5 out of 5
84.99 Dhs - 98.00 Dhs,sweat shaper debardeur pour perte du poids original,,(19),3.6 out of 5
36.00 Dhs,CORDE A SAUTER - JUMPE ROPE AVEC COMPTEUR,,(4),1.5 out of 5
38.99 Dhs,1 paire bouchons d'oreilles souples de natation piscine Sport plage surf,,(8),3.3 out of 5
85.86 Dhs,Revoflex Xtreme Appareil de musculation  Revoflex Xtreme,,(30),4 out of 5
59.00 Dhs,BEAUTY BODY MOBILE GYM 6 PACK STIMULATEUR MUSCULAIRE - EMS GYM MOBILE,,(22),3.4 out of 5
680.00 Dhs,Ensembles Haltère Musculation kit 20 Kg plus la barre,,(4),4.3 out of 5
39.00 Dhs,2 Elastiques fitness MULTI FONCTION,,(10),3.4 out of 5
119.00 Dhs,Ensemble survêtement  Tshirt et pantalon NOIR 2021,,(2),2.5 out of 5
65.00 Dhs,Pakka Gants pour Musculation et cyclisme en Cuir et Daim - Noir,,(11),4.5 out of 5
82.99 Dhs,"Domyos TAPIS DE SOL STRETCHING  140CM X 50CM X 6,5MM",,,
54.00 Dhs,3 Elastiques fitness MULTI FONCTION,,(22),3.5 out of 5
130.00 Dhs,Ensemble de survêtement avec poches - Grona-,,(8),3.1 out of 5
279.00 Dhs,baseball batting New York black  red,,(16),4.4 out of 5
102.90 Dhs,"Smart fitness gear EMS 3 PIÈCE abdominaux, biceps, triceps...",,(19),3.3 out of 5
69.00 Dhs,Tummy Trimmer Entrainement de abdominaux .,,(3),4.3 out of 5
269.00 Dhs,Ensemble de survêtement avec poches 2021,,,
69.00 Dhs,Ceinture de sudation (Ventre plat),,(7),3.7 out of 5
58.00 Dhs,Headband Anti Rain Village - Bandeau PAIN - Naruto Shippuden - for Otaku Cosplay,,(2),3.5 out of 5
108.00 Dhs,"Tenue Fitness Soutien-gorge de fitness porter, leggings de yoga pour les femmes",,(2),4 out of 5
130.00 Dhs,GANTS DE BOXE HOMME ET FEMME RAMO jaune,,,
149.00 Dhs - 169.00 Dhs,"Gilet de Sudation Minceur Perte Poids ventre,  Ceinture Abdominale minceur homme",,(22),3 out of 5
85.00 Dhs - 449.00 Dhs,Pack de Disques D'haltère Musculation En Plastique à poignée Pour Remise en forme,,(2),4 out of 5
22.50 Dhs,Apparreil renforcement avant bras et relax - Noir,,(2),3 out of 5
39.00 Dhs,CORDE A SAUTER - JUMPE ROPE,,(13),4 out of 5
119.00 Dhs,Barre fixe permanente pour porte,,(5),3.6 out of 5
125.00 Dhs,Vibroaction La ceinture vibrante,,(45),3.8 out of 5
39.00 Dhs,Bsh Corde à Sauter PROFESSIONNEL Noir BSH,,(5),3.2 out of 5
58.89 Dhs,Tummy Trimmer Appareil d'entrainement les abdominal et les bras pour femmes et hommes,,(6),4.2 out of 5
96.00 Dhs,Roue Abdominaux Exercice AB Wheel,,(3),4.7 out of 5
199.00 Dhs,Ensemble De Survêtement Court Avec Angel Imprimé,,,
149.00 Dhs,As Seen On Tv 5 super Slim-Ceinture minceur et Massage avec 5 Moteurs,,(3),3.7 out of 5
140.00 Dhs,ensemble femmes gris sweat à capuche et jogging,,(2),3.5 out of 5
379.00 Dhs,Ulzzang Barre fixe OMISO 2021  BAR externe training multi fonction pull up,,(12),3.9 out of 5
,,,,
,,,,
,,,,
,,,,
,,,,
,,,,
,,,,
,,,,
549.00 Dhs,Support  de barre de musculation  omiso 2020 + squat (hauteur jusqu'a 160cm),,(2),3.5 out of 5
249.00 Dhs,Barre Fixe fitness,,(1),5 out of 5
119.00 Dhs,Alarme de pêche visuelle et Sonore LED détecteur morsure poisson canne a pêche.,,(2),5 out of 5
70.00 Dhs - 78.00 Dhs,Slim 'N Lift Débardeur Minceur  pour les hommes,,(2),4 out of 5
199.00 Dhs,Ensemble de survêtement avec poches,,(3),3.3 out of 5
138.00 Dhs - 149.00 Dhs,Newfeel Chaussure pour marche sportive gris Newfeel femme/homme,,(3),3.7 out of 5
65.00 Dhs,3 PIÈCES KIT BANDES ÉLASTIQUES EXERCICE SPORT YOGA,,(23),4.1 out of 5
33.99 Dhs,Bande élastique pour squat musculation sport fitness,,(9),4.2 out of 5
51.00 Dhs,Bandage MMA Pour Gant Boxe Boxing Boxeur Sac de Frappe Poignees  (noir),,(3),4.3 out of 5
95.00 Dhs - 99.00 Dhs,Débardeur Gainant Homme pour ventre plat - NOIR,,(6),4 out of 5
69.00 Dhs,"bande élastique Multi-usage (genouillère,chevillère,poignet,coude,jambe,mollet)",,(3),4.7 out of 5
399.00 Dhs,Barre fixe parallel,,(2),5 out of 5
195.00 Dhs - 199.00 Dhs,ensemble femmes Top rayé & Pantalon- noir-,,(1),4 out of 5
44.00 Dhs,Corde a Sauter  Gris - Jumpe Rope,,(1),4 out of 5
119.00 Dhs,Bande de Resistance  Kit de 11 pièces pour exercice fitness gym yoga abs ou de pilâtes,,(1),3 out of 5
297.00 Dhs,Kit Haltères 2pcs 7kg×2=14kg,,,
99.00 Dhs,résistance à 150 LBS - Kit de Bandes Élastique Fitness,,(14),3.4 out of 5
220.00 Dhs,Fashion Mens Outdoor Ankle Top Basketball Sneakers-Black White,,,
29.00 Dhs,Elastique fitness MULTI FONCTION,,(1),5 out of 5
138.00 Dhs - 139.00 Dhs,GANTS DE BOXE HOMME ET FEMME RAMO noir,,,
99.00 Dhs,Débardeur sweat shaper pour perte du poids Pour homme,,(6),4 out of 5
179.00 Dhs,Weekwiki Super Ensemble sport - Rouge-,,(62),3.2 out of 5
99.00 Dhs,Ballons gym Ball 65 cm  + pompe,,,
329.00 Dhs,Mikasa Ballon de Football Mikasa Original,,,
199.00 Dhs,Ensemble de survêtement à imprimé papillon avec cordon,,(2),4.5 out of 5
249.00 Dhs,Kit Haltères 2 pcs 5kg×2  = 10kg,,(15),4.7 out of 5
139.00 Dhs,Genouillère de sport rkba,,(2),4.5 out of 5
488.00 Dhs,Dynamic Haltère Musculation kit 20 Kg,,,
88.00 Dhs,Kalenji TSHIRT BLEU ANTI TRANSPIRATION HOMME,,,
215.00 Dhs,Myprotein Beurre de Cacahuète - Penaut Butter 1kg - ORIGINAL,,(16),4.6 out of 5
249.00 Dhs,Kappa Basket Running pour hommes sport,,(11),3.9 out of 5
64.99 Dhs,Knee Support - Genouillère pour se Débarrasser de la douleur( bande de genoux),,(4),4.3 out of 5
87.00 Dhs,5 Élastiques fitness MULTI FONCTION,,,
39.00 Dhs,Bande élastique de kinésiologie adhésive thérapeutique de sports 2.5cm x 5m,,(3),2.3 out of 5
99.00 Dhs,Ems Hips Trainer EMS Hip Trainer Buttocks Fitness Stick Muscle Stimulation Body Beauty Massager,,(3),2.7 out of 5
279.00 Dhs,"Sac de Frappe, Sacs de Boxe,  Musculation Fitness, Stress Relief Gym Equipment, Noir_125cmx 35cm +Bande de boxe",,(3),3.3 out of 5
249.00 Dhs,Kappa Basket Running pour hommes sport Noir,,(10),3.9 out of 5
179.00 Dhs,Ensemble de survêtement 2021 - NOIR,,,
149.00 Dhs,Hot Body Shapers pour Homme en Néoprène Minceur,,(2),2 out of 5
165.00 Dhs,Jeu de boxe Punching Ball pour enfants,,,
,,,,
,,,,
,,,,
,,,,
,,,,
,,,,
,,,,
,,,,
149.00 Dhs,Pantalons Minceur Thermo Sauna pour plus de Transpiration de fitness pour femme,,(18),4.6 out of 5
138.99 Dhs - 159.00 Dhs,Newfeel Chaussures footing marche sportive  3D permet une bonne aération de votre pied,,(3),5 out of 5
119.00 Dhs,Ensemble survêtement  Tshirt et pantalon NOIR 2021,,,
74.00 Dhs,La balle de vitesse de boxe peut améliorer la vitesse de réponse et la coordination de la main,,(8),3.6 out of 5
107.00 Dhs,Barre de Sport Réglable En Acier Barre D'entraînement,,(1),4 out of 5
75.00 Dhs,"Ceinture Abdominale en Néoprène – Gaine Amincissante Ventre Plat - ""STANDARD""",,(4),2 out of 5
69.00 Dhs,Women Hot Neoprene Body Shaper Slimming,,(1),1 out of 5
119.00 Dhs,"Dynamic Balle de GYM Gymball avec Pompe a Main Fitness , Yoga",,(7),4.9 out of 5
65.00 Dhs,Kipsta Ballon de Football first kick Taille 5,,(1),3 out of 5
50.00 Dhs,"YC Bande Support Stabilisateur Genoux genouillère orthese de genou pour douleur, entorse et soutien genoux",,(1),5 out of 5
119.00 Dhs,Barre fixe  permanente et multifonctionnelle pour porte,,,
84.80 Dhs,Appareil de musculation et d'entrainement abdominal originale,,(62),3.8 out of 5
32.00 Dhs,bande de résistance sport hommes femmes musculation yoga entraînement Fitness,,(1),5 out of 5
106.00 Dhs,Barre Fixe Multifonction de porte,,,
88.99 Dhs,Fitness Yoga Résistance Bandes Sport Body Latex Belt Strap Musculation,,(1),5 out of 5
270.00 Dhs - 290.00 Dhs,Survette  Longue,,(12),4.3 out of 5
"2,820.00 Dhs",Lvs ORBITRAC,,(8),4.4 out of 5
169.00 Dhs,Ensemble sweat à capuche et legging à imprimé graphique,,(22),3.5 out of 5
149.00 Dhs,Barre Fixe Multifonctions neuf sans emballage,,(16),4 out of 5
199.00 Dhs,Ensemble de survêtement avec bande,,(1),4 out of 5
230.00 Dhs,Fashion Unisex Basketball Shoes Outdoor Sports Sneakers-Black,,,
119.00 Dhs,Le Gilet Débardeur en Néoprène a forte compression et transpiraton - Perte de poids,,(5),3.6 out of 5
129.00 Dhs,Super Joggings Homme new collection 2020 - Noir,,(3),3.3 out of 5
179.00 Dhs,Weekwiki Top Survêtement Femme 2019 -Blanc-,,(8),3.5 out of 5
45.00 Dhs,Original Corde à sauter pour Fitness avec compteur à vitesse rapide réglable,,,
575.00 Dhs,Domyos kit Haltéres Musculation 20 kg avec une valise qui facilite le transport et le rangement,,(9),4.4 out of 5
99.00 Dhs,Mustad Couteau de pêche Multifonction 25cm Robuste chasse + Cache a canne file tresse,,(1),5 out of 5
79.00 Dhs,SPORTING 4 Disque Musculation 1 KG,,(1),5 out of 5
269.00 Dhs,Ensemble de survêtement avec poches 2021 - Beige -,,,
255.00 Dhs,Masque d'entraînement Résistance à l'oxygène de haute altitude Respiration Course à pied Jogging,,,
210.00 Dhs,Fashion Mens Outdoor Ankle Top Basketball Sneakers-Black White,,,
69.00 Dhs,10pcs Leurre pêche Crevette Mini 4cm hameçon crevette spinning surfcasting canne,,(3),4.3 out of 5
239.99 Dhs,KCASA X5 fois le rejet de la ceinture de massage minceur vibrations perte de poids graisse,,(2),5 out of 5
"3,799.00 Dhs",Majestic fitness Vélo Elliptique d'exercices d'appartement,,,
69.00 Dhs,Abdominal curl fitness équipement - bleu,,(1),3 out of 5
64.00 Dhs,Tummy Trimmer Appareil Abdominale Tummy,,(4),3.5 out of 5
178.00 Dhs,"Top Sport Tapis de Yoga et Fitness, Extra Epais 15mm, 180 x 60 cm abdo cardio musculation",,,
270.00 Dhs - 290.00 Dhs,Survette  Longue,,(13),4.4 out of 5
69.00 Dhs,Pakka Gant de gardien Pakka football - Vert,,,
185.00 Dhs,CEINTURE SPORT POUR PERDRE LE VENTRE ET LES GRAISSES HOMMES ET FEMMES ,,(2),4.5 out of 5
,,,,
,,,,
,,,,
,,,,
,,,,
,,,,
,,,,
,,,,
108.00 Dhs,Power bands resistance - LARAMODE,,(1),3 out of 5
64.00 Dhs,1 poignée _ Musclet de main-Hand grip-Éponge Poignée 5kg/60kg,,(1),2 out of 5
299.00 Dhs,Ulzzang Box support sac boxing bag wall OMISO 2021,,(3),3.7 out of 5
123.99 Dhs,Iron Gym Barre Fixe  de traction Multi Fonctions en métal,,(8),3.5 out of 5
130.00 Dhs - 150.00 Dhs,ensemble survêtement femmes  et pantalon de jogging,,(1),4 out of 5
124.00 Dhs,Gym ball - ballon de yoga - Ballon d'exercice -Silver,,(3),4 out of 5
69.00 Dhs,"SIBOTE Genouillère élastique en Nylon, genouillère de protection pour Fitness, équipement de protection, soutien de la rotule, pour sport, course à pied, basket-ball et volley-ball, 1 pièce",,(2),3 out of 5
19.80 Dhs,Corde athlétique main en bois pour sauter de fitness (1 pièce),,,
43.00 Dhs,Pakka Gants Musculation en laine peigné et cuir synthétique,,,
460.00 Dhs - 520.00 Dhs,Fashion Unisex Soccer Shoes Outdoor Football Sneakers-BLACK,,,
69.00 Dhs,3 Elastiques fitness MULTI FONCTION,,(2),1.5 out of 5
42.00 Dhs,bouchons de natation d'oreilles piscine plage city club surf sous marine plongée,,(69),3.7 out of 5
139.00 Dhs,Newfeel Chaussures femmes running footing sport de marche légère respirable,,,
299.00 Dhs,Haltéres Musculation 8 KG,,(2),5 out of 5
199.00 Dhs,GAINE AMINCISSANTE (SPORT SLIMMING BODYSUIT) Taille 'XL',,(1),4 out of 5
79.00 Dhs,SIT-UP outils d’exercice abdominaux réglables de 4 niveaux,,(1),4 out of 5
99.00 Dhs,Tummy Trimmer zia mall vous propose Rameur élastique Appareil Multifonction Ventre Action Musculation Entraînement,,(3),4 out of 5
99.99 Dhs,Live Up 1 paire de poids ajustables au poignet et à la cheville Wrap Strap Bandage,,(1),5 out of 5
159.00 Dhs,Genie Super Pack Pantalon jogging pour homme - noit et gris,,(4),4 out of 5
99.00 Dhs,Majestic fitness kit de Bandes Élastique Fitness Résistance -150 LBS en Total- 11 Pièces de Résistance,,(7),4.6 out of 5
219.00 Dhs,Nike BALLON DE FOOTBALL - BLANC,,(3),2 out of 5
159.00 Dhs,Genie Ensemble short t-shirt new collections - blanc,,(2),3.5 out of 5
51.00 Dhs,Bandage MMA Pour Gant Boxe Boxing Boxeur Sac de Frappe Poignees,,(2),2.5 out of 5
95.00 Dhs,1 pair de Poignet / Cheville Poids unisex de 1 KG - Bleu,,,
199.00 Dhs,Wydad Athletic Club - Flag Official - COLLECTOR - 83 Years - Limited edition,,(464),4.6 out of 5
145.00 Dhs,Appareil Multi-fonction 3 Exercices,,(15),4.1 out of 5
178.00 Dhs - 179.00 Dhs,"Corset, Débardeur, Sudation, Ceinture Minceur Abdo-minal pour Perte de Poids",,,
199.00 Dhs,Deux Mini Barres Altères Chromé,,(7),4.7 out of 5
145.00 Dhs,Gilet de sport d'entraînement amincit pour augmenter la transpiration - femme,,(13),4.2 out of 5
59.00 Dhs,SIBOTE cheville sangle de soutien unisexe sports d'exercice,,(1),5 out of 5
199.00 Dhs,support des disques de musculations à 3 tubes OMISO 2021,,(3),4 out of 5
158.96 Dhs,Iron Gym Barre Fixe de traction Multi Fonctions en métal,,(1),4 out of 5
229.00 Dhs,support des disques de musculations à 4 tubes OMISO 2021,,,
199.00 Dhs,Ensemble femme avec poche,,(15),3.8 out of 5
99.00 Dhs,Dynamic Matérielle ROUES à poussée 3 In 1 Multi function PUSH UP Bar,,(3),4.3 out of 5
149.00 Dhs,tracksuit ultimate sweat & jogger with tie,,(1),1 out of 5
35.00 Dhs,Paire de gants  Pro de musculation de haute qualité avec bande de poignet - bleu,,(2),4.5 out of 5
71.00 Dhs,Bandes Bandage MMA Pour Gant Boxe Boxing + Protège-dents (NOIR),,(2),3 out of 5
31.00 Dhs,Apparreil renforcement avant bras et relax deux pièces,,(11),4.3 out of 5
290.00 Dhs - 299.00 Dhs,Survette  Longue,,(6),4.5 out of 5
,,,,
,,,,
,,,,
,,,,
,,,,
,,,,
,,,,
,,,,
99.00 Dhs,Fitness exercices bandes de résistances,,(7),3.7 out of 5
113.00 Dhs,Das Gesunde Plus 3 PRODUITS: Vitamine Efervescente Vitamine C SANS SUCRE Mivolis,,(9),3.9 out of 5
50.00 Dhs,"YC Bande Support Stabilisateur Genoux genouillère orthese genou pour douleur, entorse et soutien genoux",,(1),3 out of 5
270.00 Dhs,Survette  Longue,,(12),4.7 out of 5
489.00 Dhs,Dynamic Haltère Musculation kit 20 Kg,,(35),3.7 out of 5
"1,960.00 Dhs",Majestic fitness 50 KG haltères chromé longs et Barres montables,,(1),4 out of 5
270.00 Dhs,Survette  Longue,,(3),3.3 out of 5
39.00 Dhs,Saibike Paire de Genouillère élastique Saibike HIGHT QUALITY,,,
289.00 Dhs,Vibro Shape Ceinture abdominale amincissant le corps et brûlant les graisses,,,
55.00 Dhs,Bande élastique de kinésiologie adhésive thérapeutique de sports 5cm x 5m,,(1),4 out of 5
129.00 Dhs,Autre 4 Colors Fishing Wobblers Electric Luminous Bionic Shrimp Shape Squid Saltwater Fishing Lures Crank Bait Fishing Tackle,,,
149.00 Dhs,Tracksuit hoodie & slim jogger with tie,,(3),4.3 out of 5
119.00 Dhs - 180.00 Dhs,SWEAT SHAPER DÉBARDEUR POUR PERTE DE POIDS POUR FEMMES,,(8),4.1 out of 5
36.00 Dhs,Paire de gants  Pro de musculation de haute qualité avec bande de poignet - bleu,,(1),5 out of 5
179.00 Dhs,Jeu de boxe Punching Ball pour enfants,,,
150.00 Dhs,Barre Fixe  Multi Fonctions en métal,,,
162.00 Dhs,Myprotein Cyclisme Homme Sport - Sculpt Seamless Tights - Cyclisme Original,,(1),4 out of 5
129.00 Dhs,Fox 40 Sifflet Fox 40 Epik CMG avec cordon (NOIR) professionnel original,,,
499.00 Dhs,Paire Haltéres Musculation plastifié 20 KG,,(2),4.5 out of 5
65.00 Dhs,Kinesiology Tape Bande Kiné 5m x 5cm - Ruban élastique pour le soutien des blessures sportives,,,
"1,686.00 Dhs",PEDALIER D 'EXERCICE,,(8),3.8 out of 5
195.00 Dhs - 199.00 Dhs,Ensemble femme sport avec bloc couleur,,(1),4 out of 5
320.00 Dhs,Mikasa SOCCER FOOTBALL - BALLON DE FOOT N 5 ORIGINAL,,(1),5 out of 5
177.00 Dhs,Myprotein L-Carnitine (90 COMPRIMÉS) Myprotein,,(1),3 out of 5
125.00 Dhs,Kit de Bandes Élastique Fitness Résistance -150 LBS/Kg 70 MAX,,(1),1 out of 5
35.00 Dhs,Pince à main Fitness musculation exercice main puissante Ressort poignée doigt,,(1),4 out of 5
899.00 Dhs,Dynamic Strong Delux Réglable Multi-Fonction Banc,,(7),4.4 out of 5
199.00 Dhs,Ensemble femme avec bande latérale,,(1),2 out of 5
199.00 Dhs,Ensemble de survêtement avec poches - Grona-,,(1),4 out of 5
200.00 Dhs,Bang Maillot  Officiel Pro Blanc Away - MAS,,(1),5 out of 5
564.00 Dhs,Domyos kit Haltéres Musculation 20 kg avec une valise qui facilite le transport et le rangement,,(5),4.8 out of 5
162.00 Dhs,2Pcs Outdoor Portable Martial Arts Metal Magic Pocket Bo Staff Performance Prop,,,
220.00 Dhs,"support sac de boxe،boxe, fitness, sports, support",,,
649.00 Dhs,Barre de Traction Fixation Murale,,(1),4 out of 5
183.00 Dhs,Jeu de boxe Punching Ball pour enfants,,(42),3.8 out of 5
199.00 Dhs,Ensemble femme avec poch devant 2021,,,
155.00 Dhs - 199.00 Dhs,Ensemble de survêtement Femmes molleton - noir-,,,
69.99 Dhs,Domyos PREMIUM POIGNÉE CONFORTABLE HAND-GRIP MUSCULATION AVANT BRAS RÉGLABLE de 10 à 40 kg,,(2),3.5 out of 5
75.00 Dhs,"Ceinture pour Hommes et Femmes, en Néoprène Perte de Poids Sauna Sweat",,(4),5 out of 5
67.00 Dhs,Boodun 1 pièces Billard Gants De Snooker Gants De Queue De Billard Pool Noir 3 doigts À Gauche,,,
,,,,
,,,,
,,,,
,,,,
,,,,
,,,,
,,,,
,,,,
92.00 Dhs,"Dm 3 PRODUITS Comprimés Effervescents Multivitamines, Multimineral, Vitamine C (SANS SUCRE) DM",,(3),5 out of 5
98.99 Dhs - 159.00 Dhs,Gilet de Sudation Minceur Perte Poids au Ventre pour Homme en Néoprène Noir,,(4),3.3 out of 5
179.00 Dhs,Door Mountend Exerciser Barre Fixe Multifonctions + 2 pince avant bras gratuit,,(1),2 out of 5
538.00 Dhs,Domyos Kit Haltères 20 Kg Musculation Valise Inclus Pour Rangement et Transport,,,
190.00 Dhs,"redresseur de genou pour les personnes âgées , l'escalier réduire 20kg de charge",,,
249.00 Dhs,Decathlon Bande élastique fitness pour maison,,(16),3.6 out of 5
179.00 Dhs,Foldable Push Up Board - Planche de traction 14 en1 support pour la musculation,,(1),5 out of 5
83.00 Dhs,SAUNA SUIT noir convient pour brûler des calories tout en faisant de l'exercice.,,(1),2 out of 5
95.00 Dhs,Grain de Sable T-SHIRT,,,
199.00 Dhs,Ensemble de survêtement,,(2),2 out of 5
119.00 Dhs,Domyos 2 BANDES DE RENFORT PROTÈGES POIGNETS GRIS MUSCULATION  PROFESSIONNELLE,,(2),5 out of 5
99.99 Dhs,liveupsports SAUNA SUIT,,(1),5 out of 5
227.00 Dhs,Kipsta Chaussure De Football Adulte Terrains Secs Agility 100 FG Adulte Noire,,,
170.00 Dhs,Ensemble de survêtement avec bande,,(1),1 out of 5
167.00 Dhs - 179.00 Dhs,Myprotein Pulle Sport MYPROTEIN - Haut zippé ¼ Pulle Manches Longues Performance,,(2),4 out of 5
199.00 Dhs,Pakka 2PCS Protège tibia De thai boxing et kick boxing pakka,,,
119.00 Dhs,Haltère pair de fitness gym à domicile 1 kg musculation aerobics,,(8),4.9 out of 5
168.00 Dhs,Kalenji Chaussures de sport homme Running Footing la Salle GYM Très légère,,(2),5 out of 5
25.00 Dhs,Bande d’exercice sport résistance fitness musculation yoga orange,,(2),5 out of 5
379.00 Dhs,"Barre de musculation, HulkFit Olympic  Lifting Trap Bar",,(2),4 out of 5
190.00 Dhs,PROTÈGE DENTS BADBREED,,(2),5 out of 5
129.00 Dhs,TAPIS DE SOL FITNESS TAPIS DE YOGA Tapis d'exercice 173 x 60 cm,,,
129.00 Dhs,Tapis de sol Yoga Sport gymnastique Fitness 173  x 61 cm,,,
"1,990.00 Dhs",Majestic fitness 1 kit/Mallette ensemble de 50 KG haltères chromé longs et Barres montables,,,
58.30 Dhs,Bsh Corde à Sauter PROFESSIONNEL BSH,,(15),3.9 out of 5
159.00 Dhs,Genie Ensemble De T-shirt En Blocs De Couleurs à Demi-Zip Et De Short à Cordon - Rouge,,(3),3.7 out of 5
169.00 Dhs,ensemble femmes gris sweat à capuche et jogging,,(2),4.5 out of 5
98.00 Dhs,Domyos 2 BANDES DE RENFORT PROTÈGES POIGNETS GRIS MUSCULATION SERRAGE VELCRO,,(2),5 out of 5
180.00 Dhs - 199.00 Dhs,Ensemble de survêtement Noir avec poche - 2021,,(1),1 out of 5
379.00 Dhs,Barre fixe de musculation 2021 robuste kapiko,,(2),3.5 out of 5
130.00 Dhs,bandes de résistance puissance 70kg 11 pièces,,(1),5 out of 5
175.00 Dhs,Ensemble de survêtement Femmes avec blocs de couleurs,,(1),4 out of 5
33.99 Dhs,Remplacement Lance-Pierres de chasse en Aluminium pour randonnée camping,,(3),4 out of 5
260.00 Dhs,Queue billard Snooker Jimmy White (1/2),,(3),5 out of 5
89.00 Dhs,sac de course poignet bande bras téléphones portables,,(2),3.5 out of 5
399.00 Dhs,Raja Black Jersey,,(19),4.4 out of 5
116.60 Dhs - 146.60 Dhs,As Seen On Tv Legging Minceur Hot Shaper 2019,,(4),2.5 out of 5
45.00 Dhs,Kinesiology Tape Rouleau Kinesiologie Tape Blue 5mx2.5cm Kinesiology Elastique Medical Tape Sport,,(1),4 out of 5
79.00 Dhs,gant musculation fitness,,(2),4 out of 5
169.00 Dhs,3 pièces Bandes de Hanche,,(2),4.5 out of 5
,,,,
,,,,
,,,,
,,,,
,,,,
,,,,
,,,,
,,,,
59.00 Dhs,Filet de pêche Cage de pêche résille conception cuivre Accessoires de Pêche,,(3),4.3 out of 5
181.00 Dhs,Nike Ballon de Football Nike,,,
198.00 Dhs,Molten Ballon Molten Basket-Ball,,(1),4 out of 5
69.98 Dhs,Tummy Trimmer Appareil d'entrainement Pour exercice et Fitness femme / homme,,(3),2.3 out of 5
199.00 Dhs,Kipsta BALLON DE BASKETBALL,,(1),4 out of 5
163.00 Dhs,Live Up Ballons gym Ball 75 cm  + gonfleur,,(2),4 out of 5
115.00 Dhs,Sauna Belt Ceinture Réglable Masseur Sauna Pour Perte De Poids et Brûle de Graisses,,,
229.00 Dhs,Step aerobic et fitness BLUE,,(2),3.5 out of 5
199.00 Dhs,Ensemble femme sport avec cagoule et capuche et poche devant,,(1),1 out of 5
71.50 Dhs,Corde à Sauter avec Compteur Automatique,,,
135.00 Dhs,PU Leather Boxing G L Ov Es Body Punch Bag Training Martial Art,,,
149.00 Dhs,Paire de genouillères de soutien articulaire,,,
339.00 Dhs - 400.00 Dhs,Barre Longue -,,(2),4 out of 5
185.00 Dhs,Myprotein Caféine Pure 200 Comprimés,,(14),4.2 out of 5
199.00 Dhs,Ensemble de bandes de résistance élastique avec poignées,,,
59.00 Dhs,100 pièces appât leurre souple de pêche Maritime Rivière...,,(6),3.7 out of 5
65.00 Dhs,Pakka Gants de Musculation original,,,
149.00 Dhs,Weekwiki New Ensemble sport - Rouge-,,(4),1.5 out of 5
200.00 Dhs,Fashion Chaussures de sport de grande taille pour baskets légères-Gris,,,
379.00 Dhs,Barre fixe de musculation 2021 robuste kapiko,,,
49.00 Dhs,CORDE À SAUTER CARDIO  DE VITESSE,,(2),4.5 out of 5
299.00 Dhs - 319.00 Dhs,Chaussure de football et de futsal pour gazon intérieur KELME Original,,(1),5 out of 5
299.00 Dhs - 319.00 Dhs,KELME Chaussure de football et de futsal pour gazon intérieur KELME Original,,(1),4 out of 5
199.00 Dhs,GAINE AMINCISSANTE (SPORT SLIMMING BODYSUIT) Taille 'M',,(2),3.5 out of 5
174.00 Dhs - 186.00 Dhs,Kalenji Chaussures de sport homme Running Footing la Salle GYM Très légère,,,
49.00 Dhs,Frisbee Ultime Disque Volant Enfants Adulte Jouer En Plein Air Soucoupe,,(4),4.5 out of 5
79.00 Dhs,Abdominal curl fitness équipement,,(1),5 out of 5
60.00 Dhs,Pakka Gants pour Musculation et cyclisme en Cuir et Daim - Bleu,,(1),5 out of 5
65.00 Dhs,Kinesiology Tape Bande 5m x 5cm - Ruban élastique pour le soutien des blessures sportives,,(3),3 out of 5
279.00 Dhs,Kipsta Chaussure De Football Adulte tout-terrain,,,
79.00 Dhs,SIBOTE ST-2502 Brace Protector Breathable Sport Tennis Cycling Knee Support Pad,,,
310.00 Dhs,Lixada Canne à pêche et moulinet Combo Canne à pêche,,,
48.00 Dhs,Aolikes 1 pièces coton élastique Bandage main Sport bracelet Gym soutien poignet attelle canal carpien,,(1),5 out of 5
223.00 Dhs,Nike Ballon de Football Nike,,(2),3 out of 5
199.00 Dhs,Ensemble de survêtement avec cordon,,,
155.79 Dhs,"2 pcs soutien rebond ressort Force ,professionnel protection sport genouillère",,,
249.00 Dhs,Step aerobic et fitness,,(6),3.8 out of 5
110.00 Dhs,SWEAT SHAPER Débardeur Polymère amincissement perte de poids Fitness Gym anti sueur entrainement bruleur de graisse pour femmes/ for women,,,
148.00 Dhs,Lot de 40 Plots original avec support de transport,,,
45.00 Dhs,Ceinture Amincissante De Sudation Discrète Homme/femme,,(1),1 out of 5
,,,,
,,,,
,,,,
,,,,
,,,,
,,,,
,,,,
,,,,
85.00 Dhs,Fitness Yoga Résistance Bandes Sport Body Latex Belt Strap Musculation,,,
60.00 Dhs,Pakka Gants pour Musculation et cyclisme en Cuir et Daim - Vert,,(1),5 out of 5
199.00 Dhs,Super Ensemble sweat à capuche 2021 - Noir,,,
200.00 Dhs,"Fashion Baskets légères de grande taille, chaussures de course de sport-noir",,(1),5 out of 5
39.60 Dhs,Joueur de basket pour enfantsBen Ten  accroché au mur 36 x 26 cm (1 pièce)-002,,(2),4.5 out of 5
125.00 Dhs,1 paire Barre de musculation I PUSH UP BAR,,(1),5 out of 5
168.00 Dhs - 179.00 Dhs,Kalenji Chaussures de sport homme Running Footing la Salle GYM Très légère,,,
109.00 Dhs,Canne à Pêche Télescopique - CAPERLAN ESSENTIEL-  180 cm,,,
145.00 Dhs - 159.00 Dhs,Newfeel CHAUSSURES MARCHE SPORTIVE HOMME PW 100 GRIS,,,
35.00 Dhs,Gold Bonnets de natation Bonnet de bain Élastique Silicone,,,
249.00 Dhs,Vibro shape Vibrations Chauffant Multifonctionnel Ceinture de Massage,,(7),4.1 out of 5
158.90 Dhs,11pcs/set Pull Rope ResFitness Exercises istance Bands Crossfit Latex Tubes Pedal Excerciser Body Training Workout Yoga,,,
199.00 Dhs,Pack Barre Fixe & AB Strap Pull UP,,(1),5 out of 5
21.17 Dhs,Sifflet d'arbitre (12 pièces) avec un fil de plusieurs couleurs,,(4),3.5 out of 5
223.00 Dhs,Nike Ballon de Football Nike,,(1),5 out of 5
36.00 Dhs,Gants de Sport - Bleu & Noir,,(3),2.3 out of 5
49.00 Dhs,100 pièces Hameçon à poisson de pêche en acier à haute teneur en carbone,,(1),2 out of 5
85.00 Dhs,"Tapis de Yoga de Sport  étirements noir 140cmx50cmx6,5mm",,(1),3 out of 5
170.00 Dhs,Ensemble de survêtement avec bande latérale,,(1),4 out of 5
199.00 Dhs,Fitness bandes de résistance élastique : 3 niveaux de résistance + pochette gratuite,,(5),4.4 out of 5
129.00 Dhs,Tapis de Sport,,(2),3 out of 5
259.00 Dhs,liveupsports GYM BALL,,(5),4.8 out of 5
588.00 Dhs,KIT HALTÈRES MUSCULATION 20 KG,,(1),5 out of 5
99.00 Dhs,Live Up Corde à sauter ajustable pour double dessous LIVE UP original,,,
98.00 Dhs,Ballon Gym 65 cm - Bleu,,,
