price,product,product_information,sells,stars
138.00 Dhs,"Beauty Body Smart Ceinture musculation électrostimulation EMS pour abdominaux,biceps,triceps",,(1),1 out of 5
25.00 Dhs,2 poignée _  Musclet de main-Hand grip-Éponge Poignée (Paire),,(4),3.8 out of 5
39.60 Dhs,Joueur de basket pour enfants accroché au mur 36 x 26 cm (1 pièce)-005,,(11),3.2 out of 5
88.00 Dhs,Roue abdominaux,,(1),3 out of 5
89.00 Dhs,Dymatize Nutrition Smart Shaker 500ML,,,
55.00 Dhs,Chaussettes de soutien magnétique du pied thérapie magnétique pied attelle de cheville,,,
69.50 Dhs,Women Hot Neoprene Body Shaper Slimming Waist Trainer Corset Slim Belt,,,
549.00 Dhs,Autre 10 Modes Electrotherapy Health Care Dual-Output Tens Unit Machine Pulse Electric Body Massager EMS Muscle Stimulator Pain Relief( ),,,
49.00 Dhs,Bouchons d'oreille en silicone de natation professionnel pour adulte - Jaune,,(2),3.5 out of 5
219.00 Dhs,"Pakka Gants de box, Kick kickboxing PAKKA rouge",,,
47.00 Dhs,"Appareil renforcement ajustable avant bras ""10-50Kg"" - Noir",,,
165.00 Dhs,"2 pcs soutien rebond ressort Force ,professionnel protection sport genouillère",,(1),1 out of 5
180.00 Dhs,"Compressport Headband, Compressport",,,
72.00 Dhs,3 PIÈCES KIT BANDES ÉLASTIQUES EXERCICE SPORT YOGA,,(1),5 out of 5
49.00 Dhs,BANDE ÉLASTIQUE PILATES ROSE,,,
45.00 Dhs,Bonnets de natation Bonnet de bain Élastique Silicone (noir),,,
48.99 Dhs,bande de résistance sport hommes femmes musculation yoga entraînement Fitness,,(8),4.1 out of 5
183.00 Dhs,Iron Gym Barre Fixe Iron Gym Total Entraînement Barre Porte De Traction Exercice de Force,,,
53.00 Dhs,CORDE A SAUTER PROFESSIONNEL,,,
189.00 Dhs,TARMAK BALLON DE BASKET BT100 ORANGE TAILLE 7,,(2),4 out of 5
197.55 Dhs,Sencor Balance individuelle SBS 113SL,,,
,,,,
,,,,
,,,,
,,,,
,,,,
,,,,
,,,,
,,,,
159.00 Dhs,poids et haltère pour fitness Domyos 1.5 KG,,(1),5 out of 5
159.00 Dhs,Legging Minceur Hot Shaper 2019 - بنطلون تنحيف,,,
235.00 Dhs,Quechua ROULEAU DE MOBILITE ET MASSAGE ROLLER SOFT,,(1),4 out of 5
383.00 Dhs,100pcs Self Adhesive Gel Electrode Pads For Electrical EMS Stimulator Tens Acupuncture Therapy Massager Slimming Massage Patch( ),,,
60.00 Dhs,Fox 40 Sifflet d'arbitre FOX40 classic jaune,,,
64.96 Dhs,Tummy Trimmer Appareil d'entrainement,,(1),4 out of 5
85.00 Dhs, ceinture Brûleur De Graisse,,,
69.00 Dhs,Proberos 100m Tresse de pêche file Robuste 0.20mm 9kg a canne leurre moulinet filet,,,
59.00 Dhs,Pakka Protège-tibias De Football Shin De Protection,,,
119.00 Dhs,Bandes Élastique Fitness Résistance - 5 couleur,,,
29.15 Dhs,"Titiz Bouteille d'eau et boissons 0,75 L",,,
219.00 Dhs,Northpacific KIT HALTÈRES MUSCULATION 10 KG,,(1),5 out of 5
249.00 Dhs,Ajuster alliage poignet orthèse bracelet poignet soutien poignet attelle Fractures,,,
189.00 Dhs,BARRE DE TRACTION MUSCULATION PULL UP BARS,,,
299.00 Dhs,Pakka Protège tibia de thaï-boxing et kickboxing full contact muay thai pakka original,,,
140.27 Dhs,Fitness Punching Tower Bag 160cm/5.2ft Inflatable Punching,,,
196.70 Dhs,Power knee support genou,,(1),3 out of 5
149.00 Dhs,Kit de Bandes Élastique Fitness Résistance -150 LBS/Kg 70 MAX,,(1),2 out of 5
139.00 Dhs,Domyos BANDE ÉLASTIQUE GLUTE BAND MUSCULATION FESSIERS LIGHT,,(1),5 out of 5
279.00 Dhs,Myvitamins ZMA 90 Gélules ZINC 20mg + MAGNÉSIUM 300mg + VITAMINE B6 7mg Myprotein,,(2),4.5 out of 5
60.00 Dhs,Universal Correcteur de posture et renfort dorsal,,(5),3.6 out of 5
149.00 Dhs - 199.00 Dhs,Slimming Hot Shaper Cami Hot For Women,,,
78.90 Dhs,"Domyos PREMIUM CORDE A SAUTER BLEU, GARANTIE 2 ANS",,,
149.00 Dhs,Revoflex Extreme,,,
79.00 Dhs,Ceinture de sudation et ventre plat,,,
91.00 Dhs,3-in-1 Multifunctional Wooden Chess Set Folding Chessboard,,,
239.00 Dhs,Domyos KETTLEBELL 4KG,,(1),5 out of 5
223.00 Dhs,Handheld Electronic Pulse Massager Electrotherapy Pain Management TENS/EMS Muscle Stimulator Acupuncture Neck Eletrode  Pads( ),,,
199.00 Dhs,Revoflex Xtreme Fitness Préparateur Abdominal ABS Kit De Formation Des Bandes De Résistance Exercice Multifonction Crossfit Exercice,,,
52.00 Dhs,Enrouleur de cerf-volant verrouillable avec ligne de vol de,,,
119.00 Dhs,"Muscletech shaker protein muscletech , masstech",,(1),4 out of 5
88.00 Dhs,Autre Réglable Paracord Bracelet Maker avec Cordons Bukles,,,
899.00 Dhs,Outshock CHAUSSURES DE BOXE ANGLAISE 500 LÉGÈRES ET FLEXIBLES,,,
280.00 Dhs,"Ceinture de perte de poids, ceinture de massage,vibration de perte de poids",,,
632.00 Dhs,Autre Optics 3D Eye Massager Restore Myopia Glasses EMS Acupressure Eye Care Head Massage Three months to restore 120 degree Vision( ),,,
247.00 Dhs,12 professional crampons,,,
79.00 Dhs,lunettes de protection totale vert,,(2),4 out of 5
699.00 Dhs,Domyos Gilet Lesté De Musculation Et Cross Training 10 Kg Homme Et Femme,,,
129.00 Dhs,"Mustad Pince de pêche Multifonction + monofilament 0,35 300M pour canne moulinet leurre",,,
95.00 Dhs - 125.00 Dhs,Pantalons Minceur Thermo Sauna pour plus de Transpiration de fitness pour femme,,,
,,,,
,,,,
,,,,
,,,,
,,,,
,,,,
,,,,
,,,,
139.00 Dhs,Pull Rope Fitness Exercises Resistance Bands Crossfit Latex,,,
59.00 Dhs,L'éponge d'aptitude sportive donne au promoteur de poignet de prise de force,,,
99.00 Dhs,Bsh Apparreil renforcement avant bras et relax deux pièces,,,
119.00 Dhs,Hot Shaper Gilet minceur pour femme,,,
169.00 Dhs,liveupsports Échelle d'entraînement,,,
101.00 Dhs,2/10PCS Massage Electrode Pads For EMS Tens Machine Massager 5 Styles Long-Life Head Electrode Lead Wires Cable Therapy Machine(2pcs 10x5cm),,,
29.00 Dhs,Jump Rope Corde à Sauter sportif junior,,,
143.99 Dhs,Barres d'entraînement horizontales réglables pour l'exercice aérobie,,(1),4 out of 5
269.00 Dhs,ensemble survêtement femmes - nouvelle collection 2021 - Noir,,,
43.00 Dhs,Bouchons d'oreille en silicone de natation professionnel pour adulte - Bleu,,(1),5 out of 5
197.99 Dhs,superbe jouet Jeu de boxe Punching Ball pour enfants,,,
150.00 Dhs,Northpacific Rouleau en mousse pour sport ,,,
114.00 Dhs,"liveupsports Balle de GYM Gymball  Fitness,Yoga - MAUVE-",,,
63.00 Dhs,Les boules de table de billard d&#39;enfants de 25MM / 38MM,,,
39.00 Dhs,Jindou bande élastique de soutien de coude bon Qualité 1 paire,,,
59.00 Dhs,Lampe De Poche Sous-Marine Torche Étanche Lampe De Plongée,,,
128.00 Dhs,Le véritable Minceur Shapers Pantalon Thermo Porter Capri courte perte de poids Shapers,,,
149.00 Dhs,Bombe de froid douleurs et soulagement Ice Spray 400 ML,,,
99.00 Dhs,Domyos Gant Musculation Domyos Originale,,(3),3.7 out of 5
88.00 Dhs,Roue abdominaux total body exerciser 2019,,(1),4 out of 5
178.00 Dhs,"Minceur Ceinture Vibrante,Brûler les Graisses,Perte Poids Massage Ceinture/Belt-Pour L'abdomen/Epaule/Cuisses/Jambes/Hanches/Dos Etc",,,
199.00 Dhs,Bestway Bateau pour plage ou piscine 2 Places +  Pompe a,,,
89.00 Dhs,Appareil de fitness pour les Bras,,,
99.00 Dhs - 127.00 Dhs,Hot Shaper Gilet minceur pour femme - New,,,
300.00 Dhs,Genres STEP AROBIC Étape d'exercice / d'entraînement avec des élévateurs,,,
99.00 Dhs,TAPIs DE SPORT ET YOGA FITNES 68/24 POUCE,,,
55.00 Dhs,Autre Genouillère Réglable Sports Baseball Football Randonnées,,,
55.00 Dhs,Musculation Main Hand Grip Exercice Portable Fitness Grip 10-40 Kg.,,(10),4.3 out of 5
39.00 Dhs - 149.00 Dhs,SPORT bandes de résistance Yoga gymnastique musculation bande de Fitness élastique en caoutchouc boucle de résistance Crossfit équipement d'exercice,,,
57.00 Dhs,Pakka BANDAGE POIGNEE 4.5 mètre POUR BOXE THAI-BOXING KICKBOXING noir,,,
99.00 Dhs,As Seen On Tv WONDER ARMS - Appareil De Musculation Pour Le Haut Du Corps,,,
56.00 Dhs,Kipsta Ballon de Football first kick Taille 5,,,
99.00 Dhs,Ballon De GYM 65 cm - Violet,,(4),3.5 out of 5
99.00 Dhs,Fitness Yoga résistance bandes santé élastique Sport Latex ceinture tirer Force bras cuisse,,,
215.00 Dhs,"Vibro Shape Ceinture Abdominale Amincissante, Vibrante et Massante ",,(1),3 out of 5
119.00 Dhs,liveupsports Training Set Resistance Tubes 3 Pc LIVEUP,,(1),5 out of 5
139.00 Dhs,Domyos HALTERE PVC 2 X 1 KG,,,
62.00 Dhs,Wake 31.8mm Potence En Alliage aluminium pour randonnée à vélo,,,
19.80 Dhs,Corde athlétique main en bois pour sauter de fitness (1 pièce),,(1),4 out of 5
322.00 Dhs,EMS Smart Feet Circulation Stimulator Massager Electric Massager for Foot Boost Circulation & Relief Aching Feet Legs Muscles(With Remote Control),,(1),5 out of 5
,,,,
,,,,
,,,,
,,,,
,,,,
,,,,
,,,,
,,,,
35.00 Dhs,Tennis Trainer Self-study Rebound Ball Baseboard with Ball,,,
135.00 Dhs,61cm Golf Swing Training Aid Trainer Strength Flexibility,,,
84.00 Dhs,Domyos SAC DE FITNESS PLIABLE 30L,,,
42.00 Dhs,Universal Folded Fishing Net Fish Shrimp Minnow Crab Baits Cast Mesh Trap New,,,
71.00 Dhs,General 3d sous pression Fitness course cyclisme Bandage genouillère,,,
105.00 Dhs,"Tenue Fitness Soutien-gorge de fitness porter, leggings de yoga pour les femmes",,,
101.00 Dhs,4pcs Replacement Standard Electrode Lead Wires Standard Pin Connection For Tens / Ems Machines( ),,,
63.00 Dhs,Pakka Gants Musculation et cyclisme pour hommes et femmes en Cuir et Daim - Gris,,,
34.00 Dhs,Autre Semaine pilule boîte 7 jours 14 grille portable pilule,,,
29.00 Dhs,Pakka BANDAGE POIGNEE POUR BOXE THAI-BOXING KICK-BOXING jaune,,,
49.00 Dhs,Hot-Shapers/Ceinture de transpiration saine,,,
79.00 Dhs,Kipsta BALLON DE BASKET ADULTE R100 TAILLE 7 ORANGE,,(1),4 out of 5
196.00 Dhs,Autre 1 Pcs Back Lumbar Support Belt Brace Four  Orthopedic Support Bars Waist Trainer Bodybuilding Waist Protector Health Care(Black),,,
212.00 Dhs,Autre Anneaux de gymnastique en bois de 28 mm / 32 mm Anneaux de,,,
45.00 Dhs,Cup's Balles de tennis x3,,(3),5 out of 5
69.00 Dhs,Royal Posture Une ceinture médicale pour le dos corset arrière pour redresser le dos S/M/L/XL,,(3),3.3 out of 5
162.00 Dhs,Lixada Running Exercise Weight Vest Fitness Tool Boxing Training,,,
79.00 Dhs,Kipsta Ballon De Football F100  Jaune,,,
123.00 Dhs - 129.00 Dhs,Débardeur d'entraînement pour le brûleur de graisse de ventre de perte de poids,,,
85.00 Dhs,Pakka Gants pour Musculation Noir,,,
75.00 Dhs,Heavy Duty Triceps Rope Attachment Cable Nylon Gym Fitness Training Cable Black,,,
99.00 Dhs,Heavy 5 Élastiques fitness MULTI FONCTION,,(1),5 out of 5
97.00 Dhs,Revoflex Appareil de musculation et Abdominaux bon qualite,,,
80.00 Dhs,Nabaiji FERMETURE PROTECTION PINCE NEZ DE NATATION FLOTTANT FACILE A RÉCUPÉRER BLEU CYAN,,,
174.00 Dhs - 189.00 Dhs,General Polaire Chasse- SOLOGNAC,,,
649.00 Dhs,Coffret D'haltères 20 KG avec valise Fitness Kit Haltéres Musculation,,(4),3.3 out of 5
118.00 Dhs,Northpacific pilates barre de gym multifonction fitness yoga corps sport ,,,
85.00 Dhs,ceinture de musculation  en Cuir,,,
39.00 Dhs,Ceinture Minceur,,(87),3.1 out of 5
30.00 Dhs,Pakka PROTEGE DENT POUR ART MARTIAUX POUR ADULTES,,(1),4 out of 5
37.00 Dhs,corde a sauter JUMP ROPE 3 M,,,
79.00 Dhs - 99.00 Dhs,Slim 'N Lift Original débardeur gainant pour hommes,,(1),3 out of 5
261.00 Dhs,EMS  Hips Trainer Remote USB Rechargeable Muscle Toner Stimulator Butt Toner Helps To Lift Shape and SlimMassage(Hiptrainer),,(1),5 out of 5
49.00 Dhs,BANDE ELASTIQUE TONIFICATION GYM,,,
44.00 Dhs,Northpacific BANDE ÉLASTIQUE PACK 3 Pièce 3 niveau de résistance MULTI FONCTION + un boite,,(4),4.3 out of 5
129.00 Dhs,Goalkeeper Gloves rouge pour football,,,
199.00 Dhs,Molten ballon Basket-ball extérieur en caoutchouc MOLTEN original,,,
189.00 Dhs,Molten ballon Basket-ball extérieur en caoutchouc MOLTEN original,,,
99.00 Dhs,Push Up Bars Plus - Multifonctions,,,
129.00 Dhs,Autre Lot de 6pcs Gilet Dossards d'entraînement,,,
,,,,
,,,,
,,,,
,,,,
,,,,
,,,,
,,,,
,,,,
349.00 Dhs,Barre Longue Musculation  professionnelle  185 CM,,(9),4.4 out of 5
61.00 Dhs,Kipsta Ballon de football F100 taille 3 (_INF_ 8 Ans) bleu,,,
670.00 Dhs,Executive golfset Ensemble Cadeau Mini Golf Ensemble Green avec Boîte En Cuir de Golf Putter,,,
89.00 Dhs,Bestway pack natation enfant Lunettes De Natation + tube plonger vert,,(1),1 out of 5
75.00 Dhs,Pakka 2x pièces Support de poignet gymnastique,,(1),4 out of 5
688.00 Dhs,Autre New Smart EMS Muscle Stimulator ABS Abdominal Muscle Toner Body Fitness Shaping Massage Patch Sliming Trainer Exerciser Uni(Option 03),,(1),5 out of 5
849.00 Dhs,Dynamic Siége de sport multifonctions,,(1),4 out of 5
134.00 Dhs,Smart EMS Trainer Electric Muscle Stimulator Abdominal ABS  Fitness Body,,,
35.00 Dhs,Corde à Sauter Fitness jaune haute résistance,,,
75.00 Dhs,Nabaiji BOUCHONS D'OREILLES NATATION THERMOPLASTIQUE MALLÉABLES BLEUS ET ROSES,,,
564.00 Dhs,kit de Musculation 20 kg haltere + boite de rangement,,(2),5 out of 5
234.00 Dhs,Ems Muscle abs Stimulator Abdominal Hip Trainer electric vibrate massager Weight Loss relaxation Body Slimming Belt Uni(Option 3),,,
49.00 Dhs,BANDE ELASTIQUE ELASTIBAND HARD FORTE RESISTANCE,,,
179.00 Dhs,Myvitamins Vitamine B - Mélange de huit vitamines B dans des Comprimés pratiques 120 TABLETS,,(2),4 out of 5
349.00 Dhs,Tefal Pese  personne TEFEL,,(1),5 out of 5
72.00 Dhs,liveupsports JUMP ROPE Pro PREMIUM SKIPPING EXERCISE,,,
149.00 Dhs,VibraTone Ceinture vibrante pour massage musculaire,,(1),3 out of 5
59.00 Dhs,Set de 2 Raquettes de Tennis de Table avec 3 Balles Ping-Pong,,,
128.50 Dhs,Ceinture de genou médicale,,,
39.00 Dhs,Protège-dents simple Shock Doctor,,,
108.00 Dhs,"liveupsports Hip Bande resistance gym et fitness Large (Bleu) - 17""",,(1),5 out of 5
89.00 Dhs,Decathlon BOUCHONS D'OREILLES NATATION FORME SAPIN EN SILICONE 3 TAILLES-MULTICOLORES,,(2),4 out of 5
145.00 Dhs,Barre fixe permanente pour porte,,,
42.00 Dhs,Artengo 6 BALLES DE TENNIS DE TABLE PING PONG,,,
38.00 Dhs,Gants de Musculation -Taille Standard,,(11),3.8 out of 5
136.00 Dhs,Tcetoctre Tennis Ball Singles Training Practice Balls Back Base Trainer Tools and Tennis- Blue,,(1),5 out of 5
149.00 Dhs,pantalon court du sport  Polymère Trainer  Sweat Shaper (femmes),,,
96.97 Dhs,Revoflex Xtreme Appareil abdominale Multi-Fonctions plus de 50 Exercices,,(12),3.8 out of 5
133.65 Dhs,Autocollant Football chaussures de foot Stickers décoration vinyle Déco stick N 140013,,,
99.00 Dhs,POIGNÉES POUR POMPE CROSSTRAINING PUSH UP BARS,,,
128.00 Dhs,Domyos Kit Halters 2 x 1.5kg,,,
139.00 Dhs,Myprotein Pure Caféine 100 tablets MYPROTEIN,,,
29.00 Dhs,Pakka BANDAGE POIGNEE POUR BOXE THAI-BOXING KICK-BOXING bleu,,,
139.00 Dhs,"Smart Ceinture musculation EMS pour abdominaux, biceps, triceps, cuisses, dos, épaules",,,
99.00 Dhs,Ceinture de course,,,
299.00 Dhs,Domyos Kit haltère courte poids barre disques fitness musculation biceps sport 10kg,,(5),3.8 out of 5
159.00 Dhs,Top Sport BALLON D’EXERCICES ET DE MASSAGE,,,
58.00 Dhs,Filet de crabe plié Crawdad Pêche à la pêche à la crevette,,,
99.00 Dhs - 129.00 Dhs,Nabaiji Maillot de bain de natation femme une pièce Heva bleu,,,
129.00 Dhs,5Pcs Leurre de pêche surface Popper 6.5cm 13g black bass brochet canne tresse file,,,
,,,,
,,,,
,,,,
,,,,
,,,,
,,,,
,,,,
,,,,
143.00 Dhs,Gants Boxing ramo noir,,,
199.00 Dhs,Jeu de boxe Punching Ball pour enfants Age 4+,,(1),5 out of 5
89.00 Dhs,Nabaiji Lunettes de Natation - SHARK BLUE- ( Haute Qualité ) - Réglable Double,,(1),5 out of 5
85.00 Dhs - 94.00 Dhs,Premium Ensemble de bandes élastiques Livepro Lot de bandes d'exercice le meilleur pour le fitness,,,
619.00 Dhs,"Masque d'entraînement 3.0 ORIGINAL MADE IN USA à élévation pour sports, fitness, musculation training mask",,,
99.00 Dhs,5 Élastiques fitness MULTI FONCTION,,(1),4 out of 5
88.00 Dhs,Kipsta Ballon de football Grande Taille 5 + 1 Aiguilles À Ballon,,,
198.00 Dhs,Pack of 60 Tennis Racket Grips Anti-skid Badminton Racquet,,,
585.00 Dhs,Autre Ultrasonic Cavitation Body Slimming  Machine (Ultrasound+EMS+ Infrared) Lipo Massager Anti Cellulite Fat Burner Therapy( ),,,
110.00 Dhs,As Seen On Tv Ceinture Raffermissante A Transpiration chauffante,,(1),3 out of 5
139.00 Dhs,Accessoire de renforcement musculaire professionnel pour pectoraux et bras,,(1),1 out of 5
197.00 Dhs,2 Mini Barres,,,
169.00 Dhs,Autumn Winter Warming Soft Pet Dog Bed Fleece Plush  Red {m},,,
199.00 Dhs,Vibroaction Masseur amincissant élimine les grosses cuisses,,,
135.00 Dhs,OR Worker Modification Upgrade Spring N-STRIKE ELITE STRONGARM Blaster Silver,,,
"1,870.00 Dhs",Trampoline gym pour le  Super  Fitness à la maison,,,
49.00 Dhs,BANDE ÉLASTIQUE PILATES,,(2),2.5 out of 5
199.00 Dhs,Protège cheville Pied Bandages,,(1),4 out of 5
153.90 Dhs,"Domyos HALTERES TONEDUMBELL 2*1.5 Kg BLEU,  gym à domicile",,,
165.00 Dhs,"Ems Hips Trainer Electrostimulateur des muscles, unisexe, pour Raffermir et Lever les Hanches",,(1),4 out of 5
95.00 Dhs,Revoflex Xtreme Materiel de musculation multifonction,,(31),4 out of 5
249.00 Dhs,Ceinture de massage minceur fitness électrique perdre du poids Vibrateur,,(1),5 out of 5
65.40 Dhs,1PC Adjustable Knee Patellar Tendon Support Strap Band Knee,,,
99.00 Dhs,SPORTING Disque Musculation 4 KG,,(1),5 out of 5
149.00 Dhs,L'échelle d'agilité 4 Metre,,(1),3 out of 5
209.00 Dhs,Lvs combinaison sauna,,(2),1 out of 5
59.00 Dhs,"2pcs Bande bandage boxe main 4m bleu taille unique bleu, Bandages de Poignet",,,
175.00 Dhs,Resistance 11pcs/set Pull Rope Fitness Exercises Resistance Bands Crossfit Latex Tubes Pedal Excerciser Body Training Workout Yoga,,(1),4 out of 5
105.00 Dhs,Roue Abdominal Exercice AB Wheel,,,
159.00 Dhs,"Pakka Pattes D'ours Courbées Carbone pour Boxe Anglaise, Kick-Boxing, Muay-Thai  ا",,(1),5 out of 5
104.00 Dhs,Autre Women Waist Trainer Corset Abdomen Slimming Body Shaper Sport Girdle Belt Exercise Workout Aid Gym Home Sports Daily Accessory(#black),,,
92.00 Dhs,Kipsta MAILLOT DE FOOTBALL ADULTE F100 NOIR,,,
99.90 Dhs,Ballon de Foot  Taille 5 -Jeu Sport Football - Soccer Fifa-,,,
139.00 Dhs,GAINE NOIRE REMONTE FESSES CEINTURE ET JAMBES SHORT,,,
199.00 Dhs,Pack : Roue Abdominal + Barre Fixe de porte ,,,
121.00 Dhs,Autre 1 Pair 8 Colors Travel Sickness Wrist Band Anti Nausea Boats Car Sea Plane Wristband anti motion sickness bracelet strap(Purple),,,
29.00 Dhs,1 pièce bande Genouillère élastique Sangle de genou,,(2),5 out of 5
159.00 Dhs,Lixada Lot de 3 culottes de compression pour hommes,,(1),5 out of 5
130.00 Dhs,Kids Adjustable Mini Basketball Set Indoor Net Hoop Ball Pump Sport Game Toy,,(1),5 out of 5
69.00 Dhs,Proberos 100m Tresse de pêche file Robuste 0.20mm 9kg a canne leurre moulinet filet,,,
,,,,
,,,,
,,,,
,,,,
,,,,
,,,,
,,,,
,,,,
79.00 Dhs,Dynamic PACK DE 3 de Bande Elastique Fitness Musculation - PACK de 3 Bandes,,,
129.00 Dhs,Autre Lot de 6pcs Gilet Dossards d'entraînement,,,
349.00 Dhs,Kit Haltères 2pcs 8Kg + 8Kg = 16Kg,,,
139.00 Dhs,Sperbe Pack Raquettes de ping pong avec 3 balles et filet,,,
39.00 Dhs,Jump Rope 2 Corde à Sauter sport Fitness junior confortable,,,
198.00 Dhs,Anneaux de gymnastique en bois de 28 mm / 32 mm Anneaux de,,,
63.00 Dhs,Portefeuille d'arbitres cartes d'avertissement de Football général de grande taille,,,
183.00 Dhs,Pakka LES PAO KICK BOXING / MUAI THAI PAKKA BLANC,,,
131.83 Dhs,2pcs Swivel Carabiner Clip 360° Rotatable Spinner Carabiner,,,
159.00 Dhs,"SPORTING Tapis de Yoga de Sport Gym Pilate Anti dérapant PROMO, Recommandé par OMS",,,
77.00 Dhs,Domyos SAC SPORT FITNESS CARDIO TRAINING PLIABLE AVEC POCHETTE 30L ROSE DOMYOS,,(2),4 out of 5
169.00 Dhs,Artengo Set de 2 Raquettes de Tennis de Table avec 6 Balles Ping-Pong,,(2),4.5 out of 5
119.00 Dhs,Revoflex Xtreme Double Roue Rouleau,,,
81.99 Dhs,Tummy Entrainement de abdominaux,,,
79.00 Dhs,2PCS Jig 8Hameçon Octagonal Préparation Pêche la Pelote PELOTA 11g Canne,,,
89.00 Dhs,15 Pcs Ver de pêche 14cm  leurre silicone appât marrin jumbo canne file moulinet,,(1),5 out of 5
799.00 Dhs,Elevation Training Mask 2.0 original Couleur Noir,,,
115.00 Dhs - 199.00 Dhs,"Gilet minceur Sauna ,Super Body ,Shaper Homme Polymère Prime Transpiration",,,
128.99 Dhs - 199.00 Dhs,GILET MINCEUR HOMME EN NEOPERENE A FORTE SUDATION,,(1),1 out of 5
279.00 Dhs,Barre de musculation zigzag,,,
177.00 Dhs,Barre fixe permanente pour porte maison,,,
35.00 Dhs,Bandes Bandage MMA Pour Gant Boxe Boxing Boxeur Sac de Frappe Poignees - Jaune,,,
67.00 Dhs,Pakka Gant de gardien de football - Orange,,,
69.00 Dhs,"Extenseur de poitrine, Sport en salle pour enfants, musculaire ajustable, 5 bandes de résistance",,(1),5 out of 5
65.00 Dhs,Trendy Handheld Anti Cellulite Full Body Massage Brush Slimming Beauty,,,
682.00 Dhs,Autre TENS/EMS Kegel Exerciser Pelvic Floor Muscle Vaginal Stimulation  Incontinence Improve Intimate Sensation CE( ),,(1),4 out of 5
190.00 Dhs,Ballon  foot N 5 Rouge,,,
499.00 Dhs,Ceinture Vibro Shape - حزام تخسيس البطن,,,
49.00 Dhs,Corde à sauter sportif haute résistance avec conteur numérique,,,
115.00 Dhs,Rafco Disque Musculation 5 KG,,,
74.97 Dhs,Appareil pour renforcer vos Abdos,,,
119.00 Dhs,Live Up POIDS POIGNET / CHEVILLE 1 KG,,,
99.00 Dhs,Tummy Trimmer Rameur élastique pour musculation Outil d'entraînement rapide du ventre plat homme femme,,,
123.86 Dhs,Fitness Punching Bag Inflatable Punching Tower Bag,,,
85.00 Dhs,17in Double Side Dartboard Professional Dart Board Game Set,,,
199.00 Dhs,Myvitamins Vitamine D3 360 GÉLULES,,(4),3.3 out of 5
66.00 Dhs,Universal Heavy Duty Weight Loss Slim Sweat Exercise Gym Fitness Sauna Suit Hoodie  3XL,,,
29.00 Dhs,Musculation Poignée Pince à main Fitness d'exercice main puissante Ressort poignée doigt,,,
319.00 Dhs,Myprotein Impact Whey Protein 1kg Chocolat Brownie - Whey Protéine,,,
85.00 Dhs,Ems Autocollant stimulation professionnel d'entraînement muscles abdominaux sans fil,,(1),1 out of 5
,,,,
,,,,
,,,,
,,,,
,,,,
,,,,
,,,,
,,,,
88.00 Dhs,Roue abdominaux total body exerciser,,,
134.99 Dhs,bandes de résistance puissance 70kg 11 pièces,,,
119.00 Dhs,Dynamic Poignées Polyvalentes De Cross Training Push Up Wheels,,(1),5 out of 5
40.00 Dhs,"Sac de tapis Yoga Portable multifonction, sac d'équipement, de gymnase, Durable, de haute qualité",,,
33.00 Dhs,Pakka Protège-dents simple - Pistache,,,
186.00 Dhs,Jeu de boxe Punching Ball pour enfants,,,
99.00 Dhs,Decathlon Compresse Pour Récupération Sportif Chaud / Froid Poche De Froid Anti Douleur et œdème,,,
99.00 Dhs,Boite 5 leurre de pêche Mini Crankbait 1.5g 3cm pour canne spinning surfcasting,,,
68.00 Dhs,Kipsta BALLON DE FOOTBALL TAILLE 5 TOUT TERRAIN TOUT AGE,,(1),4 out of 5
129.00 Dhs,Pack 11 Pièces bandes de résistance max 70kg,,,
72.00 Dhs,Tcetoctre 2Pcs 25mm Barbell Gym Weight Bar Dumbbell Lock Clamp Spring Collar Clips -Black,,(1),2 out of 5
125.00 Dhs,VibraTone Slimming Massage Belt,,(24),3.6 out of 5
239.00 Dhs,Decathlon Rouleau De Mobilité  Massage,,,
193.53 Dhs,Arsuxeo Men Reflective Cycling Jacket Breathable Long Sleeve,,,
89.00 Dhs,Bandage Support Wrap Tennis Basketball Boxing Thai Boxing Hand Ankle Brace Protector,,,
"1,560.00 Dhs",Kipsta But De Football Fun et sport  3m  x 2m,,,
56.00 Dhs - 64.00 Dhs,Pakka Paire de gants Pakka Pro de musculation de haute qualité,,(10),3.4 out of 5
99.00 Dhs,Set 2 disques de 2Kg Plastifié à poignées,,,
35.00 Dhs,Protect 2 PCS Protège-tibias De Football Shin De Protection+ Conseil,,,
79.00 Dhs,1 paire de bouchons d'oreilles souples de natation en Silicone imperméable,,,
181.00 Dhs,Gilet de pêche en plein air gilet de veste de pêche en,,,
319.00 Dhs,Domyos Haltère PVC 2 unités x 5 KG Domyos,,(3),5 out of 5
119.00 Dhs,Ceinture de Sudation Abdominale / Hbt Gear Waist Trimer,,,
141.13 Dhs,Mini Aluminium Pocket Pen canne à pêche +Reel pour les amateurs de pêche,,,
65.00 Dhs,Lot de 3 Crevette de pêche 3 couleurs 10 CM 6G leurre de pêche pour eau de mer.,,(5),4.4 out of 5
160.75 Dhs,1 Pair Power Lift Joint Support Knee Pads Brace Rebound Spring Knees Rehabilitation Tool,,,
97.00 Dhs,Roue de sport multi-fonction,,(2),4.5 out of 5
39.99 Dhs,Protège dents pour boxe-Multisport-noir,,,
968.00 Dhs,Dynamic Siège de sport multifonctions,,(1),3 out of 5
199.00 Dhs,"Minceur Ceinture Vibrante,Brûler les Graisses,Perte Poids Massage Ceinture/Belt-Pour L'abdomen/Epaule/Cuisses/Jambes/Hanches/Dos Etc",,(2),5 out of 5
119.00 Dhs,3d sous pression Fitness course cyclisme Bandage genouillère,,,
287.00 Dhs,Autre Figure 8 Weight Lifting Straps for Home Gym Powerlifting Fitness Pull up Deadlift Horizontal Bar Gripping Strength Wrist Support(Type B-Red),,,
89.00 Dhs,Leurre a bille Minnow 18cm 24g a Trois triplet pour peche a canne moulinet ,,,
253.00 Dhs,"Universal Women Sports Yoga Suit Three-piece Set Sportswear Fitness Coat Short Sleeve Trousers, Size: XXL(Orange+Black)",,,
59.00 Dhs,Combo Leurre de peche souple 7cm Avec Tête 10g + Corp offert a canne file,,,
47.00 Dhs,Decathlon BANDE ÉLASTIQUE SPORT EN LATEX,,,
454.00 Dhs,Portable 2.4 Inch LCD Fish Finder 240FT Depth Range Fishing Finder with Wired Sonar Sensor Transducer,,,
149.00 Dhs,Ceinture Robuste de taille Support pour canne a pêche Soulèvement  ,,(1),5 out of 5
82.00 Dhs,Kipsta PROTÈGE-TIBIAS DE FOOTBALL ADULTE F100 NOIR,,,
189.00 Dhs,Domyos HALTERES De Musculation BodyBuilding - Biceps 2 x 2 Kg,,(2),5 out of 5
,,,,
,,,,
,,,,
,,,,
,,,,
,,,,
,,,,
,,,,
99.00 Dhs,Caperlan 5Pcs Kit Cuillere de pêche tournante N°1 leurre a canne spinning file Spinner,,,
159.00 Dhs,AB Wheel Équipement d'exercice de toner de rouleau d'Ab à 3 roues pour les entraînements abdominaux de noyau et le réducteur de graisse de ventre,,(1),5 out of 5
39.00 Dhs,bouchons de natation d'oreilles piscine plage city club surf sous marine plongée noir,,(1),5 out of 5
126.99 Dhs,Dynamic Raquettes de ping pong avec 3 balles - Dynamic SERIE 8600D,,(1),5 out of 5
49.00 Dhs,Pakka BANDAGE POIGNE POUR BOXE THAI-BOXING KICK-BOXING,,,
99.00 Dhs,File de pêche Fluorocarbon 250m japan + 2 flotteurs offert a canne et leurre,,,
549.00 Dhs,Support  de barre de musculation  omiso 2020,,,
564.00 Dhs,Domyos kit Haltéres Musculation 20 kg avec une valise qui facilite le transport et le rangement,,(1),5 out of 5
66.00 Dhs,Tummy Trimmer Appareil abdominal,,(10),4.3 out of 5
